[
  {
    "url": "https://www.lorientlejour.com/cuisine-liban-a-table/1477552/les-maamouls-symbole-des-retrouvailles-en-famille-de-chef-amani.html",
    "title": "Les maamouls, symbole des retrouvailles en famille, de chef Amani",
    "chef_name": "Chef Amani, du Akkar à Sydney, en passant par Insta",
    "cuisine_type": "libanaise",
    "is_lebanese": true,
    "is_recipe": true,
    "category_canonical": "dessert",
    "difficulty_canonical": "facile",
    "tags": [
      "cuisine du moyen-orient",
      "recette libanaise",
      "dessert",
      "recette végétarienne",
      "cuisine méditerranéenne"
    ],
    "main_ingredients": [
      "semoule",
      "ghee",
      "datte",
      "noix",
      "pistache"
    ],
    "aliases": [],
    "search_text": "Les maamouls, symbole des retrouvailles en famille, de chef Amani Chef Amani, du Akkar à Sydney, en passant par Insta « Le maamoul est bien plus qu’un simple dessert : c’est un symbole de fête, de tradition et de retrouvailles familiales. À l’approche des fêtes, les maisons à travers le Moyen-Orient s’emplissent du parfum réconfortant du maamoul qui cuit, annonçant la joie des célébrations à venir. Qu’ils soient garnis de pistaches, de noix ou de dattes, ces biscuits délicieux sont appréciés de tous et chéris de génération en génération», explique Amani Khazaal Krayem. « L’art de préparer le maamoul varie d’un foyer à l’autre, chaque famille y ajoutant sa touche personnelle. Dans cette recette, je vous propose ma version simple et conviviale pour réaliser des maamouls », poursuit la cheffe, qui précise, sur son compte Insta, que cette recette est un « hit ». Les maamouls sont façonnés à l’aide de moules en bois traditionnels, ornés de motifs délicats, puis cuits jusqu’à obtenir une belle couleur dorée. Pour la pâte : 1 kg de semoule fine 250 g de grosse semoule (ferkha) 500 g de ghee ou beurre clarifié (Gold Medal ou autre) 200 ml d’eau de rose 50 ml d’eau de fleur d’oranger 100 g de sucre 1 c. à s. de levure instantanée Pour la farce aux dattes : 250 g de pâte de dattes ½ c. à s. de ghee 1 c. à s. d’eau de rose ½ c. à s. d’eau de fleur d’oranger Pour la farce aux noix : 250 g de noix hachées ¾ c. à s. de sucre ½ c. à s. de ghee 2 c. à s. de sirop de sucre 1 ½ c. à s. d’eau de rose ½ c. à s. d’eau de fleur d’oranger Pour la garniture à la pistache : 250 g de pistaches hachées ¾ c. à s. de sucre ½ c. à s. de ghee 1 ½ c. à s. de sirop de sucre 1 ¼ c. à s. d’eau de rose ½ c. à s. d’eau de fleur d’oranger Dans un grand bol, mettre le ghee et le pétrir avec les mains jusqu'à ce qu'il devienne pâle et mousseux. Ajouter le sucre, bien mélanger, puis verser lentement l'eau de rose et l'eau de fleur d'oranger tout en mélangeant. Ajouter la levure et incorporer la semoule petit à petit, en laissant la pâte l'absorber lentement. La semoule ayant besoin de temps pour absorber les liquides, il faut être patient lors de cette étape. Une fois l’ensemble bien mélangé, couvrir et laisser reposer la pâte pendant 1 heure à température ambiante. Si votre pièce est plus fraîche ou plus sèche, le repos peut prendre jusqu'à 2 heures. Pendant ce temps, préparer les garnitures. À l'aide d'un batteur sur socle ou de vos mains, mélanger la garniture aux dattes jusqu'à obtenir une texture lisse. Préparer les garnitures aux noix et aux pistaches dans des bols séparés, en mélangeant bien tous les ingrédients. Diviser la pâte en boules de 25 grammes chacune. La garniture aux pistaches peut peser 24 g pour s'adapter aux moules plus fins. Aplatir chaque boule de pâte, placer la garniture de votre choix au centre et refermer délicatement la pâte autour. S’assurer qu'elle est bien scellée. Tremper chaque boule garnie dans de la semoule fine avant de la presser dans le moule. Cela évite qu'elle ne colle et permet d'obtenir un résultat net. Si nécessaire, utiliser du film alimentaire ou une chaussette en nylon comme doublure. Pour les maamouls aux pistaches et aux noix, préchauffer le four à 200 °C en mode chaleur tournante. Pour les maamouls aux dattes, faire cuire à 210 °C en mode chaleur tournante. Faire cuire sur des plaques en aluminium (idéales pour une cuisson uniforme) sur la grille du milieu : 8 à 10 minutes pour les pistaches/noix ou jusqu'à ce qu'ils soient légèrement dorés. Les maamouls aux dattes doivent être bien dorés. À mi-cuisson, tourner la plaque à 180 degrés pour assurer un brunissage uniforme. Laisser refroidir pendant 5 minutes, puis transférer délicatement sur une grille. Une fois complètement refroidis, saupoudrer les maamouls aux noix et aux pistaches de sucre glace. Pas de sucre glace pour les dattes ! cuisine du moyen-orient recette libanaise dessert recette végétarienne cuisine méditerranéenne  semoule ghee datte noix pistache",
    "source": "olj",
    "raw_category": "dessert",
    "raw_difficulty": "facile",
    "raw_enrichment_present": true
  },
  {
    "url": "https://www.lorientlejour.com/cuisine-liban-a-table/1458417/une-soiree-tacos-au-poulet-comme-une-delicieuse-invitation-au-voyage.html",
    "title": "Les tacos au poulet, comme une délicieuse invitation au voyage",
    "chef_name": "Jaimee Lee Haddad, cheffe amateure",
    "cuisine_type": "mexicaine",
    "is_lebanese": false,
    "is_recipe": false,
    "category_canonical": "plat_principal",
    "difficulty_canonical": "facile",
    "tags": [
      "cuisine",
      "plat principal",
      "recette"
    ],
    "main_ingredients": [
      "poulet",
      "tortillas",
      "tomates",
      "oignons",
      "poivrons"
    ],
    "aliases": [],
    "search_text": "Les tacos au poulet, comme une délicieuse invitation au voyage Jaimee Lee Haddad, cheffe amateure  Pour le poulet : 1 kg de poitrine de poulet sans peau, coupée en tranches 1 cuillère à soupe de cumin en poudre 2 cuillères à café de coriandre en poudre 1 cuillère à soupe d’origan séché 3 gousses d’ail 1 cuillerée à soupe de paprika fumé 1 cuillerée à café de poivre noir Jus d’un citron Jus d’une orange 1 cuillerée à soupe de vinaigre de cidre de pomme Un gros oignon jaune, finement tranché 1 cuillerée à soupe d’huile d’olive Sel au goût Pour la « salsa » : 3 poivrons rouges, coupés en deux 1 à 4 piments rouges (selon votre tolérance aux épices), coupés en deux 4 grosses tomates rouges mûres, coupées en deux 1 gros oignon pelé, coupé en deux 4 gousses d’ail pelées ½ tasse de coriandre hachée ½ cuillère à café de poivre noir Le jus d’un citron Le jus d’une orange 1 cuillère à soupe de vinaigre blanc Sel au goût Garnitures, selon vos envies : Un bol de fromage blanc émietté Un bol d’oignons rouges émincés Un bol de jalapenos marinés en fines tranches Un bol de coriandre hachée Un avocat découpé en tranches Un bol de tomates en dés Quartiers d’un citron ou un lime Sauce piquante Un bol de labné ou de sour cream. 12 tortillas  cuisine plat principal recette  poulet tortillas tomates oignons poivrons",
    "source": "olj",
    "raw_category": "plat principal",
    "raw_difficulty": "facile",
    "raw_enrichment_present": true
  },
  {
    "url": "https://www.lorientlejour.com/cuisine-liban-a-table/1469756/su-beureg-maison.html",
    "title": "Le Su Beureg maison d'Aline Kamakian",
    "chef_name": "Aline Kamakian, cheffe engagée",
    "cuisine_type": "méditerranéenne",
    "is_lebanese": false,
    "is_recipe": true,
    "category_canonical": "plat_principal",
    "difficulty_canonical": "moyenne",
    "tags": [
      "recette arménienne",
      "recettes aline kamakian",
      "aline kamakian",
      "chef libanais",
      "recette végétarienne",
      "mezzé",
      "entrée"
    ],
    "main_ingredients": [
      "farine",
      "œufs",
      "fromage salé",
      "fromage tressé",
      "persil"
    ],
    "aliases": [],
    "search_text": "Le Su Beureg maison d'Aline Kamakian Aline Kamakian, cheffe engagée Aline Kamakian : «Su beuregest le nom turc de ce plat.Susignifie « eau »,beuregdésigne la pâtisserie : le nom fait référence au fait que les différentes couches de cette pâte sont bouillies dans l’eau. Le résultat ressemble à un millefeuille.Quand je voulais obtenir une faveur de ma mère, quand je voulais faire quelque chose qu’elle aurait très probablement refusé, je la soudoyais avec dusu beureg. 'Si tu me laisses jouer au basket, je te prépare unsu beureg.' Et quand j’en préparais un, elle prévenait mon père, qui ramenait ses invités spéciaux à la maison pour le dîner. » Pour la pâte : 600 de farine tamisée 6 œufs Une demi cuillère à soupe de sel Environ 125 g de farine supplémentaires pour fariner la table et étaler la pâte 30 g de beurre 70 g de graisse végétale (margarine par exemple) Pour la farce : 1 kg de fromage salé (de type Akkawi), râpé ou émietté 1 kg de fromage tressé (de type Majdoul), râpé ou émietté 1 cuillèresà soupe de piment rouge en poudre Un demi bouquet de persil finement haché  recette arménienne recettes aline kamakian aline kamakian chef libanais recette végétarienne mezzé entrée  farine œufs fromage salé fromage tressé persil",
    "source": "olj",
    "raw_category": "plat principal",
    "raw_difficulty": "moyenne",
    "raw_enrichment_present": true
  },
  {
    "url": "https://www.lorientlejour.com/cuisine-liban-a-table/1469763/viande-grillee-dourfa-et-aubergines-urfa-kebab.html",
    "title": "Viande grillée d’Ourfa et aubergines (Ourfa kebab) d'Aline Kamakian",
    "chef_name": "Aline Kamakian, cheffe engagée",
    "cuisine_type": "libanaise",
    "is_lebanese": true,
    "is_recipe": false,
    "category_canonical": "plat_principal",
    "difficulty_canonical": "moyenne",
    "tags": [
      "recette arménienne",
      "recettes aline kamakian",
      "aline kamakian",
      "chef libanais",
      "plat principal"
    ],
    "main_ingredients": [
      "aubergine",
      "agneau",
      "bœuf",
      "tomate",
      "piment"
    ],
    "aliases": [],
    "search_text": "Viande grillée d’Ourfa et aubergines (Ourfa kebab) d'Aline Kamakian Aline Kamakian, cheffe engagée Aline Kamakian et Barbara Drieskens : « Ourfa est une magnifique ville au cœur de ce qui fut autrefois la Cilicie. Sa citadelle surplombe la vieille ville, avec à ses pieds un parc verdoyant et, tout autour, des champs fertiles. Cette région bénéficie d’un climat idéal pour cultiver les fameux piments rouges, que l’on transforme en pâte séchée au soleil ou en flocons grillés. Mais Ourfa est surtout la ville des aubergines. Même au petit-déjeuner, on y mange du pain traditionnel avec une aubergine grillée, un peu de sel, et pour les amateurs de piquant, un piment grillé.Il n’est donc pas étonnant que le kebab d’Ourfa soit un plat à base de viande grillée et d’aubergines, préparé une fois les grillades terminées, puis mijoté pendant des heures sur les braises encore chaudes. On le sert le lendemain, réchauffé dans une sauce : la viande et les aubergines fondent littéralement en bouche. » Pour le kebab : 8 aubergines d’Ourfa, ou des aubergines longues et fines 4 tomates 4 piments verts forts 1 tasse de persil haché 1 gros oignon blanc, finement émincé 1 cuillère à soupe de sumac 200 g de poitrine d’agneau finement hachée 200 g de cuisse de bœuf finement hachée ½ cuillère à café de quatre-épices ½ cuillère à café de mélange sept épices 1 pincée de poivre noir 1 cuillère à café de sel 1½ cuillère à café de pâte de piment rouge fort 1 cuillère à café de pâte de poivron doux 2 petits oignons, très finement hachés Pour la sauce : 1 cuillère à soupe de concentré de tomate ½ cuillère à soupe de pâte de piment rouge 1 cuillère à café de sel 500 ml d’eau  recette arménienne recettes aline kamakian aline kamakian chef libanais plat principal  aubergine agneau bœuf tomate piment",
    "source": "olj",
    "raw_category": "plat principal",
    "raw_difficulty": "moyenne",
    "raw_enrichment_present": true
  },
  {
    "url": "https://www.lorientlejour.com/cuisine-liban-a-table/1463970/la-panade-daubergines-fattit-batinjane-a-la-tomate-et-au-basilic-de-liza.html",
    "title": "La panade d’aubergines (fattit batinjane) à la tomate et au basilic de Liza",
    "chef_name": "Liza Soughayar Asseily : un chef et un prénom",
    "cuisine_type": "libanaise",
    "is_lebanese": true,
    "is_recipe": false,
    "category_canonical": "mezze_froid",
    "difficulty_canonical": "facile",
    "tags": [
      "recette libanaise",
      "diaspora libanaise",
      "recette végétarienne",
      "entrée",
      "recette",
      "cuisine libanaise"
    ],
    "main_ingredients": [
      "yaourt",
      "vinaigre de vin",
      "eau",
      "ail",
      "tahiné",
      "tomates",
      "oignons",
      "basilic",
      "huile",
      "pain pita",
      "aubergines",
      "pignons de pin",
      "rumsteck",
      "gigot d’agneau"
    ],
    "aliases": [],
    "search_text": "La panade d’aubergines (fattit batinjane) à la tomate et au basilic de Liza Liza Soughayar Asseily : un chef et un prénom « Ce plat peut se préparer en mezzé ou en version végétarienne, classique, mais aussi en version revisitée avec du basilic. J’aime la façon de la présenter et surtout l’amour inconditionnel de nos clients pour ce plat. Je l’ai retiré de la carte parisienne pendant un mois, et c’était la révolution ! » assure Liza Soughayar Asseily.« Le Liban, c’est tout ce que j’aime. Cette diversité de choses et dans la cuisine, qui va des recettes les plus simples, comme les œufs au plat avec du sumac, jusqu’aux feuilles de vigne avec côtelettes, ou encore des plats comme le tajine de poisson aux pignons et oranges. Une cuisine qui va du street-food aux mezzés, en passant par les plats de fête, végétariens ou très carnivores. La cuisine libanaise est pour moi, et de loin, la meilleure cuisine au monde. Elle est saine avec tout genre de salades, des plats à l’huile, à la viande, au poulet », ajoute-t-elle. Sauce yaourt 600 gr de yaourt 5 cl de vinaigre de vin 30 cl d’eau 5 gr d’ail 25 gr de tahiné Sel. Tomates au basilic 400 gr de tomates 75 gr d’ail 400 gr de gros oignons 2 bottes de basilic 15 cl d’huile mixte Sel Poivre. Fritures Huile de friture 4 pains pita 800 gr d’aubergines Farine 50 gr de pignons de pin. Viandes 100 gr de rumsteck 200 gr de gigot d’agneau Sel Poivre.  recette libanaise diaspora libanaise recette végétarienne entrée recette cuisine libanaise  yaourt vinaigre de vin eau ail tahiné tomates oignons basilic huile pain pita aubergines pignons de pin rumsteck gigot d’agneau",
    "source": "olj",
    "raw_category": "mezze",
    "raw_difficulty": "facile",
    "raw_enrichment_present": true
  },
  {
    "url": "https://www.lorientlejour.com/cuisine-liban-a-table/1351172/le-angel-cake-de-carl-gerges.html",
    "title": "Le « Angel Cake » de Carl Gerges",
    "chef_name": "Carl Gerges, chef d'un jour",
    "cuisine_type": "méditerranéenne",
    "is_lebanese": false,
    "is_recipe": false,
    "category_canonical": "dessert",
    "difficulty_canonical": "facile",
    "tags": [
      "cuisine",
      "dessert",
      "recette",
      "recette végétarienne"
    ],
    "main_ingredients": [
      "blancs d’œufs",
      "sucre",
      "farine",
      "sel",
      "crème de tartre",
      "extrait de vanille",
      "framboises"
    ],
    "aliases": [],
    "search_text": "Le « Angel Cake » de Carl Gerges Carl Gerges, chef d'un jour « J'ai choisi de faire un Angel Cake parce que, en tant qu'architecte, il va sans dire que je suis obsédé par l'esthétique, et ce gâteau fait toujours sensation. Mes amis se moquent de moi parce que j'aime cuisiner, mais je déteste mettre le bazar dans ma cuisine, c'est un éternel dilemme. Avec ce gâteau, je trouve que chaque étape est belle, avec un minimum d'ingrédients. Il suffit de bons ustensiles de cuisine et d'un moule à gâteau Bundt. J'ai trouvé ce moule en cuivre art déco à Paris dans un magasin vintage, que j'ai hâte d'utiliser à chaque fois… Mon amie Nayla Audi (Oslo) est la reine de ce gâteau. Ma version est le résultat d'essais et d'erreurs… J’ai voulu rajouter plus de blancs d'œufs pour une teneur plus élevée en protéines, et très peu de sucre pour que le gâteau reste léger », explique Carl Gerges. 10 blancs d’œufs 230 g de sucre cristallisé 110 g de farine pour gâteaux ¼ de c. à. c de sel 1 et ½ c. à. s de crème de tartre (fine poudre blanche) 1 et ½ c. à. s d’extrait de vanille pur 1 barquette de framboises  cuisine dessert recette recette végétarienne  blancs d’œufs sucre farine sel crème de tartre extrait de vanille framboises",
    "source": "olj",
    "raw_category": "dessert",
    "raw_difficulty": "facile",
    "raw_enrichment_present": true
  },
  {
    "url": "https://www.lorientlejour.com/cuisine-liban-a-table/1360795/quand-la-pavlova-au-chocolat-rencontre-le-moscatel.html",
    "title": "Pavlova au chocolat (sublimée par le Moscatel)",
    "chef_name": "Chadi Hereiz, chef exécutif",
    "cuisine_type": "méditerranéenne",
    "is_lebanese": false,
    "is_recipe": true,
    "category_canonical": "dessert",
    "difficulty_canonical": "facile",
    "tags": [
      "recette",
      "dessert",
      "vin",
      "cuisine",
      "chocolat"
    ],
    "main_ingredients": [
      "blancs d'œufs",
      "sucre",
      "vanille",
      "vinaigre",
      "Maïzena",
      "crème liquide",
      "chocolat noir",
      "noisettes"
    ],
    "aliases": [],
    "search_text": "Pavlova au chocolat (sublimée par le Moscatel) Chadi Hereiz, chef exécutif Le choix de Château Ksara :« Avec la Pavlova au chocolat, nous vous proposons notre Moscatel, composé de deux cépages, le Muscat et le Gewurztraminer. Le Gewurztraminer donne des notes épicées de gingembre et poivre blanc ainsi que les fruits exotiques comme la mangue, le litchi et l’ananas. Le gingembre se marie bien avec la meringue et donne une longueur en bouche pour le vin et le dessert, ce qui fait durer plus longtemps le plaisir en bouche. Quant au muscat, de par sa structure fruitée (goyave, banane et poire Williams), il va à merveille avec le chocolat et le sucre. » Pour la meringue : 90 gr de blancs d'œufs (environ 3 blancs) 120 gr de sucre Les graines d’une demi-gousse de vanille 3 gr de vinaigre blanc 4 gr de Maïzena 1 pincée de sel. Pour la crème chantilly : 250 gr de crème liquide 70 gr de sucre glace Les graines de 1/2 gousse de vanille. Pour la sauce chocolat 300 gr de chocolat noir 54 % 500 ml d’eau 260 gr de crème liquide 80 gr de sucre. Pour le dressage : 1 l de glace au chocolat 100 gr de noisettes torréfiées.  recette dessert vin cuisine chocolat  blancs d'œufs sucre vanille vinaigre Maïzena crème liquide chocolat noir noisettes",
    "source": "olj",
    "raw_category": "dessert",
    "raw_difficulty": "facile",
    "raw_enrichment_present": true
  },
  {
    "url": "https://www.lorientlejour.com/cuisine-liban-a-table/1468906/kebbe-de-potiron.html",
    "title": "Kebbe de potiron",
    "chef_name": "Tara Khattar, cheffe et ambitieuse entrepreneuse",
    "cuisine_type": "libanaise",
    "is_lebanese": true,
    "is_recipe": true,
    "category_canonical": "mezze_froid",
    "difficulty_canonical": "facile",
    "tags": [
      "recette libanaise",
      "recette automne",
      "potiron",
      "plat principal",
      "mezzé",
      "chef libanais",
      "tara khattar",
      "cuisine libanaise"
    ],
    "main_ingredients": [
      "potiron",
      "boulgour",
      "oignon",
      "blettes",
      "cumin"
    ],
    "aliases": [
      "kebbé",
      "kebbe",
      "kibbe"
    ],
    "search_text": "Kebbe de potiron Tara Khattar, cheffe et ambitieuse entrepreneuse Tara Khattar : « C'est la recette idéale pour les végétariens, la favorite dans ma famille durant la saison des courges. Personnellement, j'adore la servir en apéritif et j'aime bien ajouter du piment dans la sauce : en général, j'ajoute un peu de sauce Sriracha pour un petit contraste avec le côté sucré de la courge. » Pour la farce : 1/2 oignon 1 botte de feuilles de blettes (ou d'épinards) 1/2 cuil. à café de sumac Huile d'olive Sel, poivre Pour les kebbés : 500 g de pulpe de courge en purée (potiron) 250 g de blé concassé (boulgour fin) 1/4 d'oignon blanc 1 cuil. à soupe de persil haché 3 cuil. à soupe de farine 1 cuil. à café de cumin en poudre 1/2 cuil. à café de cannelle V4 cuil. à café de muscade Sel, poivre Pour la friture : 11 d'huile type canola Pour la sauce 1 verre de pâte de sésame (tahiné) Le jus de 2 citrons jaunes 1 cuil. à café de sauce Sriracha (facultatif) 1 cuil. à soupe d'huile d'olive Sel  recette libanaise recette automne potiron plat principal mezzé chef libanais tara khattar cuisine libanaise kebbé kebbe kibbe potiron boulgour oignon blettes cumin",
    "source": "olj",
    "raw_category": "mezze",
    "raw_difficulty": "facile",
    "raw_enrichment_present": true
  },
  {
    "url": "https://www.lorientlejour.com/cuisine-liban-a-table/1346535/le-risotto-al-pesto-de-imad-afram.html",
    "title": "Le risotto al pesto de Imad Afram",
    "chef_name": "Imad Afram, chef consultant et blogueur passionné",
    "cuisine_type": "italienne",
    "is_lebanese": false,
    "is_recipe": false,
    "category_canonical": "plat_principal",
    "difficulty_canonical": "facile",
    "tags": [
      "recette",
      "cuisine méditerranéenne",
      "plat principal",
      "recette végétarienne"
    ],
    "main_ingredients": [
      "riz arborio",
      "parmesan",
      "basilic",
      "pignons",
      "ail"
    ],
    "aliases": [],
    "search_text": "Le risotto al pesto de Imad Afram Imad Afram, chef consultant et blogueur passionné  Pour le pesto 40g de parmesan 20g de pignons 1 gousse d’ail 40 feuilles de basilic 120 g d’huile d’olive extravierge Une pincée de sel. Pour le riz 1 oignon espagnol finement haché 200 g de riz arborio Un peu de vin blanc ou de vinaigre Du bouillon de poulet ou de légume 40 g de parmesan 60 g de beurre coupé en cubes Pour la garniture Câpres soufflées Huile d’olive Poivre noir Piment d’Espelette.  recette cuisine méditerranéenne plat principal recette végétarienne  riz arborio parmesan basilic pignons ail",
    "source": "olj",
    "raw_category": "plat principal",
    "raw_difficulty": "facile",
    "raw_enrichment_present": true
  },
  {
    "url": "https://www.lorientlejour.com/cuisine-liban-a-table/1478513/la-kebbe-nayye-et-glace-a-larak-du-chef-youssef-akiki.html",
    "title": "La kebbé nayyé et glace à l’arak du chef Youssef Akiki",
    "chef_name": "Youssef Akiki, chef aux multiples projets",
    "cuisine_type": "libanaise",
    "is_lebanese": true,
    "is_recipe": true,
    "category_canonical": "mezze_froid",
    "difficulty_canonical": "facile",
    "tags": [
      "recette libanaise",
      "recettes youssef akiki",
      "cuisine libanaise",
      "cuisine méditerranéenne",
      "entrée"
    ],
    "main_ingredients": [
      "viande d’agneau",
      "bourghol",
      "menthe",
      "oignon",
      "marjolaine",
      "poivron doux",
      "cannelle",
      "lait",
      "crème",
      "jaune d’œuf",
      "sucre",
      "arak"
    ],
    "aliases": [
      "kebbé",
      "kebbe",
      "kibbe"
    ],
    "search_text": "La kebbé nayyé et glace à l’arak du chef Youssef Akiki Youssef Akiki, chef aux multiples projets « C’est un plat que l’on peut consommer en entrée. Je l’ai choisi parce que c’est une recette purement libanaise, comme je les aime, et que je sers dans mon restaurant Brût, à Hrajel, mais avec untwist. De plus, j’aime la viande d’agneau, j’ai mon propre élevage. L’équilibre entre la tradition dans la préparation de la kebbé et l’utilisation de l’arak non pas comme une boisson qui accompagne le plat, mais comme une glace, m’a paru intéressant. La tradition oui, mais dans la modernité. » Pour la kebbé nayyé : 500 g de viande d’agneau hachée 100 g de bourghol (blé dur concassé) 25 g de menthe fraîche ½ petit oignon 10 g de marjolaine fraîche ½ c. à. c de poivron doux en poudre ½ c. à. c. de cannelle en poudre Pour la glace à l’arak : 1 verre de lait liquide 75 g de crème 1 jaune d’œuf (20 g) 1 c. à. s. de sucre 1 c. à c. de stabilisateur 2 c. à s. pleines d’arak 3 g de sel de Maldon. Bien mélanger en malaxant longuement tous les ingrédients ensemble. Lorsqu’une pâte homogène se forme, garder au frais. recette libanaise recettes youssef akiki cuisine libanaise cuisine méditerranéenne entrée kebbé kebbe kibbe viande d’agneau bourghol menthe oignon marjolaine poivron doux cannelle lait crème jaune d’œuf sucre arak",
    "source": "olj",
    "raw_category": "mezze",
    "raw_difficulty": "facile",
    "raw_enrichment_present": true
  },
  {
    "url": "https://www.lorientlejour.com/cuisine-liban-a-table/1452546/la-salade-de-nouilles-arc-en-ciel-une-ode-au-printemps-et-au-soleil.html",
    "title": "La salade de nouilles « arc-en-ciel » : une ode au printemps et au soleil",
    "chef_name": "Jaimee Lee Haddad, cheffe amateure",
    "cuisine_type": "méditerranéenne",
    "is_lebanese": false,
    "is_recipe": false,
    "category_canonical": "salade",
    "difficulty_canonical": "facile",
    "tags": [
      "cuisine méditerranéenne",
      "recette végétarienne",
      "recette vegan",
      "recette de carême",
      "entrée"
    ],
    "main_ingredients": [
      "pâtes spaghetti",
      "chou kale",
      "carottes",
      "concombres",
      "oignon rouge",
      "radis",
      "brocoli",
      "graines de sésame"
    ],
    "aliases": [],
    "search_text": "La salade de nouilles « arc-en-ciel » : une ode au printemps et au soleil Jaimee Lee Haddad, cheffe amateure Un professeur d’art, au lycée, me confiait un jour : « Je cuisine comme je peins, en utilisant toutes les couleurs de l’ arc-en-ciel. » Cette salade de nouilles rend hommage à cette philosophie. Les légumes qui la composent se déclinent plusieurs nuances de vert et différentes textures croquantes. Le plat gagne en légèreté grâce à une astuce qui permet de transformer de simples spaghettis en nouilles souples façon ramen. La sauce, d’un orange éclatant, évoque quant à elle la chaleur du soleil. Pour la salade : 1 paquet de pâtes spaghetti n°5 1 cuillère à café de bicarbonate de soude 1 cuillère à café de sel 1 cuillère à soupe d’ huile de sésame 10-15 feuilles de chou kale 2 cuillères à soupe de vinaigre 5 carottes moyennes, pelées 6 concombres moyens 1 oignon rouge 6 à 8 petits radis rouges 1 tête de brocoli 100 g de graines de sésame grillées. Pour la vinaigrette : 230 ml de vinaigre de pomme 3 gousses d’ail 1 carotte moyenne, pelée 1 cuillère à soupe de gingembre séché 1/2 cuillère à café de curcuma 1 cuillerée à soupe de paprika fumé 2 cuillères à soupe de ketchup 1 cuillerée à soupe de crème de sésame (tahini) 1 cuillerée à soupe de sauce soja 80 ml d’ huile de sésame 100 ml d’ huile d’ olive Sel  cuisine méditerranéenne recette végétarienne recette vegan recette de carême entrée  pâtes spaghetti chou kale carottes concombres oignon rouge radis brocoli graines de sésame",
    "source": "olj",
    "raw_category": "salade",
    "raw_difficulty": "facile",
    "raw_enrichment_present": true
  },
  {
    "url": "https://www.lorientlejour.com/cuisine-liban-a-table/1469769/compote-de-fruits-secs-epicee-khoshav.html",
    "title": "La compote de fruits secs épicée (Khoshav) d'Aline Kamakian",
    "chef_name": "Aline Kamakian, cheffe engagée",
    "cuisine_type": "libanaise",
    "is_lebanese": true,
    "is_recipe": true,
    "category_canonical": "dessert",
    "difficulty_canonical": "facile",
    "tags": [
      "recette arménienne",
      "recettes aline kamakian",
      "aline kamakian",
      "dessert",
      "chef libanais"
    ],
    "main_ingredients": [
      "pâte d’abricot",
      "abricots secs",
      "raisins secs",
      "pruneaux",
      "sucre",
      "amandes",
      "pignons de pin",
      "pistaches",
      "cannelle",
      "clous de girofle"
    ],
    "aliases": [],
    "search_text": "La compote de fruits secs épicée (Khoshav) d'Aline Kamakian Aline Kamakian, cheffe engagée Ce dessert se prépare en hiver avec les restes des fruits secs de la période du Nouvel An. 150 g de pâte d’abricot 150 g d’abricots secs 150 g de raisins secs 125 g de pruneaux 100 g de sucre 15 g d’amandes 15 g de pignons de pin 15 g de pistaches 1 bâton de cannelle ½ cuillère à soupe de clous de girofle  recette arménienne recettes aline kamakian aline kamakian dessert chef libanais  pâte d’abricot abricots secs raisins secs pruneaux sucre amandes pignons de pin pistaches cannelle clous de girofle",
    "source": "olj",
    "raw_category": "dessert",
    "raw_difficulty": "facile",
    "raw_enrichment_present": true
  },
  {
    "url": "https://www.lorientlejour.com/cuisine-liban-a-table/1468660/feves-a-lhuile-foul-akhdar-bi-zeit.html",
    "title": "Feves a lhuile foul akhdar bi zeit.html",
    "chef_name": null,
    "cuisine_type": null,
    "is_lebanese": false,
    "is_recipe": false,
    "category_canonical": "autre",
    "difficulty_canonical": "non_specifie",
    "tags": [],
    "main_ingredients": [],
    "aliases": [],
    "search_text": "Feves a lhuile foul akhdar bi zeit.html",
    "source": "olj",
    "raw_category": null,
    "raw_difficulty": null,
    "raw_enrichment_present": true
  },
  {
    "url": "https://www.lorientlejour.com/cuisine-liban-a-table/1459431/le-saute-de-beef-thai-au-basilic-le-depaysement-dans-un-bol-de-riz.html",
    "title": "Le saute de beef thai au basilic le depaysement dans un bol de riz.html",
    "chef_name": null,
    "cuisine_type": null,
    "is_lebanese": false,
    "is_recipe": false,
    "category_canonical": "autre",
    "difficulty_canonical": "non_specifie",
    "tags": [],
    "main_ingredients": [],
    "aliases": [],
    "search_text": "Le saute de beef thai au basilic le depaysement dans un bol de riz.html",
    "source": "olj",
    "raw_category": null,
    "raw_difficulty": null,
    "raw_enrichment_present": true
  },
  {
    "url": "https://www.lorientlejour.com/cuisine-liban-a-table/1460867/curry-de-legumes-au-roti-revisite-mais-tellement-bon.html",
    "title": "Curry de legumes au roti revisite mais tellement bon.html",
    "chef_name": null,
    "cuisine_type": null,
    "is_lebanese": false,
    "is_recipe": false,
    "category_canonical": "autre",
    "difficulty_canonical": "non_specifie",
    "tags": [],
    "main_ingredients": [],
    "aliases": [],
    "search_text": "Curry de legumes au roti revisite mais tellement bon.html",
    "source": "olj",
    "raw_category": null,
    "raw_difficulty": null,
    "raw_enrichment_present": true
  },
  {
    "url": "https://www.lorientlejour.com/cuisine-liban-a-table/1337931/la-manouche-une-galette-empreinte-de-gout-et-de-nostalgie.html",
    "title": "La manouche une galette empreinte de gout et de nostalgie.html",
    "chef_name": null,
    "cuisine_type": null,
    "is_lebanese": false,
    "is_recipe": false,
    "category_canonical": "autre",
    "difficulty_canonical": "non_specifie",
    "tags": [],
    "main_ingredients": [],
    "aliases": [],
    "search_text": "La manouche une galette empreinte de gout et de nostalgie.html",
    "source": "olj",
    "raw_category": null,
    "raw_difficulty": null,
    "raw_enrichment_present": true
  },
  {
    "url": "https://www.lorientlejour.com/cuisine-liban-a-table/1483994/entree-plat-dessert-decouvrez-nos-recettes-dautomne-signees-par-des-chefs-libanais.html",
    "title": "Entree plat dessert decouvrez nos recettes dautomne signees par des chefs libanais.html",
    "chef_name": null,
    "cuisine_type": null,
    "is_lebanese": false,
    "is_recipe": false,
    "category_canonical": "autre",
    "difficulty_canonical": "non_specifie",
    "tags": [],
    "main_ingredients": [],
    "aliases": [],
    "search_text": "Entree plat dessert decouvrez nos recettes dautomne signees par des chefs libanais.html",
    "source": "olj",
    "raw_category": null,
    "raw_difficulty": null,
    "raw_enrichment_present": true
  },
  {
    "url": "https://www.lorientlejour.com/cuisine-liban-a-table/1294765/les-courgettes-a-la-sauce-tomate-danissa-helou-et-sa-mere-loris.html",
    "title": "Les courgettes à la sauce tomate d’Anissa Helou et sa mère Loris",
    "chef_name": "Anissa Helou, chef tous azimuts",
    "cuisine_type": "méditerranéenne",
    "is_lebanese": false,
    "is_recipe": false,
    "category_canonical": "plat_principal",
    "difficulty_canonical": "facile",
    "tags": [
      "recette végétarienne",
      "recette vegan",
      "plat principal",
      "cuisine libanaise",
      "recette libanaise"
    ],
    "main_ingredients": [
      "courgettes",
      "tomates",
      "oignons",
      "ail",
      "menthe"
    ],
    "aliases": [],
    "search_text": "Les courgettes à la sauce tomate d’Anissa Helou et sa mère Loris Anissa Helou, chef tous azimuts Cette recette de courgettes, dont les secrets lui ont été soufflés par sa maman, est « facile, fraîche, et très méditerranéenne », assure Anissa Helou 600 gr de petites courgettes, coupées en deux dans la longueur 3 c. à soupe d’huile d’olive vierge 2 oignons moyens, coupés en deux en longueur et en lamelles fines 3 gousses d’ail, coupées en lamelles fines 600 gr tomates mûres, pelées et coupées en petits morceaux, ou l’équivalent en boîte Sel marin 1 c. à soupe de menthe séchée en poudre, ou de la menthe fraîche, ciselée finement  recette végétarienne recette vegan plat principal cuisine libanaise recette libanaise  courgettes tomates oignons ail menthe",
    "source": "olj",
    "raw_category": "plat principal",
    "raw_difficulty": "facile",
    "raw_enrichment_present": true
  },
  {
    "url": "https://www.lorientlejour.com/cuisine-liban-a-table/1450583/samboussek-et-samoussa-vegetaliens-des-delices-frits-revisites.html",
    "title": "Samboussek et samoussa végétaliens, des délices frits revisités",
    "chef_name": "Jaimee Lee Haddad, cheffe amateure",
    "cuisine_type": "libanaise",
    "is_lebanese": true,
    "is_recipe": true,
    "category_canonical": "mezze_froid",
    "difficulty_canonical": "facile",
    "tags": [
      "entrée",
      "cuisine du moyen-orient",
      "recette végétarienne",
      "gastronomie libanaise",
      "recette vegan",
      "recette de carême",
      "mezzé",
      "cuisine méditerranéenne"
    ],
    "main_ingredients": [
      "farine",
      "pommes de terre",
      "protéines de soja",
      "oignon",
      "ail"
    ],
    "aliases": [
      "samboussek",
      "samoussa"
    ],
    "search_text": "Samboussek et samoussa végétaliens, des délices frits revisités Jaimee Lee Haddad, cheffe amateure  Pour la pâte des samoussa et des samboussek : 4 tasses moyennes de farine tout usage 2 cuillères à café de sel 1/2 tasse moyenne d’huile végétale 1 tasse moyenne d’eau Pour la garniture des samoussa de pomme de terre : 4 pommes de terre de taille moyenne ½ tasse moyenne de petits pois surgelés 2 cuillères à soupe d’huile d’olive 1 oignon moyen finement haché 3 gousses d’ail finement hachées 1 cuillerée à soupe de gingembre séché 1 cuillère à soupe de cumin moulu 1 cuillère à café de coriandre moulue 1 cuillère à café de curcuma en poudre 1 cuillère à café de piment rouge en poudre ½ cuillère à café de poivre noir ½ cuillère à café de cannelle 1 cuillerée à soupe de ketchup 1 cuillère à café de jus de citron ¼ tasse de coriandre, de menthe ou d’aneth frais hachés Sel Pour la garniture des samboussek végétalien : 1 tasse moyenne de protéines de soja hachées 2 oignons blancs moyens, finement hachés 4 gousses d’ail, finement hachées 1/3 tasse d’huile d’olive 1 cuillère à soupe de concentré de tomates 2 cuillères à soupe de sauce soja 1 cuillère à café de poivre noir 1 cuillère à café de toutes les épices 1 cuillère à café de cannelle 1 cube de bouillon de légumes 3 cuillères à soupe de mélasse de grenade 4 oignons verts, hachés 2 courgettes finement hachées ½ tasse d’amandes effilées Sel  entrée cuisine du moyen-orient recette végétarienne gastronomie libanaise recette vegan recette de carême mezzé cuisine méditerranéenne samboussek samoussa farine pommes de terre protéines de soja oignon ail",
    "source": "olj",
    "raw_category": "mezze",
    "raw_difficulty": "facile",
    "raw_enrichment_present": true
  },
  {
    "url": "https://www.lorientlejour.com/cuisine-liban-a-table/1469085/foies-de-volaille-perles.html",
    "title": "Foies de volaille perlés",
    "chef_name": "Alan Geaam, chef étoilé",
    "cuisine_type": "libanaise",
    "is_lebanese": true,
    "is_recipe": false,
    "category_canonical": "plat_principal",
    "difficulty_canonical": "facile",
    "tags": [
      "recette libanaise",
      "alan geaam",
      "cuisine libanaise",
      "chef libanais",
      "plat principal",
      "mezzé"
    ],
    "main_ingredients": [
      "foies de volaille",
      "vinaigre blanc",
      "ail",
      "coriandre",
      "mélange sept épices libanais",
      "cannelle",
      "mélasse de grenade",
      "jus de citron",
      "grains de grenade",
      "huile d'olive"
    ],
    "aliases": [],
    "search_text": "Foies de volaille perlés Alan Geaam, chef étoilé  600 g de foies de volaille 600 ml de vinaigre blanc 2 gousses d'ail 15 g de coriandre 3 g de mélange sept épices libanais 1 g de cannelle en poudre 2 g de coriandre en poudre 20 g de mélasse de grenade 10 ml de jus de citron Grains de grenade Sel 30 ml d'huile d'olive  recette libanaise alan geaam cuisine libanaise chef libanais plat principal mezzé  foies de volaille vinaigre blanc ail coriandre mélange sept épices libanais cannelle mélasse de grenade jus de citron grains de grenade huile d'olive",
    "source": "olj",
    "raw_category": "plat principal",
    "raw_difficulty": "facile",
    "raw_enrichment_present": true
  },
  {
    "url": "https://www.lorientlejour.com/cuisine-liban-a-table/1484500/les-crevettes-guacamole-a-la-libanaise-de-liza-asseily-1.html",
    "title": "Les crevettes guacamole a la libanaise de liza asseily 1.html",
    "chef_name": null,
    "cuisine_type": null,
    "is_lebanese": false,
    "is_recipe": false,
    "category_canonical": "autre",
    "difficulty_canonical": "non_specifie",
    "tags": [],
    "main_ingredients": [],
    "aliases": [],
    "search_text": "Les crevettes guacamole a la libanaise de liza asseily 1.html",
    "source": "olj",
    "raw_category": null,
    "raw_difficulty": null,
    "raw_enrichment_present": true
  },
  {
    "url": "https://www.lorientlejour.com/cuisine-liban-a-table/1290437/la-kebbe-aux-noix-et-aubergines-de-nayla-et-sabine-kassouf.html",
    "title": "La kebbe aux noix et aubergines de nayla et sabine kassouf.html",
    "chef_name": null,
    "cuisine_type": null,
    "is_lebanese": false,
    "is_recipe": false,
    "category_canonical": "autre",
    "difficulty_canonical": "non_specifie",
    "tags": [],
    "main_ingredients": [],
    "aliases": [],
    "search_text": "La kebbe aux noix et aubergines de nayla et sabine kassouf.html",
    "source": "olj",
    "raw_category": null,
    "raw_difficulty": null,
    "raw_enrichment_present": true
  },
  {
    "url": "https://www.lorientlejour.com/cuisine-liban-a-table/1469013/mouloukhiye-ragout-de-corete-au-poulet-et-au-boeuf.html",
    "title": "La Mouloukhiyé (ragoût de corète au poulet et au boeuf) de Tara Khattar",
    "chef_name": "Tara Khattar, cheffe et ambitieuse entrepreneuse",
    "cuisine_type": "libanaise",
    "is_lebanese": true,
    "is_recipe": true,
    "category_canonical": "plat_principal",
    "difficulty_canonical": "moyenne",
    "tags": [
      "recette libanaise",
      "recettes tara khattar",
      "tara khattar",
      "plat principal",
      "chef libanais",
      "cuisine libanaise"
    ],
    "main_ingredients": [
      "feuilles de corète",
      "poulet",
      "viande de bœuf",
      "riz",
      "oignons"
    ],
    "aliases": [],
    "search_text": "La Mouloukhiyé (ragoût de corète au poulet et au boeuf) de Tara Khattar Tara Khattar, cheffe et ambitieuse entrepreneuse Tara Khattar : « La mouloukhiyé (qui signifie « royale » en arabe) est un plat libanais d'origine égyptienne. Dans sa version libanaise, on la sert avec du riz, de la viande, du poulet, des oignons marinés dans du vinaigre et du pain pita grillé, mais vous pouvez opter pour du bouillon de viande ou de poulet uniquement. » 1 kg de feuilles de corète fraîche (ou congelée) 1 botte de coriandre 1 cuil. à soupe de beurre fondu 1 poulet entier 500 g de viande de bœuf coupée en cubes 2 bâtons de cannelle 2 feuilles de laurier 2 carottes 1/2 citron 2 petits oignons 3 gousses d'ail 2 pains pita 1/2 cuil. à café de bicarbonate de soude Le jus de 2 citrons Sel, poivre Pour les oignons marinés dans du vinaigre 40 cl de vinaigre de raisin 1 bel oignon 500 g de riz blanc  recette libanaise recettes tara khattar tara khattar plat principal chef libanais cuisine libanaise  feuilles de corète poulet viande de bœuf riz oignons",
    "source": "olj",
    "raw_category": "plat principal",
    "raw_difficulty": "moyenne",
    "raw_enrichment_present": true
  },
  {
    "url": "https://www.lorientlejour.com/cuisine-liban-a-table/1335327/pour-lamour-du-maamoul-de-generation-en-generation.html",
    "title": "Pour lamour du maamoul de generation en generation.html",
    "chef_name": null,
    "cuisine_type": null,
    "is_lebanese": false,
    "is_recipe": false,
    "category_canonical": "autre",
    "difficulty_canonical": "non_specifie",
    "tags": [],
    "main_ingredients": [],
    "aliases": [],
    "search_text": "Pour lamour du maamoul de generation en generation.html",
    "source": "olj",
    "raw_category": null,
    "raw_difficulty": null,
    "raw_enrichment_present": true
  },
  {
    "url": "https://www.lorientlejour.com/cuisine-liban-a-table/1295452/la-tarte-aux-citrons-de-raja-farah.html",
    "title": "La tarte aux citrons de Raja Farah",
    "chef_name": "Raja Farah, pâtissier passionné",
    "cuisine_type": "méditerranéenne",
    "is_lebanese": false,
    "is_recipe": true,
    "category_canonical": "dessert",
    "difficulty_canonical": "facile",
    "tags": [
      "dessert",
      "cuisine méditerranéenne"
    ],
    "main_ingredients": [
      "farine",
      "beurre",
      "sucre",
      "œufs",
      "jus de citron"
    ],
    "aliases": [],
    "search_text": "La tarte aux citrons de Raja Farah Raja Farah, pâtissier passionné « J’ai choisi la tarte au citron parce que c’est un de mes grands succès en pâtisserie, qu’elle est facile à faire, belle à voir, et que c’est une recette intéressante et une belle expérience gustative qui se passe en plusieurs étapes et à différents niveaux : la fraîcheur de la crème, le croustillant de la base puis les morceaux de citron qui éclatent en bouche », explique Rajah Farah. Pour la pâte sablée : 250 g de farine 2 g de corn flour 125 g de beurre 125 g de sucre glace 1 œuf Pour la crème de citron : 210 g de jus de citron 3 g de zeste de citron 300 g de sucre 20 g de corn flour (fécule de maïs) 4 œufs 180 g de beurre  dessert cuisine méditerranéenne  farine beurre sucre œufs jus de citron",
    "source": "olj",
    "raw_category": "dessert",
    "raw_difficulty": "facile",
    "raw_enrichment_present": true
  },
  {
    "url": "https://www.lorientlejour.com/cuisine-liban-a-table/1482770/le-tiramisu-au-cafe-de-charles-azar.html",
    "title": "Le tiramisu au café de Charles Azar",
    "chef_name": "Charles Azar, la pâtisserie sous toutes ses formes",
    "cuisine_type": "italienne",
    "is_lebanese": false,
    "is_recipe": false,
    "category_canonical": "dessert",
    "difficulty_canonical": "facile",
    "tags": [
      "recette végétarienne",
      "chef libanais",
      "charles azar",
      "recettes charles azar",
      "dessert"
    ],
    "main_ingredients": [
      "biscuits à la cuillère",
      "mascarpone",
      "jaunes d’œufs",
      "sucre",
      "crème",
      "rhum",
      "café",
      "cacao"
    ],
    "aliases": [],
    "search_text": "Le tiramisu au café de Charles Azar Charles Azar, la pâtisserie sous toutes ses formes Le tiramisu évoque la chaleur du café et le plaisir du partage. Il s‘agit d’un dessert universel, mais qui rappelle aussi les premiers souvenirs gourmands que nous créons à The Chase. Ce dessert fait partie des souvenirs de la belle époque du restaurant que nous souhaitons prolonger. 12 biscuits à la cuillère (savoyards) 250 g de mascarpone 3 jaunes d’œufs 70 g de sucre semoule 25 g d’eau 200 g crème montée 20 g de rhum agricole 200 g de café espresso fort, refroidi 15 g de cacao en poudre non sucré  recette végétarienne chef libanais charles azar recettes charles azar dessert  biscuits à la cuillère mascarpone jaunes d’œufs sucre crème rhum café cacao",
    "source": "olj",
    "raw_category": "dessert",
    "raw_difficulty": "facile",
    "raw_enrichment_present": true
  },
  {
    "url": "https://www.lorientlejour.com/cuisine-liban-a-table/1233126/la-tarte-aux-figues-de-charles-azar.html",
    "title": "La tarte aux figues de Charles Azar",
    "chef_name": "Charles Azar, la pâtisserie sous toutes ses formes",
    "cuisine_type": "méditerranéenne",
    "is_lebanese": false,
    "is_recipe": true,
    "category_canonical": "dessert",
    "difficulty_canonical": "facile",
    "tags": [
      "recette",
      "recettes charles azar",
      "cuisine méditerranéenne",
      "recette libanaise",
      "chef libanais",
      "dessert",
      "charles azar"
    ],
    "main_ingredients": [
      "figues",
      "beurre",
      "sucre",
      "poudre d'amande",
      "farine"
    ],
    "aliases": [],
    "search_text": "La tarte aux figues de Charles Azar Charles Azar, la pâtisserie sous toutes ses formes Ce que dit Charles Azar : « Outre son goût inégalable, la figue, surtout lorsqu’elle est fraîche, est un fruit très riche en antioxydants et en fibres. Séchées, les figues sont riches en sels minéraux, particulièrement en potassium, calcium, phosphore et magnésium. Personnellement, j’apprécie beaucoup ce fruit que j’utilise pour concocter des desserts et cela exclusivement quand il est de saison. Je me fournis en figues sur le marché local car, au Liban, nous avons les conditions adéquates pour une production de bonne qualité. La récolte se fait en outre manuellement, ce qui est bon pour le fruit. Enfin, il est important, aujourd’hui plus que jamais, d’aider les agriculteurs libanais à écouler leur récolte.La recette que j’ai choisie doit être préparée à l’avance. Les arômes peuvent ainsi se développer pleinement et donner tout son intérêt à la recette. » Pour la pâte sucrée 115 g de beurre 70 g de sucre glace 20 g de poudre d’amande 1g de fleur de sel 45 g d’œuf 190 g de farine tout usage. Pour la crème d’amande 30 g de beurre 30 g d’œuf 30 g de sucre semoule 60 g de poudre d’amandes 50 g de brunoise de figues (figues coupées en très petits dés). Pour la compotée de figues 120 g de figues 20 g de miel 10 g de jus de citron. Pour la crème vanille Ingrédients 200 g de lait 50 g de crème 1 gousse de vanille 25 g de sucre 40 g de jaune d’œuf 5 g de farine 5 g de fécule 25 g de beurre. Pour le montage 500 à 600 g de figues mûres, soit 12 à 14 figues, selon la taille.  recette recettes charles azar cuisine méditerranéenne recette libanaise chef libanais dessert charles azar  figues beurre sucre poudre d'amande farine",
    "source": "olj",
    "raw_category": "dessert",
    "raw_difficulty": "facile",
    "raw_enrichment_present": true
  },
  {
    "url": "https://www.lorientlejour.com/cuisine-liban-a-table/1475288/la-ratatouille-mediterraneenne-de-bernard-hage.html",
    "title": "La ratatouille méditerranéenne de Bernard Hage",
    "chef_name": "Bernard Hage, chef d'un jour",
    "cuisine_type": "méditerranéenne",
    "is_lebanese": false,
    "is_recipe": false,
    "category_canonical": "plat_principal",
    "difficulty_canonical": "facile",
    "tags": [
      "cuisine méditerranéenne",
      "plat principal",
      "recette végétarienne"
    ],
    "main_ingredients": [
      "halloum",
      "tomate",
      "aubergines",
      "poivron",
      "champignons",
      "pommes de terre",
      "oignons",
      "olives",
      "persil"
    ],
    "aliases": [],
    "search_text": "La ratatouille méditerranéenne de Bernard Hage Bernard Hage, chef d'un jour « Je vais commencer cet “instant cuisine” par une demi-heure de méditation ! » Sans sourciller, sans même sourire, Bernard Hage, et son humour aussi noir que ses vêtements, toujours noirs, ironise sans jamais se moquer de la vie, de la folie du monde et de ses dirigeants, de la politique, de nos malheurs, des siens aussi, de ses maladresses et de ses traumatismes d’enfant. Se servant avec ce même humour ironique de son modèle, chef Antoine, il improvise, le sourcil levé, la blague au bout de son couteau pas vraiment aiguisé. Pas pressé, il s’amuse, amuse, découpe lentement les légumes dans l’ordre, de couleur surtout. Et il y en a beaucoup, des légumes, dans sa ratatouille méditerranéenne…Lorsqu’on lui demande au bout de ce long et lent processus pourquoi il a choisi ce plat, il répond : « Je voulais faire de la mouloukhiyé, mais on m’a conseillé de viser moins haut vu le temps que j’ai. J’ai préféré donc la stratégie “sauvé par les légumes”. » 350 g de halloum 1 tomate 4 aubergines longues 1 poivron vert Ail 200 g de champignons 1,5 kg de pommes de terre (plutôt de petite taille) 4 oignons verts 3 grandes cuillères d’huile d’olive Une trentaine de petites olives noires Persil séché Sel  cuisine méditerranéenne plat principal recette végétarienne  halloum tomate aubergines poivron champignons pommes de terre oignons olives persil",
    "source": "olj",
    "raw_category": "plat principal",
    "raw_difficulty": "facile",
    "raw_enrichment_present": true
  },
  {
    "url": "https://www.lorientlejour.com/cuisine-liban-a-table/1462498/les-cookies-chocolat-pistaches-et-cardamome-de-rafaella-sargi.html",
    "title": "Les cookies chocolat, pistaches et cardamome de Rafaella Sargi",
    "chef_name": "Rafaella Sargi, passionnée de cuisine",
    "cuisine_type": "méditerranéenne",
    "is_lebanese": false,
    "is_recipe": false,
    "category_canonical": "dessert",
    "difficulty_canonical": "facile",
    "tags": [
      "recette",
      "dessert",
      "cuisine",
      "chocolat",
      "diaspora libanaise",
      "recette végétarienne",
      "cuisine du moyen-orient"
    ],
    "main_ingredients": [
      "farine",
      "beurre",
      "sucre",
      "œuf",
      "chocolat",
      "pistaches",
      "cardamome"
    ],
    "aliases": [],
    "search_text": "Les cookies chocolat, pistaches et cardamome de Rafaella Sargi Rafaella Sargi, passionnée de cuisine « Cette recette suit est une création qui a beaucoup de succès auprès des petits et des grands. Elle symbolise en quelque sorte ma nouvelle identité de Libano-Américaine », selon Rafaella Sargi. 200 g de farine 1 c. à café de bicarbonate de soude 1/2 c. à café de sel 1/2 c. à café de cardamome moulue 113 g de beurre non salé, à température ambiante 80 g de sucre blanc 50 g de sucre brun 1 œuf 1 c. à café d’extrait de vanille liquide 340 g de pépites de chocolat 200 g de pistaches (mondées et légèrement grillées).  recette dessert cuisine chocolat diaspora libanaise recette végétarienne cuisine du moyen-orient  farine beurre sucre œuf chocolat pistaches cardamome",
    "source": "olj",
    "raw_category": "dessert",
    "raw_difficulty": "facile",
    "raw_enrichment_present": true
  },
  {
    "url": "https://www.lorientlejour.com/cuisine-liban-a-table/1350035/la-kafta-bi-batata-de-chaker-bou-abdalla.html",
    "title": "La kafta bi batata de Chaker Bou Abdalla",
    "chef_name": "Chaker Bou Abdalla, chef d'un jour",
    "cuisine_type": "libanaise",
    "is_lebanese": true,
    "is_recipe": false,
    "category_canonical": "plat_principal",
    "difficulty_canonical": "facile",
    "tags": [
      "cuisine",
      "cuisine libanaise",
      "recette libanaise",
      "plat principal"
    ],
    "main_ingredients": [
      "kafta",
      "pommes de terre",
      "tomates",
      "poivron"
    ],
    "aliases": [],
    "search_text": "La kafta bi batata de Chaker Bou Abdalla Chaker Bou Abdalla, chef d'un jour Même derrière les fourneaux, Chaker Bou Abdalla semble en représentation, dans cette même attitude décalée qui fait son charme. Qu’il oublie un ingrédient, qu’il parle avec les légumes en s’excusant de les sacrifier, tout est sujet à un moment drôle à déguster sans modération. Son kafta bi batata, un traditionnel plat libanais que les mamas libanaises adorent servir à leur famille, il l’a choisi parce que « c’est facile et que c’est l’un des rares plats que je sais préparer », avoue-t-il… 1 poivron vert découpé en tranches dans le sens de la largeur 3 pommes de terre moyennes bien lavées, non pelées et coupées en dés 2 tomates coupées en rondelles 1 kg de kafta en forme de boulettes 2 c. à s. de concentré de tomate 1 cube Maggi Huile de cuisson au besoin.  cuisine cuisine libanaise recette libanaise plat principal  kafta pommes de terre tomates poivron",
    "source": "olj",
    "raw_category": "plat principal",
    "raw_difficulty": "facile",
    "raw_enrichment_present": true
  },
  {
    "url": "https://www.lorientlejour.com/cuisine-liban-a-table/1485024/entre-tradition-et-reinvention-notre-selection-de-recettes-pour-feter-lindependance-du-liban.html",
    "title": "Entre tradition et reinvention notre selection de recettes pour feter lindependance du liban.html",
    "chef_name": null,
    "cuisine_type": null,
    "is_lebanese": false,
    "is_recipe": false,
    "category_canonical": "autre",
    "difficulty_canonical": "non_specifie",
    "tags": [],
    "main_ingredients": [],
    "aliases": [],
    "search_text": "Entre tradition et reinvention notre selection de recettes pour feter lindependance du liban.html",
    "source": "olj",
    "raw_category": null,
    "raw_difficulty": null,
    "raw_enrichment_present": true
  },
  {
    "url": "https://www.lorientlejour.com/cuisine-liban-a-table/1474718/les-manaichs-du-chouf-de-salim-azzam.html",
    "title": "Les mana’ichs du Chouf de Salim Azzam",
    "chef_name": "Salim Azzam, chef d’un jour",
    "cuisine_type": "libanaise",
    "is_lebanese": true,
    "is_recipe": true,
    "category_canonical": "mezze_froid",
    "difficulty_canonical": "facile",
    "tags": [
      "mezzé",
      "recette libanaise",
      "recette végétarienne",
      "gastronomie libanaise"
    ],
    "main_ingredients": [
      "farine",
      "huile d'olive",
      "thym séché",
      "kichik",
      "poivre rouge",
      "sésame"
    ],
    "aliases": [],
    "search_text": "Les mana’ichs du Chouf de Salim Azzam Salim Azzam, chef d’un jour Dans la cuisine de son atelier à Bater, Salim Azzam, un sourire amusé aux lèvres, noue son tablier orné d’une broderie représentant le camion de livraison de son oncle. Entouré des femmes qui travaillent avec lui à l’atelier, il se lance, confirmant d’emblée qu’il ne sait rien de la cuisine. Toutes les femmes, avec à leur tête Joumana, Widad et Aïda, répondent à l’appel du jeune homme, visiblement dépassé. Avec son « qaf » qui souligne son appartenance, il choisit une recette facile : des mana’ich du Chouf. Salim Azzam va pétrir, tenter de jongler avec pour en faire une pâte fine, qui « a l’air triste » selon lui, pour, finalement, se résigner à s’en remettre à ses conseillères.Et lorsqu’il lance de son français unique un « Retrouvez-moi dansL’Orient-Le Jour», on ne peut que sourire devant ce grand garçon qui ne se prend pas au sérieux. En cuisine du moins. Pour la pâte 10 cuillères à café de farine ½ c. à. c de sel Un soupçon de levure bio 2 verres d’eau potable tiède Farine Pour l’assaisonnement ½ tasse à café d’huile d’olive 1 cuillère à soupe de thym séché 3 c. à s. de kichik déjà prêt 2 c. à c. de poivre rouge 1 c. à. c de sésame  mezzé recette libanaise recette végétarienne gastronomie libanaise  farine huile d'olive thym séché kichik poivre rouge sésame",
    "source": "olj",
    "raw_category": "mezze",
    "raw_difficulty": "facile",
    "raw_enrichment_present": true
  },
  {
    "url": "https://www.lorientlejour.com/cuisine-liban-a-table/1468728/les-ravioles-au-yaourt-shish-barak.html",
    "title": "Les ravioles au yaourt shish barak.html",
    "chef_name": null,
    "cuisine_type": null,
    "is_lebanese": false,
    "is_recipe": false,
    "category_canonical": "autre",
    "difficulty_canonical": "non_specifie",
    "tags": [],
    "main_ingredients": [],
    "aliases": [],
    "search_text": "Les ravioles au yaourt shish barak.html",
    "source": "olj",
    "raw_category": null,
    "raw_difficulty": null,
    "raw_enrichment_present": true
  },
  {
    "url": "https://www.lorientlejour.com/cuisine-liban-a-table/1449543/ramadan-et-careme-en-mode-light-le-potiron-en-deux-soupes-a-moins-de-10-dollars.html",
    "title": "Velouté de potiron aux noix de cajou",
    "chef_name": "Jaimee Lee Haddad, cheffe amateure",
    "cuisine_type": "méditerranéenne",
    "is_lebanese": false,
    "is_recipe": false,
    "category_canonical": "soupe",
    "difficulty_canonical": "facile",
    "tags": [
      "recette végétarienne",
      "recette automne",
      "potiron",
      "recette vegan",
      "recette de carême",
      "entrée"
    ],
    "main_ingredients": [
      "potiron"
    ],
    "aliases": [],
    "search_text": "Velouté de potiron aux noix de cajou Jaimee Lee Haddad, cheffe amateure En cet hiver qui a enfin montré le bout de son nez froid et humide, rien de plus réconfortant qu’un bol de soupe bien chaude. Et ce d’autant plus en période de jeûne. Aujourd'hui, nous mettons à l'honneur un légume de saison : le potiron.   recette végétarienne recette automne potiron recette vegan recette de carême entrée  potiron",
    "source": "olj",
    "raw_category": "soupe",
    "raw_difficulty": "facile",
    "raw_enrichment_present": true
  },
  {
    "url": "https://www.lorientlejour.com/cuisine-liban-a-table/1469018/ouayamat-petits-beignets-au-sirop.html",
    "title": "Les ouayamat (petits beignets au sirop) de Tara Khattar",
    "chef_name": "Tara Khattar, cheffe et ambitieuse entrepreneuse",
    "cuisine_type": "libanaise",
    "is_lebanese": true,
    "is_recipe": true,
    "category_canonical": "dessert",
    "difficulty_canonical": "facile",
    "tags": [
      "recette libanaise",
      "recettes tara khattar",
      "tara khattar",
      "dessert",
      "chef libanais",
      "recette végétarienne",
      "cuisine libanaise"
    ],
    "main_ingredients": [
      "farine",
      "lait en poudre",
      "sucre",
      "levure boulangère",
      "huile",
      "eau de fleur d'oranger"
    ],
    "aliases": [],
    "search_text": "Les ouayamat (petits beignets au sirop) de Tara Khattar Tara Khattar, cheffe et ambitieuse entrepreneuse Tara Khattar : « Voici la version libanaise du beignet. Il s'agit d'une pâte levée frite que l'on trempe dans un sirop épais à la fleur d'oranger. Souvent servies lors des moments festifs, ces petites boules croustillantes et moelleuses se trouvent dans toutes les pâtisseries orientales et dans les rues, où de nombreux vendeurs étalent leurs préparations diverses, devant les églises ou sur les places populaires dans les villages. » Pour les beignets : 500 g de farine 25 cl d'eau tiède 1 pincée de sel 1 cuil. à soupe de lait en poudre 1 cuil. à soupe de sucre 1 cuil. à café de levure boulangère déshydratée 1 litre d'huile pour friture type canola Pour le sirop à la fleur d'oranger : 400 g de sucre 25 cl d'eau 1 cuil. à café de jus de citron jaune 1 cuil. à soupe d'eau de fleur d'oranger  recette libanaise recettes tara khattar tara khattar dessert chef libanais recette végétarienne cuisine libanaise  farine lait en poudre sucre levure boulangère huile eau de fleur d'oranger",
    "source": "olj",
    "raw_category": "dessert",
    "raw_difficulty": "facile",
    "raw_enrichment_present": true
  },
  {
    "url": "https://www.lorientlejour.com/cuisine-liban-a-table/1367224/le-ceviche-de-merou-au-citron-tomates-avocats-et-piments-dalbert-kostanian.html",
    "title": "Le ceviche de mérou au citron, tomates, avocats et piments d’Albert Kostanian",
    "chef_name": "Albert Kostanian, chef d'un jour",
    "cuisine_type": "méditerranéenne",
    "is_lebanese": false,
    "is_recipe": false,
    "category_canonical": "plat_principal",
    "difficulty_canonical": "facile",
    "tags": [
      "albert kostanian",
      "recette végétarienne",
      "recette",
      "plat principal",
      "cuisine"
    ],
    "main_ingredients": [
      "mérou",
      "citron",
      "gingembre",
      "ail",
      "piments",
      "sauce soja",
      "oignons",
      "avocats",
      "tomates",
      "coriandre"
    ],
    "aliases": [],
    "search_text": "Le ceviche de mérou au citron, tomates, avocats et piments d’Albert Kostanian Albert Kostanian, chef d'un jour « La cuisine est surtout pour moi une occasion de me concentrer sur une préparation manuelle. C’est méditatif, la cuisine, et je suis lent… », dit Albert Kostanian. Du haut de son mètre quatre-vingt-treize, il doit parfois s’asseoir pour mieux voir ce qu’il fait, mettre un peu d’ordre dans son désordre. Et alors, les couleurs et les saveurs apparaissent dans un défilé de teintes et de parfums.« Le ceviche est un plat frais, simple à préparer et très bon. Et puis, les oignons, le piment et le citron vert… Je cherche constamment un prétexte pour en manger. » 1 kg de mérou, bar ou abou sin coupé en fines tranches 10 citrons verts pressés 1 morceau de gingembre frais râpé 3 gousses d’ail écrasées 2 ou 3 piments verts et rouges coupés en rondelles 3 c. à c. de sauce soja 2 oignons rouges coupés en lamelles 2 avocats pelés, dénoyautés et coupés en cubes 2 petites tomates coupées en lamelles Quelques feuilles de coriandre Poivre  albert kostanian recette végétarienne recette plat principal cuisine  mérou citron gingembre ail piments sauce soja oignons avocats tomates coriandre",
    "source": "olj",
    "raw_category": "plat principal",
    "raw_difficulty": "facile",
    "raw_enrichment_present": true
  },
  {
    "url": "https://www.lorientlejour.com/cuisine-liban-a-table/1469404/viande-grillee-aux-griottes-fishneyov-khorovatz.html",
    "title": "Viande grillée aux griottes (Fishneyov khorovatz) d'Aline Kamakian",
    "chef_name": "Aline Kamakian, cheffe engagée",
    "cuisine_type": "libanaise",
    "is_lebanese": true,
    "is_recipe": true,
    "category_canonical": "plat_principal",
    "difficulty_canonical": "facile",
    "tags": [
      "recette arménienne",
      "recettes aline kamakian",
      "aline kamakian",
      "chef libanais",
      "cuisine méditerranéenne",
      "plat principal"
    ],
    "main_ingredients": [
      "bœuf haché",
      "agneau haché",
      "griottes",
      "cannelle",
      "cumin"
    ],
    "aliases": [],
    "search_text": "Viande grillée aux griottes (Fishneyov khorovatz) d'Aline Kamakian Aline Kamakian, cheffe engagée Aline Kamakian et Barbara Drieskens : « On peut diviser les cerises en trois catégories : les noires, les blanches et les griottes (cerises acides). La griotte est souvent immangeable crue, mais devient délicieuse une fois pochée, mise en conserve ou cuite en confiture. Les cerises acides poussent en Arménie et en Cilicie. Elles sont récoltées au début de l’été, puis conservées en les faisant bouillir avec du sucre pour en faire une compote. Une autre méthode consiste à faire sécher les cerises, puis à les utiliser pour préparer cette délicieuse sauce parfumée à la cannelle, avec juste une pincée de cumin » Pour la viande : 300 g de bœuf haché (bavette ou épaule) 300 g d’agneau haché (flanchet) ½ cuillère à soupe de sel 1½ cuillère à café de poudre de piment rouge ½ cuillère à café de quatre-épices ½ cuillère à café de mélange de sept épices Pour la sauce : 500 ml de compote de griottes 125 ml d’eau ½ cuillère à café de cannelle 1 pincée de cumin  recette arménienne recettes aline kamakian aline kamakian chef libanais cuisine méditerranéenne plat principal  bœuf haché agneau haché griottes cannelle cumin",
    "source": "olj",
    "raw_category": "plat principal",
    "raw_difficulty": "facile",
    "raw_enrichment_present": true
  },
  {
    "url": "https://www.lorientlejour.com/cuisine-liban-a-table/1336640/le-baklava-une-douceur-royale-en-provenance-de-topkapi.html",
    "title": "Le baklava une douceur royale en provenance de topkapi.html",
    "chef_name": null,
    "cuisine_type": null,
    "is_lebanese": false,
    "is_recipe": false,
    "category_canonical": "autre",
    "difficulty_canonical": "non_specifie",
    "tags": [],
    "main_ingredients": [],
    "aliases": [],
    "search_text": "Le baklava une douceur royale en provenance de topkapi.html",
    "source": "olj",
    "raw_category": null,
    "raw_difficulty": null,
    "raw_enrichment_present": true
  },
  {
    "url": "https://www.lorientlejour.com/cuisine-liban-a-table/1469106/fatteh-daubergines.html",
    "title": "La fatteh d’aubergines d'Alan Geaam",
    "chef_name": "Alan Geaam, chef étoilé",
    "cuisine_type": "libanaise",
    "is_lebanese": true,
    "is_recipe": false,
    "category_canonical": "mezze_froid",
    "difficulty_canonical": "facile",
    "tags": [
      "recette libanaise",
      "recettes alan geaam",
      "cuisine libanaise",
      "alan geaam",
      "recette végétarienne",
      "plat principal",
      "chef libanais",
      "mezzé"
    ],
    "main_ingredients": [
      "yaourt grec",
      "tahini",
      "aubergines",
      "pois chiches",
      "pain pita"
    ],
    "aliases": [],
    "search_text": "La fatteh d’aubergines d'Alan Geaam Alan Geaam, chef étoilé  510 g de yaourt grec 90 g de tahini 12 g de sel 9 g de cumin 300 g d'aubergines 300 g de pois chiches en conserve Poivre Pour les toppings : 120 g de pignons de pin 1 pain pita Quelques feuilles de menthe 6 radis Beurre Paprika  recette libanaise recettes alan geaam cuisine libanaise alan geaam recette végétarienne plat principal chef libanais mezzé  yaourt grec tahini aubergines pois chiches pain pita",
    "source": "olj",
    "raw_category": "mezze",
    "raw_difficulty": "facile",
    "raw_enrichment_present": true
  },
  {
    "url": "https://www.lorientlejour.com/cuisine-liban-a-table/1484182/les-feuilles-de-chou-a-la-melasse-de-grenade-de-mona-el-zaatari.html",
    "title": "Les feuilles de chou a la melasse de grenade de mona el zaatari.html",
    "chef_name": null,
    "cuisine_type": null,
    "is_lebanese": false,
    "is_recipe": false,
    "category_canonical": "autre",
    "difficulty_canonical": "non_specifie",
    "tags": [],
    "main_ingredients": [],
    "aliases": [],
    "search_text": "Les feuilles de chou a la melasse de grenade de mona el zaatari.html",
    "source": "olj",
    "raw_category": null,
    "raw_difficulty": null,
    "raw_enrichment_present": true
  },
  {
    "url": "https://www.lorientlejour.com/cuisine-liban-a-table/1294022/la-siyadieh-bi-tagine-de-hoda-baroudi-et-les-feuilles-de-chou-de-sa-soeur-mona-el-zaatari.html",
    "title": "La siyadieh bi tagine de hoda baroudi et les feuilles de chou de sa soeur mona el zaatari.html",
    "chef_name": null,
    "cuisine_type": null,
    "is_lebanese": false,
    "is_recipe": false,
    "category_canonical": "autre",
    "difficulty_canonical": "non_specifie",
    "tags": [],
    "main_ingredients": [],
    "aliases": [],
    "search_text": "La siyadieh bi tagine de hoda baroudi et les feuilles de chou de sa soeur mona el zaatari.html",
    "source": "olj",
    "raw_category": null,
    "raw_difficulty": null,
    "raw_enrichment_present": true
  },
  {
    "url": "https://www.lorientlejour.com/cuisine-liban-a-table/1482674/la-salade-de-petits-pois-a-la-sarriette-ou-thym-sauvage-du-chef-alan-geaam.html",
    "title": "La salade de petits pois à la sarriette (ou thym sauvage) du chef Alan Geaam",
    "chef_name": "Alan Geaam, chef étoilé",
    "cuisine_type": "libanaise",
    "is_lebanese": true,
    "is_recipe": false,
    "category_canonical": "salade",
    "difficulty_canonical": "facile",
    "tags": [
      "entrée",
      "recette végétarienne",
      "recettes alan geaam",
      "chef libanais"
    ],
    "main_ingredients": [
      "petits pois",
      "sarriette",
      "menthe",
      "fromage de chèvre",
      "huile d'olive",
      "jus de citron"
    ],
    "aliases": [],
    "search_text": "La salade de petits pois à la sarriette (ou thym sauvage) du chef Alan Geaam Alan Geaam, chef étoilé J’aime cette salade fraîche, légère et de saison. On peut y utiliser le « zaatar akhdar », ce thym sauvage bien de chez nous qui va assaisonner les petits pois, une herbe qui me pose et qui pose ma recette entre la France et le Liban. J’ai beaucoup d’émotions quand je prépare ce plat… Aussi, j’aime le goût du fromage de chèvre, d’autant plus quand il s’agit de labné, qui, lui aussi, me ramène au Liban. Et pour couronner le tout, ce velouté de petits pois que l’on attend pas qui vient rehausser l’ensemble de la préparation.Bon appétit ! 1 kg de petits pois écossés Sarriette (fraîche ou séchée) ou thym sauvage libanais Menthe fraîche Fromage de chèvre frais (ou labné de chèvre) Huile d'olive Jus de citron Sel Poivre  entrée recette végétarienne recettes alan geaam chef libanais  petits pois sarriette menthe fromage de chèvre huile d'olive jus de citron",
    "source": "olj",
    "raw_category": "salade",
    "raw_difficulty": "facile",
    "raw_enrichment_present": true
  },
  {
    "url": "https://www.lorientlejour.com/cuisine-liban-a-table/1462497/la-tarte-aux-ecorces-dorange-amere.html",
    "title": "La tarte aux écorces d’orange amère de Mymouné",
    "chef_name": "Randa Maalouf Geagea, Mymouné",
    "cuisine_type": "libanaise",
    "is_lebanese": true,
    "is_recipe": false,
    "category_canonical": "dessert",
    "difficulty_canonical": "facile",
    "tags": [
      "recette libanaise",
      "dessert",
      "recette",
      "recette végétarienne",
      "cuisine du moyen-orient"
    ],
    "main_ingredients": [
      "beurre",
      "sucre",
      "sel",
      "œufs",
      "farine",
      "lait",
      "vanille",
      "jaunes d’œuf",
      "fécule de maïs"
    ],
    "aliases": [],
    "search_text": "La tarte aux écorces d’orange amère de Mymouné Randa Maalouf Geagea, Mymouné La tarte aux écorces d’orange amère est savoureuse et facile à préparer… Pas besoin d’aller au marché pour acheter des fruits de saison. Il suffit d’ouvrir le placard pour garnir le fond de tarte et la crème pâtissière.« À Mymouné, nous suivons le rythme des saisons. Nous ne travaillons qu’avec des produits frais. La première année de notre aventure, l’hiver est venu et nous pensions que dame nature était en pause et nous ne voulions en aucun cas suspendre le travail à l’atelier », explique Randa Maalouf Geagea, directrice exécutive de Mymouné. « En regardant de plus près, nous avons trouvé que le littoral libanais regorgeait d’agrumes. Nous avons donc puisé dans les recettes traditionnelles l’art qu’avaient nos grands-mères pour préparer les écorces d’orange amère (Abou sfeir) au sirop. La recette est si compliquée et si harassante que la nouvelle génération l’avait occultée. Nous avons donc proposé les écorces d’orange amère au sirop, les orangettes au sucre et la marmelade aux trois agrumes, », conclut-elle. Pour la pâte sucrée : 240 g de beurre à température ambiante 180 g de sucre Une pincée de sel 2 œufs entiers battus 400 g de farine Ingrédients pour la crème pâtissière : ½ litre de lait 1 gousse de vanille 6 jaunes d’œuf 150 g de sucre 40 g de fécule de maïs  recette libanaise dessert recette recette végétarienne cuisine du moyen-orient  beurre sucre sel œufs farine lait vanille jaunes d’œuf fécule de maïs",
    "source": "olj",
    "raw_category": "dessert",
    "raw_difficulty": "facile",
    "raw_enrichment_present": true
  },
  {
    "url": "https://www.lorientlejour.com/cuisine-liban-a-table/1360467/ce-hommos-qui-dechaine-les-passions.html",
    "title": "Ce hommos qui dechaine les passions.html",
    "chef_name": null,
    "cuisine_type": null,
    "is_lebanese": false,
    "is_recipe": false,
    "category_canonical": "autre",
    "difficulty_canonical": "non_specifie",
    "tags": [],
    "main_ingredients": [],
    "aliases": [],
    "search_text": "Ce hommos qui dechaine les passions.html",
    "source": "olj",
    "raw_category": null,
    "raw_difficulty": null,
    "raw_enrichment_present": true
  },
  {
    "url": "https://www.lorientlejour.com/cuisine-liban-a-table/1415516/de-la-raqwe-de-nos-grands-meres-aux-lattes-branches-comment-le-cafe-est-devenu-une-tradition-libanaise.html",
    "title": "De la raqwe de nos grands meres aux lattes branches comment le cafe est devenu une tradition libanaise.html",
    "chef_name": null,
    "cuisine_type": null,
    "is_lebanese": false,
    "is_recipe": false,
    "category_canonical": "autre",
    "difficulty_canonical": "non_specifie",
    "tags": [],
    "main_ingredients": [],
    "aliases": [],
    "search_text": "De la raqwe de nos grands meres aux lattes branches comment le cafe est devenu une tradition libanaise.html",
    "source": "olj",
    "raw_category": null,
    "raw_difficulty": null,
    "raw_enrichment_present": true
  },
  {
    "url": "https://www.lorientlejour.com/cuisine-liban-a-table/1462496/le-poulet-sauce-blanche-revisite-par-lea-sednaoui.html",
    "title": "Le poulet sauce blanche revisité par Léa Sednaoui",
    "chef_name": "Léa Sednaoui, chef du goût et du bien-être",
    "cuisine_type": "méditerranéenne",
    "is_lebanese": false,
    "is_recipe": false,
    "category_canonical": "plat_principal",
    "difficulty_canonical": "facile",
    "tags": [
      "recette",
      "plat principal",
      "cuisine"
    ],
    "main_ingredients": [
      "poulet",
      "riz",
      "farine",
      "beurre",
      "bouillon de poule"
    ],
    "aliases": [],
    "search_text": "Le poulet sauce blanche revisité par Léa Sednaoui Léa Sednaoui, chef du goût et du bien-être Léa Sednaoui nous propose une recette classique de sa mère, revisitée à sa manière : le poulet sauce blanche, qui peut être réalisé avec des denrées basiques (riz, farine, poulet frais/congelé, etc). Pour le poulet : 1 poulet entier (ou en morceaux) 1 oignon entier épluché 1 carotte entière épluchée Un gros morceau de gingembre, coupé en morceaux 4 feuilles de laurier 1 ail entier, tranché en large 1 c. à café de poivre blanc 1 anis étoilé 1 c. à soupe de sel Pour la sauce blanche : 2 c. à café de farine 50g de beurre 500 ml de bouillon de poule Le jus d’un demi-citron, ou un peu plus Noix de muscade, si disponible Poivre blanc 1 c. à café de sel Riz : 240g de riz de votre choix, cuit à l’eau ou au bouillon de poule Pour la finition : 1 portion de coriandre, ail des ours, ciboulette et/ou herbes de votre choix, hachées (optionnel) 2 portions d’huile d’olive Pincée de sel  recette plat principal cuisine  poulet riz farine beurre bouillon de poule",
    "source": "olj",
    "raw_category": "plat principal",
    "raw_difficulty": "facile",
    "raw_enrichment_present": true
  },
  {
    "url": "https://www.lorientlejour.com/cuisine-liban-a-table/1463971/le-chou-fleur-en-mama-ganoush-dalan-geaam.html",
    "title": "Le chou-fleur en « mama ganoush » d’Alan Geaam",
    "chef_name": "Alan Geaam, chef étoilé",
    "cuisine_type": "libanaise",
    "is_lebanese": true,
    "is_recipe": false,
    "category_canonical": "mezze_froid",
    "difficulty_canonical": "facile",
    "tags": [
      "alan geaam",
      "recettes alan geaam",
      "recette",
      "entrée",
      "recette végétarienne",
      "diaspora libanaise",
      "recette vegan",
      "recette libanaise",
      "cuisine libanaise"
    ],
    "main_ingredients": [
      "chou-fleur",
      "coriandre",
      "grenade",
      "huile d’olive",
      "mélasse de grenade",
      "jus de citron",
      "crème de sésame",
      "sumac",
      "pignons de pin"
    ],
    "aliases": [],
    "search_text": "Le chou-fleur en « mama ganoush » d’Alan Geaam Alan Geaam, chef étoilé « Il s’agit de la déclinaison hivernale parfaite pour les fans de baba ghanouge ! Lorsque la saison des aubergines est finie, le 'mama ganoush' permet de faire durer le plaisir tout en apportant un peu d’originalité et de nouveauté dans ce mezzé incontournable », explique Alan Geaam.« La cuisine libanaise est ma première source d’inspiration. Elle est particulièrement riche et permet beaucoup de créativité et de déclinaisons de saveurs. C’est aussi une cuisine de partage, de convivialité et de diversité, des valeurs qui me tiennent à cœur », poursuit-il.« Libanais et Tripolitain, j’aime proposer une cuisine qui rend hommage à ma double culture franco-libanaise, en déclinant les plats emblématiques de la gastronomie française, mon pays d’adoption, à travers des influences qui rappellent mes racines libanaises », dit-il encore. 1 chou-fleur entier 1/2 botte de coriandre 1/2 grenade 10 cl d’huile d’olive 5 cl de mélasse de grenade 100 ml de jus de citron 200 g de crème de sésame 1 pincée de sumac Pignons de pin 1 l d’huile de friture (si cuisson à la friteuse) 1 citron vert (optionnel) 1 orange (optionnel) Sel et poivre selon goût.  alan geaam recettes alan geaam recette entrée recette végétarienne diaspora libanaise recette vegan recette libanaise cuisine libanaise  chou-fleur coriandre grenade huile d’olive mélasse de grenade jus de citron crème de sésame sumac pignons de pin",
    "source": "olj",
    "raw_category": "mezze",
    "raw_difficulty": "facile",
    "raw_enrichment_present": true
  },
  {
    "url": "https://www.lorientlejour.com/cuisine-liban-a-table/1463816/poulet-au-miel-de-chene-et-a-la-citronnelle.html",
    "title": "Poulet au miel de chene et a la citronnelle.html",
    "chef_name": null,
    "cuisine_type": null,
    "is_lebanese": false,
    "is_recipe": false,
    "category_canonical": "autre",
    "difficulty_canonical": "non_specifie",
    "tags": [],
    "main_ingredients": [],
    "aliases": [],
    "search_text": "Poulet au miel de chene et a la citronnelle.html",
    "source": "olj",
    "raw_category": null,
    "raw_difficulty": null,
    "raw_enrichment_present": true
  },
  {
    "url": "https://www.lorientlejour.com/cuisine-liban-a-table/1227694/le-vrai-taboule-de-kamal-mouzawak.html",
    "title": "Le « vrai » taboulé de Kamal Mouzawak",
    "chef_name": "Kamal Mouzawak, fondateur de Souk el-Tayeb",
    "cuisine_type": "libanaise",
    "is_lebanese": true,
    "is_recipe": true,
    "category_canonical": "mezze_froid",
    "difficulty_canonical": "facile",
    "tags": [
      "mezzé",
      "kamal mouzawak",
      "recette libanaise",
      "entrée",
      "recette végétarienne",
      "recette de carême",
      "recette vegan",
      "cuisine libanaise"
    ],
    "main_ingredients": [
      "persil",
      "tomate",
      "bourghol",
      "menthe",
      "oignon"
    ],
    "aliases": [
      "taboulé",
      "tabbouleh",
      "salade de persil"
    ],
    "search_text": "Le « vrai » taboulé de Kamal Mouzawak Kamal Mouzawak, fondateur de Souk el-Tayeb 1-Le taboulé est essentiellement du persil ! Avec quelques autres ingrédients mineurs.2-Le persil est plat, on ne lui (re)connaît aucune autre forme.3-Seul le bourghol se conjugue avec le taboulé… Exit le couscous, le quinoa ou d’autres céréales …4-Persil et menthe sont « tranchés » et pas hachés ! Le couteau passe une fois, jamais deux !5-La menthe aime se cacher sous le persil pour qu’elle ne s’oxyde pas une fois tranchée.6-L’oignon aime se frotter au sel et au poivre doux (bhar helou) pour le « cuire » et l’adoucir.7-Le taboulé aime les extrêmes : du citron et une bonne dose de piment vert ! Chaque bouchée doit rafraîchir la bouche.8-Il se mélange, s’assaisonne et se sert à dernière la minute ! Il se consomme frais.9-Le taboulé à l’occidentale servi avec des crevettes – ou cuit dans son jus depuis des heures – ou encore conservé 24 heures dans la vitrine d’un traiteur, ou, pire encore, en conserve n’est pas un taboulé ! Toute autre variation ou création est un autre plat qui n’a plus rien à voir avec le taboulé.« S’il existe un point commun entre tous les Libanais, peut-être même plus que notre fameux cèdre, c’est bien le taboulé… Qu’on vienne du nord, du sud, de l’est ou de l’ouest du Liban, on ne jure que par le taboulé, on pense que maman fait le meilleur taboulé ! Vert, rouge et blanc… les couleurs de notre drapeau national, rien ne raconte le Liban aussi bien que ce plat. Mon ami le Dr Antoine Daher a dressé le parallèle avec le Liban en soulignant que le taboulé est composé de différents ingrédients faciles à distinguer, coupés si petits qu’on ne peut jamais les séparer l’un de l’autre… tout comme ce peuple si différent et mélangé qu’il est difficile de diviser.Il n’y a pas de dimanche sans taboulé. Il commence par le maskabeh (le carré de persil) et une jammeh (coupe). Plus le persil est tendre, mieux c’est. Et puis, il y a les graines baladi et les amerkenne (américaines) à la saveur plus douce qui se partagent la vedette. Ensuite, c’est l’art du tebwi’e (de be’a, qui signifie bouquet).L’art de composer des bouquets de persil en prenant soin que toutes les premières feuilles en bas de la tige soient à la même hauteur. Ainsi, il devient plus facile, en hachant le persil, de jeter les tiges et n’en garder que les feuilles (et éventuellement quelques tiges…) » 2 bottes de persil plat (compter presque 150 g par botte) 1 petite botte de menthe (75 g) 2 petits oignons verts 2 grosses tomates bien rouges, mais fermes 1 c. à soupe de bourghol fin Le jus de 2 citrons 6 c. à soupe d’huile d’olive Sel et poivre doux Laitue romaine ou feuille de chou blanc pour manger le taboulé.  mezzé kamal mouzawak recette libanaise entrée recette végétarienne recette de carême recette vegan cuisine libanaise taboulé tabbouleh salade de persil persil tomate bourghol menthe oignon",
    "source": "olj",
    "raw_category": "mezze",
    "raw_difficulty": "facile",
    "raw_enrichment_present": true
  },
  {
    "url": "https://www.lorientlejour.com/cuisine-liban-a-table/1469110/cookies-a-la-mode-libanaise.html",
    "title": "Cookies à la mode libanaise d'Alan Geaam",
    "chef_name": "Alan Geaam, chef étoilé",
    "cuisine_type": "libanaise",
    "is_lebanese": true,
    "is_recipe": true,
    "category_canonical": "dessert",
    "difficulty_canonical": "facile",
    "tags": [
      "dessert",
      "recettes alan geaam",
      "cuisine méditerranéenne",
      "recette libanaise",
      "cuisine libanaise",
      "chef libanais",
      "alan geaam",
      "recette végétarienne",
      "chocolat"
    ],
    "main_ingredients": [
      "beurre",
      "sucre cassonade",
      "farine",
      "levure chimique",
      "œuf",
      "cannelle",
      "pistaches",
      "dattes",
      "chocolat"
    ],
    "aliases": [],
    "search_text": "Cookies à la mode libanaise d'Alan Geaam Alan Geaam, chef étoilé  Base : 125 g beurre 100 g sucre cassonade 200 g de farine 11 g de levure chimique 1 œuf Pour la garniture à la cannelle : 100 g de cannelle en poudre 20 g de pâte de cannelle (pour la décoration) : 5 ml d'huile d'olive, 10 g de praliné, 5 g de cannelle en poudre Pour la garniture à la pistache : 100 g de pistaches hachées ou entières 20 g de pâte de pistache (pour la décoration) Pour la garniture dattes et chocolat : 100 g de dattes en morceaux (80 g pour la pâte - 20 g pour la décoration) 100 g de chocolat fondu  dessert recettes alan geaam cuisine méditerranéenne recette libanaise cuisine libanaise chef libanais alan geaam recette végétarienne chocolat  beurre sucre cassonade farine levure chimique œuf cannelle pistaches dattes chocolat",
    "source": "olj",
    "raw_category": "dessert",
    "raw_difficulty": "facile",
    "raw_enrichment_present": true
  },
  {
    "url": "https://www.lorientlejour.com/cuisine-liban-a-table/1291726/les-rigatoni-alla-vodka-de-sophie-schoucair.html",
    "title": "Les rigatoni alla vodka de Sophie Schoucair",
    "chef_name": "Sophie Schoucair, le goût de l'Italie à Beyrouth",
    "cuisine_type": "italienne",
    "is_lebanese": false,
    "is_recipe": false,
    "category_canonical": "plat_principal",
    "difficulty_canonical": "facile",
    "tags": [
      "cuisine méditerranéenne",
      "plat principal",
      "chef libanais"
    ],
    "main_ingredients": [
      "rigatoni",
      "pancetta",
      "tomates",
      "crème fraîche",
      "vodka"
    ],
    "aliases": [],
    "search_text": "Les rigatoni alla vodka de Sophie Schoucair Sophie Schoucair, le goût de l'Italie à Beyrouth  500 gr de rigatoni 1 oignon 5 gousses d’ail Huile d’olive 300 à 400 gr de pancetta selon les goûts 1 kg de tomates pelées 15 cl de crème fraîche 20 cl de vodka  cuisine méditerranéenne plat principal chef libanais  rigatoni pancetta tomates crème fraîche vodka",
    "source": "olj",
    "raw_category": "plat principal",
    "raw_difficulty": "facile",
    "raw_enrichment_present": true
  },
  {
    "url": "https://www.lorientlejour.com/cuisine-liban-a-table/1468699/kebbe-de-pomme-de-terre-aux-noix-kebbe-batata-bi-jozz.html",
    "title": "Kebbe de pomme de terre aux noix kebbe batata bi jozz.html",
    "chef_name": null,
    "cuisine_type": null,
    "is_lebanese": false,
    "is_recipe": false,
    "category_canonical": "autre",
    "difficulty_canonical": "non_specifie",
    "tags": [],
    "main_ingredients": [],
    "aliases": [],
    "search_text": "Kebbe de pomme de terre aux noix kebbe batata bi jozz.html",
    "source": "olj",
    "raw_category": null,
    "raw_difficulty": null,
    "raw_enrichment_present": true
  },
  {
    "url": "https://www.lorientlejour.com/cuisine-liban-a-table/1368004/le-moutabbal-de-koussa-et-les-aubergines-a-lambarees-de-samer-el-amine.html",
    "title": "Le moutabbal de koussa et les aubergines à l'ambarees de Samer el-Amine",
    "chef_name": "Samer-el Amine, chef d'un jour",
    "cuisine_type": "libanaise",
    "is_lebanese": true,
    "is_recipe": true,
    "category_canonical": "mezze_froid",
    "difficulty_canonical": "facile",
    "tags": [
      "recette végétarienne",
      "cuisine libanaise",
      "mezzé",
      "entrée",
      "recette libanaise"
    ],
    "main_ingredients": [
      "courgette",
      "yaourt",
      "tahini",
      "aubergine",
      "farine"
    ],
    "aliases": [
      "moutabbal"
    ],
    "search_text": "Le moutabbal de koussa et les aubergines à l'ambarees de Samer el-Amine Samer-el Amine, chef d'un jour La cuisine, Samer el-Amine n’en avait jamais fait avant l’épidémie de Covid-19 et le confinement. « Tous les jours, confie-t-il, je préparais trois repas, petit déjeuner, déjeuner et dîner, à des SDF du quartier. » C’est à ce moment-là qu’il redécouvre les produits, les recettes, celles des plats italiens et celles de son enfance. Il s’essaie à cet exercice et y prend un malin plaisir.« La nourriture est un dialogue », dit-il tout en alignant ses courgettes coupées en fines rondelles. « Tout est question de proportions. J’aime choisir des petites feuilles qui soulignent l’assiette et la rehaussent. » Le sourire coquin et fier d’un enfant qui a réussi son coup, il affirme : « Ces deux plats, le moutabbal de courgettes et les aubergines au ambarees, je les ai réinventés. Ils sont faciles et rapides à préparer juste avant l’arrivée des invités et à servir en apéritif. Mes amis italiens en raffolent. » À peine avait-il terminé, l’assiette aussi belle qu’appétissante, que Samer el-Amine avait tout rangé, nettoyé, remis en place... Pour le moutabbal de koussa : 10 courgettes coupées en fines rondelles 1 litre d'huile végétale pour la friture 500 g de yaourt 2 c. à s. de tahini 1 gousse d'ail écrasée 1 c. à c. de menthe séchée en poudre. Pour les aubergines à l'ambarees : 2 aubergines coupées en très fines rondelles 3 c. à s. de farine 250 g d’ambarees (du lait de chèvre cru, fermenté dans des jarres en terre cuite. Il se transforme en labné avec une texture crémeuse et une saveur acide appelée ambarees) Sel 3 c. à s. de farine Quelques brindilles de thym frais (zaatar zoubaa).  recette végétarienne cuisine libanaise mezzé entrée recette libanaise moutabbal courgette yaourt tahini aubergine farine",
    "source": "olj",
    "raw_category": "mezze",
    "raw_difficulty": "facile",
    "raw_enrichment_present": true
  },
  {
    "url": "https://www.lorientlejour.com/cuisine-liban-a-table/1246484/la-kebbe-labniye-de-tara-khattar.html",
    "title": "La kebbé labniyé de Tara Khattar",
    "chef_name": "Tara Khattar, cheffe et ambitieuse entrepreneuse",
    "cuisine_type": "libanaise",
    "is_lebanese": true,
    "is_recipe": true,
    "category_canonical": "plat_principal",
    "difficulty_canonical": "facile",
    "tags": [
      "recettes tara khattar",
      "tara khattar",
      "recette de noel",
      "cuisine libanaise",
      "recette libanaise",
      "plat principal"
    ],
    "main_ingredients": [
      "viande hachée",
      "boulgour",
      "yaourt",
      "oignon",
      "épices"
    ],
    "aliases": [
      "kebbé",
      "kibbe"
    ],
    "search_text": "La kebbé labniyé de Tara Khattar Tara Khattar, cheffe et ambitieuse entrepreneuse « D’habitude, Noël représente pour moi la plus belle période de l’année. J’aime rentrer au Liban, passer des moments de qualité avec la famille, revoir les amis. Comme tout le monde, en fait. Je ne rate jamais cette occasion, même si je ne peux rentrer que pour deux jours. Cette année, les fêtes sont différentes, masquées, et surtout plus tristes. Le jour de mon arrivée, en atterrissant à l’aéroport, au lieu de la joie et l’impatience que je ressens d’habitude, j’ai éprouvé une tristesse intense. Le sentiment était différent. Noël en 2020, c’est surtout passer du temps ensemble et aider les personnes dans le besoin. J’ai cuisiné 100 repas de Noël pour Base Camp et des personnes défavorisées, ça m’a permis de me sentir utile et plus unie avec les Libanais. Ce Noël est particulier, pénible. Mais je suis très heureuse d’être là, après une longue année d’absence. J’ai choisi la kebbé labniyé pour commencer l’année, comme il est de tradition au Liban où un « plat blanc » est supposé porter chance et prospérité, et symbolise une nouvelle année sereine, une nouvelle page qui s’ouvre. » Pour la sauce au yaourt : 1 kg de yaourt nature non sucré 1 œuf 1 c. à soupe de fécule de maïs 1 c. à soupe d’eau 4 c. à soupe d’huile 2 gousses d’ail 1/2 botte de coriandre 1 c. à café de menthe séchée Sel Pour les kebbés : 250 g de viande hachée finement de bœuf ou d’agneau 200 g de boulgour fin 1/4 d'oignon 1/2 c. à café de sept épices 1 pincée de noix de muscade 1/4 cuil. à café de cannelle 1 c. à café de poivre doux. Pour la viande : 500 g de viande à ragoût (bœuf ou agneau) 1 oignon 1 feuille de laurier 3 clous de girofle 1 c. à café de cannelle Sel Pour les oignons : 12 oignons grelots 1 c. à café de sucre 4 c. à soupe de beurre 1 pincée de sel  recettes tara khattar tara khattar recette de noel cuisine libanaise recette libanaise plat principal kebbé kibbe viande hachée boulgour yaourt oignon épices",
    "source": "olj",
    "raw_category": "plat principal",
    "raw_difficulty": "facile",
    "raw_enrichment_present": true
  },
  {
    "url": "https://www.lorientlejour.com/cuisine-liban-a-table/1244115/la-dinde-americaine-revisitee-par-joanna-debbas.html",
    "title": "La dinde américaine revisitée par Joanna Kassem",
    "chef_name": "Joanna Kassem, entre montagnes et manakich",
    "cuisine_type": "méditerranéenne",
    "is_lebanese": false,
    "is_recipe": true,
    "category_canonical": "plat_principal",
    "difficulty_canonical": "moyenne",
    "tags": [
      "recette de noel",
      "plat principal",
      "cuisine méditerranéenne"
    ],
    "main_ingredients": [
      "dinde",
      "marrons",
      "carottes",
      "poireaux",
      "thym"
    ],
    "aliases": [],
    "search_text": "La dinde américaine revisitée par Joanna Kassem Joanna Kassem, entre montagnes et manakich « Des Noëls de mon enfance, je garde le goût de la dinde orientale de ma grand-mère paternelle, qui la préparait avec du riz et beaucoup de marrons. Je me souviens aussi de cette grande tablée familiale d’où fusaient tant d’éclats de rire. J’ai choisi la dinde américaine parce que c’est une autre façon de préparer ce plat traditionnel et que c’est bon ! » Pour la saumure : 2 bâtons de cannelle 4 feuilles de laurier 1 bouquet de thym sauvage 2 brins de romarin ¼ de petite cuillère de poivre blanc entier 1 c. à café de gros sel 2 carottes tranchées en 4 3 oignons moyens coupés en 4 1 c. à café de poivre noir entier Une dinde Butterball de 3 kg Pour la dinde : La dinde préparée la veille, lavée et séchée ½ tasse de graisse de canard 1 bouquet de thym, de romarin et feuilles de laurier séchées ou fraîches 10 à 15 marrons pelés 4 à 5 échalotes 2 poireaux coupés en gros cubes 2 carottes coupées en grosses rondelles Fil de cuisson Pour la farce : 1 pain au levain coupé en cubes sans la croûte. 2 poireaux découpés en fines rondelles 3 à 4 c. à café de thym sauvage ¼ de c. à café de poivre noir au moulin.  recette de noel plat principal cuisine méditerranéenne  dinde marrons carottes poireaux thym",
    "source": "olj",
    "raw_category": "plat principal",
    "raw_difficulty": "moyenne",
    "raw_enrichment_present": true
  },
  {
    "url": "https://www.lorientlejour.com/cuisine-liban-a-table/1468723/la-kebbe-crue-du-liban-sud-frake-naye.html",
    "title": "La kebbe crue du liban sud frake naye.html",
    "chef_name": null,
    "cuisine_type": null,
    "is_lebanese": false,
    "is_recipe": false,
    "category_canonical": "autre",
    "difficulty_canonical": "non_specifie",
    "tags": [],
    "main_ingredients": [],
    "aliases": [],
    "search_text": "La kebbe crue du liban sud frake naye.html",
    "source": "olj",
    "raw_category": null,
    "raw_difficulty": null,
    "raw_enrichment_present": true
  },
  {
    "url": "https://www.lorientlejour.com/cuisine-liban-a-table/1462364/capellini-aux-crevettes-fast-and-fabulous-.html",
    "title": "Capellini aux crevettes fast and fabulous .html",
    "chef_name": null,
    "cuisine_type": null,
    "is_lebanese": false,
    "is_recipe": false,
    "category_canonical": "autre",
    "difficulty_canonical": "non_specifie",
    "tags": [],
    "main_ingredients": [],
    "aliases": [],
    "search_text": "Capellini aux crevettes fast and fabulous .html",
    "source": "olj",
    "raw_category": null,
    "raw_difficulty": null,
    "raw_enrichment_present": true
  },
  {
    "url": "https://www.lorientlejour.com/cuisine-liban-a-table/1463821/cookies-au-zaatar-chocolat-et-noisettes.html",
    "title": "Cookies au zaatar chocolat et noisettes.html",
    "chef_name": null,
    "cuisine_type": null,
    "is_lebanese": false,
    "is_recipe": false,
    "category_canonical": "autre",
    "difficulty_canonical": "non_specifie",
    "tags": [],
    "main_ingredients": [],
    "aliases": [],
    "search_text": "Cookies au zaatar chocolat et noisettes.html",
    "source": "olj",
    "raw_category": null,
    "raw_difficulty": null,
    "raw_enrichment_present": true
  },
  {
    "url": "https://www.lorientlejour.com/cuisine-liban-a-table/1468691/moghrabieh.html",
    "title": "Moghrabieh.html",
    "chef_name": null,
    "cuisine_type": null,
    "is_lebanese": false,
    "is_recipe": false,
    "category_canonical": "autre",
    "difficulty_canonical": "non_specifie",
    "tags": [],
    "main_ingredients": [],
    "aliases": [],
    "search_text": "Moghrabieh.html",
    "source": "olj",
    "raw_category": null,
    "raw_difficulty": null,
    "raw_enrichment_present": true
  },
  {
    "url": "https://www.lorientlejour.com/cuisine-liban-a-table/1463823/le-cheese-cake-a-la-labne-aux-betteraves-et-au-sirop-de-rose.html",
    "title": "Le cheese cake a la labne aux betteraves et au sirop de rose.html",
    "chef_name": null,
    "cuisine_type": null,
    "is_lebanese": false,
    "is_recipe": false,
    "category_canonical": "autre",
    "difficulty_canonical": "non_specifie",
    "tags": [],
    "main_ingredients": [],
    "aliases": [],
    "search_text": "Le cheese cake a la labne aux betteraves et au sirop de rose.html",
    "source": "olj",
    "raw_category": null,
    "raw_difficulty": null,
    "raw_enrichment_present": true
  },
  {
    "url": "https://www.lorientlejour.com/cuisine-liban-a-table/1292565/les-oignons-farcis-au-riz-et-aux-amandes-de-karim-arsanios.html",
    "title": "Les oignons farcis au riz et aux amandes de karim arsanios.html",
    "chef_name": null,
    "cuisine_type": null,
    "is_lebanese": false,
    "is_recipe": false,
    "category_canonical": "autre",
    "difficulty_canonical": "non_specifie",
    "tags": [],
    "main_ingredients": [],
    "aliases": [],
    "search_text": "Les oignons farcis au riz et aux amandes de karim arsanios.html",
    "source": "olj",
    "raw_category": null,
    "raw_difficulty": null,
    "raw_enrichment_present": true
  },
  {
    "url": "https://www.lorientlejour.com/cuisine-liban-a-table/1485823/fine-bouche-se-reinvente-en-restaurant-bar-en-plein-coeur-dachrafieh.html",
    "title": "Fine bouche se reinvente en restaurant bar en plein coeur dachrafieh.html",
    "chef_name": null,
    "cuisine_type": null,
    "is_lebanese": false,
    "is_recipe": false,
    "category_canonical": "autre",
    "difficulty_canonical": "non_specifie",
    "tags": [],
    "main_ingredients": [],
    "aliases": [],
    "search_text": "Fine bouche se reinvente en restaurant bar en plein coeur dachrafieh.html",
    "source": "olj",
    "raw_category": null,
    "raw_difficulty": null,
    "raw_enrichment_present": true
  },
  {
    "url": "https://www.lorientlejour.com/cuisine-liban-a-table/1469087/samkeh-harra-a-la-mode-de-tripoli-poisson-epice-a-la-mode-de-tripoli.html",
    "title": "Samkeh Harra à la mode de Tripoli (Poisson épicé) d'Alan Geaam",
    "chef_name": "Alan Geaam, chef étoilé",
    "cuisine_type": "libanaise",
    "is_lebanese": true,
    "is_recipe": false,
    "category_canonical": "plat_principal",
    "difficulty_canonical": "non_specifie",
    "tags": [
      "recette libanaise",
      "recettes alan geaam",
      "cuisine libanaise",
      "chef libanais",
      "alan geaam",
      "plat principal",
      "mezzé",
      "recette végétarienne"
    ],
    "main_ingredients": [
      "cabillaud",
      "huile d'olive",
      "coriandre",
      "ail",
      "sauce tarator",
      "coriandre",
      "persil",
      "pignons de pin",
      "pistaches",
      "amandes",
      "poudre de chili",
      "sel",
      "poivre blanc"
    ],
    "aliases": [],
    "search_text": "Samkeh Harra à la mode de Tripoli (Poisson épicé) d'Alan Geaam Alan Geaam, chef étoilé  1 kg de cabillaud 30 ml d'huile d'olive 3 g de coriandre en poudre 12 gousses d'ail 180 g de sauce tarator (voir la recette ici) 30 g de coriandre 30 g de persil 20 g de pignons de pin, pistaches ou amandes 3 g de poudre de chili Sel et poivre blanc  recette libanaise recettes alan geaam cuisine libanaise chef libanais alan geaam plat principal mezzé recette végétarienne  cabillaud huile d'olive coriandre ail sauce tarator coriandre persil pignons de pin pistaches amandes poudre de chili sel poivre blanc",
    "source": "olj",
    "raw_category": "plat principal",
    "raw_difficulty": "inconnu",
    "raw_enrichment_present": true
  },
  {
    "url": "https://www.lorientlejour.com/cuisine-liban-a-table/1485763/-love-baklawas-un-hymne-aux-douceurs-du-chef-alan-geaam-ma-preferee-reste-la-mafrouke-.html",
    "title": "Love baklawas un hymne aux douceurs du chef alan geaam ma preferee reste la mafrouke .html",
    "chef_name": null,
    "cuisine_type": null,
    "is_lebanese": false,
    "is_recipe": false,
    "category_canonical": "autre",
    "difficulty_canonical": "non_specifie",
    "tags": [],
    "main_ingredients": [],
    "aliases": [],
    "search_text": "Love baklawas un hymne aux douceurs du chef alan geaam ma preferee reste la mafrouke .html",
    "source": "olj",
    "raw_category": null,
    "raw_difficulty": null,
    "raw_enrichment_present": true
  },
  {
    "url": "https://www.lorientlejour.com/cuisine-liban-a-table/1469401/soujouk-saucisses-epicees-a-la-sauce-citron-tomate-yerchik.html",
    "title": "Soujouk (saucisses épicées) à la sauce citron-tomate d'Aline Kamakian",
    "chef_name": "Aline Kamakian, cheffe engagée",
    "cuisine_type": "libanaise",
    "is_lebanese": true,
    "is_recipe": false,
    "category_canonical": "plat_principal",
    "difficulty_canonical": "facile",
    "tags": [
      "recette arménienne",
      "recettes aline kamakian",
      "aline kamakian",
      "mezzé",
      "entrée",
      "chef libanais"
    ],
    "main_ingredients": [
      "saucisses épicées",
      "tomates",
      "jus de citron",
      "huile de tournesol",
      "pâte de piment rouge"
    ],
    "aliases": [],
    "search_text": "Soujouk (saucisses épicées) à la sauce citron-tomate d'Aline Kamakian Aline Kamakian, cheffe engagée  4 saucisses épicées (soujouk) 15 ml d’huile de tournesol (1 cuillère à soupe) 6 tomates, pelées et coupées en dés 1 cuillère à soupe de pâte de piment rouge (environ 15 g) 30 ml de jus de citron (2 cuillères à soupe)  recette arménienne recettes aline kamakian aline kamakian mezzé entrée chef libanais  saucisses épicées tomates jus de citron huile de tournesol pâte de piment rouge",
    "source": "olj",
    "raw_category": "plat principal",
    "raw_difficulty": "facile",
    "raw_enrichment_present": true
  },
  {
    "url": "https://www.lorientlejour.com/cuisine-liban-a-table/1485313/tarek-alameddine-quand-lex-mauvais-eleve-devient-le-premier-libanais-prime-aux-best-chef-awards.html",
    "title": "Tarek alameddine quand lex mauvais eleve devient le premier libanais prime aux best chef awards.html",
    "chef_name": null,
    "cuisine_type": null,
    "is_lebanese": false,
    "is_recipe": false,
    "category_canonical": "autre",
    "difficulty_canonical": "non_specifie",
    "tags": [],
    "main_ingredients": [],
    "aliases": [],
    "search_text": "Tarek alameddine quand lex mauvais eleve devient le premier libanais prime aux best chef awards.html",
    "source": "olj",
    "raw_category": null,
    "raw_difficulty": null,
    "raw_enrichment_present": true
  },
  {
    "url": "https://www.lorientlejour.com/cuisine-liban-a-table/1345246/la-labne-et-pois-chiches-a-la-harissa-de-hugo.html",
    "title": "La labné et pois chiches à la harissa de Hugo Danaguezian",
    "chef_name": "Hugo Danaguezian, tombé très tôt dans la marmite",
    "cuisine_type": "libanaise",
    "is_lebanese": true,
    "is_recipe": false,
    "category_canonical": "mezze_froid",
    "difficulty_canonical": "facile",
    "tags": [
      "recette",
      "cuisine libanaise",
      "recette libanaise",
      "mezzé",
      "entrée"
    ],
    "main_ingredients": [
      "labneh",
      "pois chiches",
      "oignons",
      "ail",
      "jus de citron",
      "cumin",
      "coriandre",
      "harissa"
    ],
    "aliases": [],
    "search_text": "La labné et pois chiches à la harissa de Hugo Danaguezian Hugo Danaguezian, tombé très tôt dans la marmite  300 gr de labné (ou 350 gr de yaourt de brebis) 20 gr de pois chiches en conserve, égouttés 2 oignons rouges 4 gousses d’ail 1 c. à s. de jus de citron 1 c. à c. de cumin moulu 1 c. à c. de graines de coriandre moulues 2 c. à s. de harissa berbère Optionnel : 100g de peaux de poulet (idéalement prélevées sur des hauts de cuisse)  recette cuisine libanaise recette libanaise mezzé entrée  labneh pois chiches oignons ail jus de citron cumin coriandre harissa",
    "source": "olj",
    "raw_category": "mezze",
    "raw_difficulty": "facile",
    "raw_enrichment_present": true
  },
  {
    "url": "https://www.lorientlejour.com/cuisine-liban-a-table/1360631/quand-la-joue-de-boeuf-confite-seveille-sur-des-accents-tanniques.html",
    "title": "Joue de bœuf confite (qui s’éveille sur des accents tanniques)",
    "chef_name": "Dany Khairallah, chef exécutif",
    "cuisine_type": "méditerranéenne",
    "is_lebanese": false,
    "is_recipe": true,
    "category_canonical": "plat_principal",
    "difficulty_canonical": "moyenne",
    "tags": [
      "vin",
      "cuisine",
      "recette",
      "plat principal"
    ],
    "main_ingredients": [
      "joue de bœuf",
      "vin rouge",
      "tomates",
      "ail",
      "thym"
    ],
    "aliases": [],
    "search_text": "Joue de bœuf confite (qui s’éveille sur des accents tanniques) Dany Khairallah, chef exécutif Le choix de Château Ksara :« Avec la joue de bœuf, nous vous proposons la Cuvée Troisième Millénaire 2020. Ce vin est fermenté à partir de petit verdot, cabernet franc et syrah. Les tanins de ce vin, provenant surtout du petit verdot, se marient bien avec les protéines et le gras de cette viande et lui confèrent une belle longueur en bouche. Ses notes fruitées contre-balancent le côté épicé et salé de la viande, surtout les notes de pruneau, myrtille et noisette du petit verdot, groseille du cabernet franc et la réglisse poivrée de la syrah. Elles mettent toutes en valeur la joue de bœuf ainsi que ce vin corsé et élégamment tannique. » 4 joues de bœuf de 350 gr chacune 4 c. à s. de sel 4 c. à s. de poivre noir concassé 2 c. à s. de piment doux (paprika) 16 gousses d’ail 250 gr bouquet garni 8 tiges de thym français 800 ml d’eau 800 gr de tomates pelées 200 ml de fond de veau (existe en version déshydratée à laquelle il faut ajouter de l’eau) 600 ml de vin rouge 200 ml d’huile d’olive. Faire chauffer le four à 125 °C (avec vapeur si possible) Mélanger les épices et en enrober la viande Verser l’huile d’olive dans une cocotte chauffée à feu moyen/fort. Saisir les pièces de viande dans la cocotte afin de les faire dorer sur toutes les faces. Une fois que la viande a obtenu une belle dorure, ajouter le bouquet garni, les aromates, le fond de veau et le vin rouge. Porter à ébullition à feu vif, puis couvrir et laisser cuire au four pendant cinq heures. Retirer les pièces de viande de la cocotte et les écraser à l’aide d’une fourchette. Porter la cocotte à feu vif pendant 5 minutes afin de faire réduire la sauce. Peut être servi avec une purée de pomme de terre. vin cuisine recette plat principal  joue de bœuf vin rouge tomates ail thym",
    "source": "olj",
    "raw_category": "plat principal",
    "raw_difficulty": "moyenne",
    "raw_enrichment_present": true
  },
  {
    "url": "https://www.lorientlejour.com/cuisine-liban-a-table/1340947/le-taboule-du-fruit-defendu-au-plat-favori-des-libanais.html",
    "title": "Le taboule du fruit defendu au plat favori des libanais.html",
    "chef_name": null,
    "cuisine_type": null,
    "is_lebanese": false,
    "is_recipe": false,
    "category_canonical": "autre",
    "difficulty_canonical": "non_specifie",
    "tags": [],
    "main_ingredients": [],
    "aliases": [],
    "search_text": "Le taboule du fruit defendu au plat favori des libanais.html",
    "source": "olj",
    "raw_category": null,
    "raw_difficulty": null,
    "raw_enrichment_present": true
  },
  {
    "url": "https://www.lorientlejour.com/cuisine-liban-a-table/1469393/salade-dolives-et-de-noix-tzitabedoughi-yev-engouizi-aghtsan.html",
    "title": "Salade d’olives et de noix d'Aline Kamakian",
    "chef_name": "Aline Kamakian, cheffe engagée",
    "cuisine_type": "libanaise",
    "is_lebanese": true,
    "is_recipe": false,
    "category_canonical": "mezze_froid",
    "difficulty_canonical": "facile",
    "tags": [
      "recette arménienne",
      "recette automne",
      "recettes aline kamakian",
      "aline kamakian",
      "chef libanais",
      "recette de carême",
      "recette végétarienne",
      "entrée",
      "mezzé",
      "recette vegan"
    ],
    "main_ingredients": [
      "olives",
      "tomate",
      "oignon",
      "noix",
      "piment",
      "huile d'olive",
      "mélasse de grenade",
      "citron",
      "persil"
    ],
    "aliases": [],
    "search_text": "Salade d’olives et de noix d'Aline Kamakian Aline Kamakian, cheffe engagée  225 g d’olives vertes 2 tomates, coupées en petits dés 1 oignon blanc, finement haché 1 cuillère à soupe de pâte de piment rouge 2 cuillères à soupe d’huile d’olive (environ 30 ml) 2 cuillères à soupe de mélasse de grenade (environ 30 ml) Le jus de 1 citron et demi 60 g de cerneaux de noix 2 cuillères à soupe de persil frais, lavé et finement haché  recette arménienne recette automne recettes aline kamakian aline kamakian chef libanais recette de carême recette végétarienne entrée mezzé recette vegan  olives tomate oignon noix piment huile d'olive mélasse de grenade citron persil",
    "source": "olj",
    "raw_category": "mezze",
    "raw_difficulty": "facile",
    "raw_enrichment_present": true
  },
  {
    "url": "https://www.lorientlejour.com/cuisine-liban-a-table/1463965/le-ragout-dartichaut-au-citron-confit-de-lea-sednaoui-une-recette-aux-accents-nord-africains.html",
    "title": "Le ragoût d'artichaut au citron confit de Léa Sednaoui, une recette aux accents nord-africains",
    "chef_name": "Léa Sednaoui, chef du goût et du bien-être",
    "cuisine_type": "nord-africaine",
    "is_lebanese": false,
    "is_recipe": false,
    "category_canonical": "plat_principal",
    "difficulty_canonical": "facile",
    "tags": [
      "recette",
      "diaspora libanaise",
      "cuisine méditerranéenne",
      "plat principal",
      "recette végétarienne",
      "recette vegan"
    ],
    "main_ingredients": [
      "artichaut",
      "citron confit",
      "fèves",
      "petits pois",
      "menthe"
    ],
    "aliases": [],
    "search_text": "Le ragoût d'artichaut au citron confit de Léa Sednaoui, une recette aux accents nord-africains Léa Sednaoui, chef du goût et du bien-être « En 2020, je me suis découvert une passion pour la cuisine nord-africaine. Ses épices, ses ragoûts, ses saveurs de la terre et du désert qui pénètrent le cœur et qui rassemblent les hommes », dit Léa Senaoui pour expliquer pourquoi elle a choisi de partager cette recette. 30 ml d'huile d'olive 4 gousses d'ail, coupées en fines tranches Le zeste d'un citron 400 g d'échalotes, coupées en fines lamelles 10 g de sel 1 c. à c. de poudre de lime 1 c. à c. de poudre de graines de cumin 1 c. à c. de poudre de graines de coriandre 4 cœurs d'artichauts, congelés ou en saumure, coupés en deux ou en quarts 1 citron confit, coupé en fines lamelles 200 g de fèves fraîches, épluchées 100 g de petits pois, congelés 20 ml de jus de citron 30 g de menthe fraîche, ciselée 30 g de persil frais, ciselée 30 g de coriandre fraîche, ciselée Un peu de poivre blanc.  recette diaspora libanaise cuisine méditerranéenne plat principal recette végétarienne recette vegan  artichaut citron confit fèves petits pois menthe",
    "source": "olj",
    "raw_category": "plat principal",
    "raw_difficulty": "facile",
    "raw_enrichment_present": true
  },
  {
    "url": "https://www.lorientlejour.com/cuisine-liban-a-table/1238670/le-burghol-daubergines-fumees-de-joe-barza.html",
    "title": "Le burghol d’aubergines fumées de Joe Barza",
    "chef_name": "Joe Barza, chef et consultant hyperactif",
    "cuisine_type": "libanaise",
    "is_lebanese": true,
    "is_recipe": true,
    "category_canonical": "mezze_froid",
    "difficulty_canonical": "facile",
    "tags": [
      "recette",
      "recette végétarienne",
      "cuisine",
      "mezzé",
      "recette libanaise",
      "entrée",
      "recette de carême"
    ],
    "main_ingredients": [
      "aubergines",
      "burghol",
      "tahina",
      "labneh",
      "citron"
    ],
    "aliases": [],
    "search_text": "Le burghol d’aubergines fumées de Joe Barza Joe Barza, chef et consultant hyperactif Voici ce que Joe Barza dit de sa recette : « J’ai toujours choisi d’emprunter des chemins différents en matière de gastronomie locale, d’explorer de nouvelles saveurs et techniques, de privilégier les produits locaux, bien avant que ce phénomène ne soit devenu à la mode au Liban. (...) Chaque jour, et maintenant plus que jamais, je suis fier de ce choix parce qu’il m’a permis de traduire dans ma cuisine mon amour et mon attachement à mon pays. J’ai pu inspirer de nombreux jeunes chefs à faire de même. (...) Pourquoi ne pas envisager un burghol d’aubergines fumées ? Je peux ainsi utiliser des produits frais, saisonniers et accessibles à tout le monde, ce qui est une bonne chose en temps de crise, et les transformer. Un retour aux sources est toujours bénéfique, il nous permet de nous reconnecter avec la nature et d’apprécier ce qu’elle nous offre ». 500g d’aubergines grillées sans la peau 50g d’oignons blancs, finement hachés 1 gousse d’ail 5g de coriandre fraîche, finement hachée 70g d’huile d’olive extravierge 100g de burghol fin 2g de curcuma 50g de tahina 1 c. à soupe de labneh Le jus d’un citron entier 5g de sel Une pincée de poivre noir. Pour la garniture : 10 feuilles de menthe 10 feuilles de coriandre fraîche 4g de graines de grenade 30g de poivrons rouges grillés sans la peau. Dans un bol, placez les aubergines grillées, une gousse d’ail, les oignons, le burghol, la cuillerée à soupe de labneh, la tahina, un peu de jus de citron et les feuilles de coriandre hâchées. Salez et poivrez selon votre goût et ajoutez une pincée de curcuma. Ajoutez un filet d’huile d’olive extravierge. Mixez jusqu’à obtenir une consistance bien lisse. Réfrigérez pendant 30 minutes. Disposez dans le fond des moules le poivron grillé. Versez la préparation d’aubergines au-dessus. Garnissez avec les graines de grenade, les feuilles de menthe et de coriandre. recette recette végétarienne cuisine mezzé recette libanaise entrée recette de carême  aubergines burghol tahina labneh citron",
    "source": "olj",
    "raw_category": "mezze",
    "raw_difficulty": "facile",
    "raw_enrichment_present": true
  },
  {
    "url": "https://www.lorientlejour.com/cuisine-liban-a-table/1463966/la-moghrabiye-aux-champignons-sauvages-de-yasmina-hayek-et-em-sherif-un-mariage-unique-de-saveurs-.html",
    "title": "La moghrabiyé aux champignons sauvages de Yasmina Hayek et Em Sherif  : un « mariage unique de saveurs »",
    "chef_name": "Yasmina Hayek, la restauration comme passion",
    "cuisine_type": "méditerranéenne",
    "is_lebanese": false,
    "is_recipe": true,
    "category_canonical": "plat_principal",
    "difficulty_canonical": "facile",
    "tags": [
      "recette",
      "recette automne",
      "diaspora libanaise",
      "plat principal",
      "recette libanaise",
      "cuisine libanaise",
      "yasmina hayek"
    ],
    "main_ingredients": [
      "moghrabiyé",
      "bouillon de volaille",
      "crème fraîche",
      "champignons sauvages",
      "échalote",
      "ail"
    ],
    "aliases": [],
    "search_text": "La moghrabiyé aux champignons sauvages de Yasmina Hayek et Em Sherif  : un « mariage unique de saveurs » Yasmina Hayek, la restauration comme passion « La moghrabiyé, ou perles de semoule, est un produit sous-estimé dans notre culture culinaire, alors qu'il a le potentiel d'être utilisé comme une alternative savoureuse aux pâtes. J’ai voulu partager cette recette que nous servons dans nos restaurants à Monaco et à Doha parce qu’elle met justement ce produit en avant à travers un mariage de saveurs unique », explique Yasmina Hayek 500 g de moghrabiyé sèche 1,5 l de bouillon de volaille 500 ml de crème fraîche ou 500 g de moghrabiyé fraîche 1 l de bouillon de volaille 300 ml de crème fraîche 1 échalote 2 cuillères à soupe d’huile d’olive 20 g de beurre 2 gousses d’ail Une pincée de carvi Une pincée de cannelle Une pincée de poivre noir 1 c. à c. de sel fin 500 g de champignons sauvages (assortiment de saison) 2 branches de thym frais 1 gousse d’ail 1 cuillère à soupe d’huile d’olive 10 g de beurre Ciboulette ciselée Huile d’olive extravierge. Émincer finement l’échalote et la faire suer dans l’huile d’olive et le beurre. Une fois translucide, y ajouter l’ail et faire revenir. Nettoyer les champignons et ajouter 1/4 de la quantité dans le mélange d’ail et d’échalote. Faire revenir. Ajouter les épices et le sel. Ajouter la moghrabiyé et mouiller avec le bouillon de volaille et la crème. Cuire pendant environ une dizaine de minutes, jusqu’à ce que les perles soient légèrement fondantes. Préparer les champignons en les faisant sauter dans le beurre et l’huile d’olive avec une branche de thym. Saler jusqu’à ce qu’ils deviennent bien dorés. Servir la moghrabiyé dans un plat, parsemer de champignons sautés et garnir de ciboulette ciselée. Arroser d’un filet d’huile d’olive extravierge. recette recette automne diaspora libanaise plat principal recette libanaise cuisine libanaise yasmina hayek  moghrabiyé bouillon de volaille crème fraîche champignons sauvages échalote ail",
    "source": "olj",
    "raw_category": "plat principal",
    "raw_difficulty": "facile",
    "raw_enrichment_present": true
  },
  {
    "url": "https://www.lorientlejour.com/cuisine-liban-a-table/1468727/moujadra-de-boulghour.html",
    "title": "Moujadra de boulghour.html",
    "chef_name": null,
    "cuisine_type": null,
    "is_lebanese": false,
    "is_recipe": false,
    "category_canonical": "autre",
    "difficulty_canonical": "non_specifie",
    "tags": [],
    "main_ingredients": [],
    "aliases": [],
    "search_text": "Moujadra de boulghour.html",
    "source": "olj",
    "raw_category": null,
    "raw_difficulty": null,
    "raw_enrichment_present": true
  },
  {
    "url": "https://www.lorientlejour.com/cuisine-liban-a-table/1468717/feuilles-de-chou-farcies-mehcheh-malfouf.html",
    "title": "Feuilles de chou farcies mehcheh malfouf.html",
    "chef_name": null,
    "cuisine_type": null,
    "is_lebanese": false,
    "is_recipe": false,
    "category_canonical": "autre",
    "difficulty_canonical": "non_specifie",
    "tags": [],
    "main_ingredients": [],
    "aliases": [],
    "search_text": "Feuilles de chou farcies mehcheh malfouf.html",
    "source": "olj",
    "raw_category": null,
    "raw_difficulty": null,
    "raw_enrichment_present": true
  },
  {
    "url": "https://www.lorientlejour.com/cuisine-liban-a-table/1349138/le-gateau-au-chocolat-de-sandra-boghos-letayf-sandys-kitchen.html",
    "title": "Le gâteau au chocolat de Sandra Boghos Letayf, Sandy’s Kitchen",
    "chef_name": "Sandra Boghos Letayf, pâtissière autodidacte",
    "cuisine_type": "méditerranéenne",
    "is_lebanese": false,
    "is_recipe": false,
    "category_canonical": "dessert",
    "difficulty_canonical": "facile",
    "tags": [
      "recette",
      "dessert",
      "chocolat",
      "cuisine"
    ],
    "main_ingredients": [
      "farine",
      "sucre",
      "cacao",
      "huile",
      "œuf",
      "lait"
    ],
    "aliases": [],
    "search_text": "Le gâteau au chocolat de Sandra Boghos Letayf, Sandy’s Kitchen Sandra Boghos Letayf, pâtissière autodidacte « Ma recette préférée est ce gâteau au chocolat que j’ai dévoilé pour la première fois pendant le confinement en 2020 », explique Sandra Boghos Letayf deSandy’s Kitchen.Depuis, la recette a été vue des millions de fois sur Instgramet TikTok, « parce qu’elle est facile et surtout délicieuse ». 200 g de farine tamisée 300 g de sucre brut (il est possible de le remplacer par n’importe quel autre sucre) 50 g de cacao en poudre tamisé 1,5 c. à c. de bicarbonate de soude 1,5 c. à c. de levure chimique 1/2 c. à c. de sel 80 ml d’huile végétale 1 gros œuf 1 c. à s. de vanille 190 ml de lait 190 ml d’eau bouillante + 1 cuillère à café de café en poudre mélangée. Pour la sauce : 150 g de chocolat au lait (ou noir, selon les préférences) 150 ml de crème fouettée 35 % de matière grasse  recette dessert chocolat cuisine  farine sucre cacao huile œuf lait",
    "source": "olj",
    "raw_category": "dessert",
    "raw_difficulty": "facile",
    "raw_enrichment_present": true
  },
  {
    "url": "https://www.lorientlejour.com/cuisine-liban-a-table/1468817/siyyadiye-poisson-blanc-aux-oignons-confits-et-riz.html",
    "title": "La siyyadiyé (Poisson blanc aux oignons confits) de Tara Khattar",
    "chef_name": "Tara Khattar, cheffe et ambitieuse entrepreneuse",
    "cuisine_type": "libanaise",
    "is_lebanese": true,
    "is_recipe": false,
    "category_canonical": "plat_principal",
    "difficulty_canonical": "moyenne",
    "tags": [
      "recette libanaise",
      "recettes tara khattar",
      "tara khattar",
      "cuisine libanaise",
      "plat principal",
      "chef libanais"
    ],
    "main_ingredients": [
      "poisson blanc",
      "riz",
      "oignons",
      "cumin",
      "pignons de pin"
    ],
    "aliases": [],
    "search_text": "La siyyadiyé (Poisson blanc aux oignons confits) de Tara Khattar Tara Khattar, cheffe et ambitieuse entrepreneuse Tara Khattar : « La siyyadiyé est un plat à base de riz et de poisson blanc. Le riz a une couleur marron foncé due aux oignons caramélisés. Ce plat est un peu long à réaliser mais il en vaut la peine. » 1 gros poisson blanc type loup de mer (loukkos) 6 gros oignons 6 verres de riz 11 d'huile pour friture type canola 4 citrons jaunes 1 cuil. à soupe de cumin en poudre 50 g de pignons de pin 1 noisette de beurre Sel, poivre  recette libanaise recettes tara khattar tara khattar cuisine libanaise plat principal chef libanais  poisson blanc riz oignons cumin pignons de pin",
    "source": "olj",
    "raw_category": "plat principal",
    "raw_difficulty": "moyenne",
    "raw_enrichment_present": true
  },
  {
    "url": "https://www.lorientlejour.com/cuisine-liban-a-table/1426265/bouza-et-plus-la-longue-histoire-damour-du-liban-avec-la-creme-glacee.html",
    "title": "Bouza et plus la longue histoire damour du liban avec la creme glacee.html",
    "chef_name": null,
    "cuisine_type": null,
    "is_lebanese": false,
    "is_recipe": false,
    "category_canonical": "autre",
    "difficulty_canonical": "non_specifie",
    "tags": [],
    "main_ingredients": [],
    "aliases": [],
    "search_text": "Bouza et plus la longue histoire damour du liban avec la creme glacee.html",
    "source": "olj",
    "raw_category": null,
    "raw_difficulty": null,
    "raw_enrichment_present": true
  },
  {
    "url": "https://www.lorientlejour.com/cuisine-liban-a-table/1469078/aubergines-et-courgettes-farcies-battenjen-w-koussa-mehche.html",
    "title": "Battenjen w Koussa mehché (Aubergines et courgettes farcies) de Tara Khattar",
    "chef_name": "Tara Khattar, cheffe et ambitieuse entrepreneuse",
    "cuisine_type": "libanaise",
    "is_lebanese": true,
    "is_recipe": false,
    "category_canonical": "plat_principal",
    "difficulty_canonical": "facile",
    "tags": [
      "recette vegan",
      "recettes tara khattar",
      "tara khattar",
      "recette végétarienne",
      "plat principal",
      "recette de carême",
      "recette libanaise",
      "chef libanais"
    ],
    "main_ingredients": [
      "courgette",
      "aubergine",
      "riz",
      "persil",
      "menthe",
      "tomate",
      "oignon"
    ],
    "aliases": [],
    "search_text": "Battenjen w Koussa mehché (Aubergines et courgettes farcies) de Tara Khattar Tara Khattar, cheffe et ambitieuse entrepreneuse Tara Khattar : « Ce plat est végétalien. Ma grand-mère préfère les aubergines et les courgettes mais plusieurs variantes sont possibles. On peut aussi utiliser des poivrons verts et des tomates. » 12 petites courgettes 12 petites aubergines 150 g de riz 1 bouquet de persil 10 feuilles de menthe fraîche 2 tomates 1 petit oignon 6 cl d'huile d'olive Le jus de 2 citrons 1 cuil. à café de sel 1/2 cuil. à café de poivre noir  recette vegan recettes tara khattar tara khattar recette végétarienne plat principal recette de carême recette libanaise chef libanais  courgette aubergine riz persil menthe tomate oignon",
    "source": "olj",
    "raw_category": "plat principal",
    "raw_difficulty": "facile",
    "raw_enrichment_present": true
  },
  {
    "url": "https://www.lorientlejour.com/cuisine-liban-a-table/1234792/les-tartelettes-aux-fruits-dautomne-de-farid-chehab.html",
    "title": "Les tartelettes aux fruits d’automne de Farid Chehab",
    "chef_name": "Farid Chehab, chef entrepreneur",
    "cuisine_type": "méditerranéenne",
    "is_lebanese": false,
    "is_recipe": false,
    "category_canonical": "dessert",
    "difficulty_canonical": "facile",
    "tags": [
      "cuisine",
      "recette automne",
      "cuisine méditerranéenne",
      "dessert",
      "recette",
      "chef libanais",
      "recette végétarienne",
      "recette libanaise"
    ],
    "main_ingredients": [
      "lait",
      "crème fraîche",
      "jaunes d’œufs",
      "sucre",
      "farine",
      "pommes",
      "pêches"
    ],
    "aliases": [],
    "search_text": "Les tartelettes aux fruits d’automne de Farid Chehab Farid Chehab, chef entrepreneur « La tarte aux pommes et pêches d’automne est un dessert que j’ai ajouté à ma carte de Bkerzay. Je l’ai choisi, car ces deux fruits mûrissent en fin d’été et nous accompagnent en automne, parce que leur prix est abordable mais aussi. Leurs qualités, tant au niveau du goût que de la texture, en font également une belle option, surtout lorsqu’ils sont associés dans une même recette. La saveur sucrée de l’un s’équilibrant avec la pointe d’acidité de l’autre, la douceur avec la fermeté. Enfin, ces deux fruits renferment de nombreuses vitamines et antioxydants, et on le sait bien, 'An apple a day keeps the doctor away !'. » Pour la crème pâtissière : 150 g de lait 100 g de crème fraîche 3 jaunes d’œufs 75 g de sucre semoule 13 g de farine 30 g de sirop de vanille ou 2 c. à sucre de sucre vanillé 10 g de menthe hachée 10 g de jus de citron. Pour la pâte sablée : 250 g de farine 120 g de beurre 100 g de sucre 20 g de jaune d’œuf 2 g de sel. et aussi 2 pommes vertes 2 pommes rouges 4 pêches 8 feuilles de menthe sumac  cuisine recette automne cuisine méditerranéenne dessert recette chef libanais recette végétarienne recette libanaise  lait crème fraîche jaunes d’œufs sucre farine pommes pêches",
    "source": "olj",
    "raw_category": "dessert",
    "raw_difficulty": "facile",
    "raw_enrichment_present": true
  },
  {
    "url": "https://www.lorientlejour.com/cuisine-liban-a-table/1469385/salade-armenienne-de-boulghour-et-tomate-itch.html",
    "title": "Salade arménienne de boulghour et tomate (Itch)",
    "chef_name": "Aline Kamakian, cheffe engagée",
    "cuisine_type": "arménienne",
    "is_lebanese": false,
    "is_recipe": false,
    "category_canonical": "salade",
    "difficulty_canonical": "facile",
    "tags": [
      "recette végétarienne",
      "aline kamakian",
      "recette arménienne",
      "recette de carême",
      "recette vegan",
      "entrée",
      "mezzé",
      "chef libanais"
    ],
    "main_ingredients": [
      "tomate",
      "boulghour",
      "oignon",
      "poivron",
      "persil",
      "menthe"
    ],
    "aliases": [],
    "search_text": "Salade arménienne de boulghour et tomate (Itch) Aline Kamakian, cheffe engagée « Au début de l’été, nous avions l’habitude de nous réunir entre amis et en famille pour préparerl’itch. Pour réussir cette salade, il faut absolument de bonnes tomates mûries au soleil et de jeunes feuilles de vigne fraîches : le premieritchde l’année ne se mange pas avec du chou. À la place, on utilise les feuilles de vigne pour saisir une bouchée avec les doigts. Ce premieritchde l’été était toujours une fête », explique Vartouhie, la mère d'Aline Kamakian, originaire de Musa Ler — ou Musa Dagh — la montagne située à la frontière entre la Syrie et la Turquie actuelles. 3 tomates bien mûres, pelées et coupées en dés 1 oignon, finement haché 1 poivron vert 80 g de boulghour blanc moyen 250 ml d’eau 2 à 4 cuillères à soupe d’huile d’olive 1 cuillère à café de sel 1 cuillère à soupe de pâte de piment rouge fort ½ cuillère à café de mélange de sept épices 2 cuillères à soupe de persil frais haché 2 oignons nouveaux 3 feuilles de menthe fraîche, finement ciselées  recette végétarienne aline kamakian recette arménienne recette de carême recette vegan entrée mezzé chef libanais  tomate boulghour oignon poivron persil menthe",
    "source": "olj",
    "raw_category": "salade",
    "raw_difficulty": "facile",
    "raw_enrichment_present": true
  },
  {
    "url": "https://www.lorientlejour.com/cuisine-liban-a-table/1367909/les-fusilli-a-la-creme-de-citron-de-sabyl-ghoussoub.html",
    "title": "Les fusilli à la crème de citron de Sabyl Ghoussoub",
    "chef_name": "Sabyl Ghoussoub, chef d'un jour",
    "cuisine_type": "italienne",
    "is_lebanese": false,
    "is_recipe": false,
    "category_canonical": "plat_principal",
    "difficulty_canonical": "facile",
    "tags": [
      "sabyl ghoussoub",
      "cuisine méditerranéenne",
      "recette végétarienne",
      "recette",
      "plat principal",
      "cuisine"
    ],
    "main_ingredients": [
      "fusilli",
      "citron",
      "crème fraîche",
      "beurre",
      "parmesan"
    ],
    "aliases": [],
    "search_text": "Les fusilli à la crème de citron de Sabyl Ghoussoub Sabyl Ghoussoub, chef d'un jour Comme pour tout ce qu’il fait, la cuisine est pour Sabyl Ghoussoub essentiellement un moment de partage. De rires échangés, de moments de bonheur et de bien-être, de souvenirs indélébiles. Manger seul ? Pas pour lui… Cuisiner pour soi ? Encore moins… « Il y a, dit-il, un bonheur à préparer à manger pour les autres. » Des choses simples, « d’une simplicité déconcertante », préparées au feeling, accompagnées toujours d’une musique qui complète ce moment convivial et chaleureux « avec les gens qu’on aime ». « Quelle tristesse de le faire seul ! » souligne-t-il en se mettant aux fourneaux. À la fois timide et généreux, il circule en cuisine avec une nonchalance maladroite, un peu perdu, toujours souriant, une sincère autodérision au bout des lèvres. Entre la râpe qui ne fonctionne pas bien, des gestes hésitants, une certaine improvisation, il confie, en plaisantant : « Je viens de décider de changer de métier. Je vais être cuisinier. » Et quand on lui demande pourquoi ce plat, il répond : « Les pâtes au citron ont le goût du bonheur. »* Cette recette est tirée du livre de Monica Luciani « 61 recettes de pâtes » La moitié d’un sac de pâtes fusilli, Les zestes de deux citrons 150 ml de crème fraîche 1 c. à s. de beurre 3 c. à s. de parmesan râpé Sel Poivre noir du moulin.  sabyl ghoussoub cuisine méditerranéenne recette végétarienne recette plat principal cuisine  fusilli citron crème fraîche beurre parmesan",
    "source": "olj",
    "raw_category": "plat principal",
    "raw_difficulty": "facile",
    "raw_enrichment_present": true
  },
  {
    "url": "https://www.lorientlejour.com/cuisine-liban-a-table/1463811/tarte-fondante-au-chocolat-romarin-et-fleur-de-sel-aux-fines-herbes.html",
    "title": "Tarte fondante au chocolat romarin et fleur de sel aux fines herbes.html",
    "chef_name": null,
    "cuisine_type": null,
    "is_lebanese": false,
    "is_recipe": false,
    "category_canonical": "autre",
    "difficulty_canonical": "non_specifie",
    "tags": [],
    "main_ingredients": [],
    "aliases": [],
    "search_text": "Tarte fondante au chocolat romarin et fleur de sel aux fines herbes.html",
    "source": "olj",
    "raw_category": null,
    "raw_difficulty": null,
    "raw_enrichment_present": true
  },
  {
    "url": "https://www.lorientlejour.com/cuisine-liban-a-table/1482263/la-fatte-de-potimarron-vegan-dhugo-danaguezian.html",
    "title": "La fatté de potimarron vegan d'Hugo Danaguezian",
    "chef_name": "Hugo Danaguezian, tombé très tôt dans la marmite",
    "cuisine_type": "libanaise",
    "is_lebanese": true,
    "is_recipe": false,
    "category_canonical": "plat_principal",
    "difficulty_canonical": "facile",
    "tags": [
      "recette végétarienne",
      "recette automne",
      "potiron",
      "recette vegan",
      "recette libanaise",
      "cuisine libanaise"
    ],
    "main_ingredients": [
      "potimarron",
      "yaourt de soja",
      "pain libanais",
      "tahini"
    ],
    "aliases": [],
    "search_text": "La fatté de potimarron vegan d'Hugo Danaguezian Hugo Danaguezian, tombé très tôt dans la marmite  Pour la marinade du potimarron : 1 potimarron entier 5 g de paprika doux 4 g de zaatar 80 g d’huile d’olive Pour le chimichurri : 20 g de cébette 20 g de persil 5 g de paprika fumé 5 g de piment de Cayenne 10 g de zaatar 1 échalote 100 ml d’huile d’olive Pour la crème de fatté : 160 g de yaourt de soja 2 g d’ail en poudre 20 g de tahini 10 g de jus de citron Sel. Pour les chips : 1 sachet de pain libanais 500 ml d’huile neutre (tournesol) Sel  recette végétarienne recette automne potiron recette vegan recette libanaise cuisine libanaise  potimarron yaourt de soja pain libanais tahini",
    "source": "olj",
    "raw_category": "plat principal",
    "raw_difficulty": "facile",
    "raw_enrichment_present": true
  },
  {
    "url": "https://www.lorientlejour.com/cuisine-liban-a-table/1474301/la-soupe-des-trois-soeurs-haricots-mais-et-courge.html",
    "title": "La soupe des trois soeurs (haricots, maïs et courge)",
    "chef_name": "Jaimee Lee Haddad, cheffe amateure",
    "cuisine_type": "amérindienne",
    "is_lebanese": false,
    "is_recipe": false,
    "category_canonical": "soupe",
    "difficulty_canonical": "facile",
    "tags": [
      "entrée",
      "recette automne",
      "potiron",
      "recette végétarienne",
      "recette vegan"
    ],
    "main_ingredients": [
      "haricots",
      "maïs",
      "courge",
      "ail",
      "oignon"
    ],
    "aliases": [],
    "search_text": "La soupe des trois soeurs (haricots, maïs et courge) Jaimee Lee Haddad, cheffe amateure Cette soupe porte le nom des « trois sœurs » : les haricots, le maïs et la courge. Dans la culture amérindienne, ils sont plantés ensemble et se complètent tout au long de leur croissance, comme des sœurs. 1 ½ tasse moyenne de haricots blancs mis à tremper dans de l’eau au moins 4 heures avant la préparation, de préférence toute la nuit 2 feuilles de laurier 6 gousses d’ail 2 poivrons verts, coupés en deux 3 oignons, coupés en deux 2 tasses moyennes de potiron, coupé en petits cubes 2 cuillères à soupe d’huile d’olive 2 cuillères à soupe de paprika fumé 1 cuillerée à soupe de cumin 2 cuillères à café de cannelle 1 cuillère à café de poivre noir 1 cuillerée à soupe d’origan 1 cuillerée à soupe de mélasse de caroube 2 cuillères à soupe de concentré de tomate Pâte de chili (facultatif) Sel 1 tasse moyenne de maïs (en conserve ou surgelé) Quelques feuilles de coriandre hachée  entrée recette automne potiron recette végétarienne recette vegan  haricots maïs courge ail oignon",
    "source": "olj",
    "raw_category": "soupe",
    "raw_difficulty": "facile",
    "raw_enrichment_present": true
  },
  {
    "url": "https://www.lorientlejour.com/cuisine-liban-a-table/1485791/la-ossmaliye-au-kaki-de-karim-haidar.html",
    "title": "La ossmaliyé au kaki de Karim Haïdar",
    "chef_name": "Karim Haïdar, chef tous azimuts",
    "cuisine_type": "libanaise",
    "is_lebanese": true,
    "is_recipe": true,
    "category_canonical": "dessert",
    "difficulty_canonical": "facile",
    "tags": [
      "dessert",
      "recette libanaise",
      "recette végétarienne",
      "chef libanais"
    ],
    "main_ingredients": [
      "achta",
      "mozzarella",
      "mascarpone",
      "kaki",
      "pistaches",
      "kadaifi"
    ],
    "aliases": [],
    "search_text": "La ossmaliyé au kaki de Karim Haïdar Karim Haïdar, chef tous azimuts  400 g de achta ou 300 g de mozzarella boule et 100 g de mascarpone et 5 cl d’eau de fleur d’oranger 100 g de kadaifi ou pâte à ossmaliyé 2 kakis bien mûrs 50 g de pistaches torréfiées grossièrement concassées. Étaler la pâte à ossmaliyé sur 1,5 cm d’épaisseur et la cuire au four à 170 degrés 6 minutes jusqu’à ce qu’elle soit bien dorée. Pour le mélange mozzarella boule/mascarpone (à la place de la achta) : égoutter la mozzarella, l’écraser à la fourchette et mélanger au mascarpone et à l’eau de fleur d’oranger. Peler les kakis et écraser leur chair. Étaler la achta (ou le mélange mozzarella boule/mascarpone) dans un plat à service en façonnant un rebord. Combler le creux avec la pulpe de kaki. Recouvrir avec la ossmaliyé croustillante. Saupoudrer de pistaches concassées. dessert recette libanaise recette végétarienne chef libanais  achta mozzarella mascarpone kaki pistaches kadaifi",
    "source": "olj",
    "raw_category": "dessert",
    "raw_difficulty": "facile",
    "raw_enrichment_present": true
  },
  {
    "url": "https://www.lorientlejour.com/cuisine-liban-a-table/1367242/le-poulet-aux-betteraves-de-misbah-ahdab.html",
    "title": "Le poulet aux betteraves de Misbah Ahdab",
    "chef_name": "Misbah Ahdab, chef d'un jour",
    "cuisine_type": "libanaise",
    "is_lebanese": true,
    "is_recipe": false,
    "category_canonical": "plat_principal",
    "difficulty_canonical": "moyenne",
    "tags": [
      "recette",
      "plat principal",
      "cuisine"
    ],
    "main_ingredients": [
      "betteraves",
      "poitrine de poulet",
      "crème",
      "riz basmati"
    ],
    "aliases": [],
    "search_text": "Le poulet aux betteraves de Misbah Ahdab Misbah Ahdab, chef d'un jour Pour le plat qu’il nous propose dans le cadre de notre série « Hommes aux fourneaux », et qu’il a lui-même composé, Misbah Ahdab a voulu mettre à l’honneur la betterave, que l’on a tendance à oublier dans la cuisine libanaise. Tout au long de la réalisation va monter, de ses fourneaux, un mélange un peu magique de couleurs, de saveurs et de parfums. Au point qu’on se demande s’il aurait aimé être chef… « Jamais ! jure-t-il. C’est un métier qui exige un engagement immense que je n’ai pas. Je ne suis pas capable de ce courage tous les jours. »Après plus d’une heure d'une préparation méticuleuse durant laquelle Misbah Ahdab a quitté son blazer, sans perdre de son élégance, une tache se forme accidentellement sur sa chemise, qui, il est vrai, « ressemble à la carte du Liban ». « C’est génial, non ? » s’exclame-t-il avec un large sourire. Pour le poulet : 1 kg de betteraves bouillies, épluchées et coupées en cubes 1 kg de poitrine de poulet coupée en cubes. Les cubes seront roulés dans un mélange de farine, de fécule de pomme de terre, de gingembre en poudre, de sel et de poivre afin d’en être légèrement enrobés 2 oignons finement hachés 4 gousses d'ail émincées 2 c. à s. de vinaigre de cidre 1 cube de bouillon de poulet 1 litre d'eau 500 ml de crème 4 c. à s. d'huile végétale Zeste d'un citron 2 cm de gingembre râpé 3 c. à s. d'estragon haché 3 c. à s. de persil haché 2 c. à s. de thym de Provence 1 c. à c. de gingembre en poudre Poivre du moulin Sel 1 pincée de poivre de Cayenne. Pour le riz : 2 verres de riz basmati rincé et trempé 4 verres d’eau 2 c. à s. d'huile végétale 1 c. à s. de gingembre râpé Zeste d’un citron 1 ou 2 branches de thym frais de Provence 1 cube de bouillon de poulet.  recette plat principal cuisine  betteraves poitrine de poulet crème riz basmati",
    "source": "olj",
    "raw_category": "plat principal",
    "raw_difficulty": "moyenne",
    "raw_enrichment_present": true
  },
  {
    "url": "https://www.lorientlejour.com/cuisine-liban-a-table/1360647/bar-poele-sauce-vierge-et-chardonnay-beurre.html",
    "title": "Bar poêlé et sauce vierge (et… chardonnay beurré)",
    "chef_name": "Alfred Asseily, un chef spécialisé dans la cuisine française",
    "cuisine_type": "française",
    "is_lebanese": false,
    "is_recipe": false,
    "category_canonical": "plat_principal",
    "difficulty_canonical": "facile",
    "tags": [
      "recette",
      "cuisine",
      "vin",
      "plat principal",
      "recette végétarienne"
    ],
    "main_ingredients": [
      "bar",
      "épinards",
      "pommes de terre",
      "lait",
      "huile d'olive",
      "céleri",
      "fenouil",
      "tomates cerises",
      "olives",
      "persil",
      "câpres",
      "citron"
    ],
    "aliases": [],
    "search_text": "Bar poêlé et sauce vierge (et… chardonnay beurré) Alfred Asseily, un chef spécialisé dans la cuisine française Le choix de Château Ksara :« Avec le bar poêlé, nous vous proposons notre Chardonnay 2020, car le côté gras du bar s’assortit bien avec le côté vanillé, boisé et beurré du chardonnay obtenu grâce à la fermentation malolactique qui lui donne ce goût beurré vinifié en barrique de chêne. Sa pointe d’acidité traverse subtilement le gras du poisson, ce qui va permettre de mieux apprécier à la fois le poisson et le vin. » Pour le poisson 2 bars de 500 gr chacun 400 gr d’épinards frais 4 pommes de terre 200 ml de lait 200 ml d’huile d’olive. Pour le condiment d’une sauce vierge : 1 branche de céleri 1/4 de fenouil 4 tomates cerises 3 olives dénoyautées 1/2 bouquet de persil 1 c. à c. de câpres 1 citron.  recette cuisine vin plat principal recette végétarienne  bar épinards pommes de terre lait huile d'olive céleri fenouil tomates cerises olives persil câpres citron",
    "source": "olj",
    "raw_category": "plat principal",
    "raw_difficulty": "facile",
    "raw_enrichment_present": true
  },
  {
    "url": "https://www.lorientlejour.com/cuisine-liban-a-table/1475584/la-samke-harra-poisson-epice-de-bechara-atallah.html",
    "title": "La samké harra (poisson épicé) de Béchara Atallah",
    "chef_name": "Béchara Attalah, chef d’un jour",
    "cuisine_type": "libanaise",
    "is_lebanese": true,
    "is_recipe": true,
    "category_canonical": "plat_principal",
    "difficulty_canonical": "facile",
    "tags": [
      "gastronomie libanaise",
      "recette libanaise",
      "plat principal",
      "recette végétarienne",
      "cuisine méditerranéenne"
    ],
    "main_ingredients": [
      "poisson",
      "tomates",
      "poivrons",
      "citrons",
      "oignons",
      "ail",
      "coriandre",
      "épices"
    ],
    "aliases": [],
    "search_text": "La samké harra (poisson épicé) de Béchara Atallah Béchara Attalah, chef d’un jour La cuisine pour lui est un moment de fête, de partage, de joie. Quand Béchara Atallah débarque en cuisine, multicolore et le sourire communicatif, c’est avec beaucoup de générosité qu’il démarre son « œuvre ». Car outre le goût, relevé comme lui, c’est bien d’une œuvre qu’il s’agit, dans laquelle il dispose les produits par et pour leurs couleurs. Du rouge, du jaune, du vert, ses teintes de prédilection qui sont un peu sa signature. Une pincée d’humour, un zeste de piquant, les gestes lents, entre deux cigarettes, le cuisinier pescétarien a donc choisi ce plat, une samké harra (un poisson épicé), parce qu’il aime autant la préparer que la consommer. « J’ai donc choisi ce plat parce que, égoïstement, c’est mon plat préféré, mais aussi parce que je ne l’ai plus préparé depuis des années et que j’avais envie de partager cette expérience avec vous. J’aime entendre le son des “hmmmm” et des “yummy”… » 1 poisson de votre choix de 1,5 kg 750 g de tomates 2 grands poivrons, un vert et un rouge 2 citrons 3 oignons 6 gousses d’ail 1 botte de coriandre Épices : poivre noir, poivre rouge, paprika Concentré de tomate 1 cuillère à soupe de gros sel  gastronomie libanaise recette libanaise plat principal recette végétarienne cuisine méditerranéenne  poisson tomates poivrons citrons oignons ail coriandre épices",
    "source": "olj",
    "raw_category": "plat principal",
    "raw_difficulty": "facile",
    "raw_enrichment_present": true
  },
  {
    "url": "https://www.lorientlejour.com/cuisine-liban-a-table/1462493/les-jarrets-dagneau-avec-oranges-nefles-grenade-et-feves-vertes-par-hussein-hadid.html",
    "title": "Les jarrets d'agneau avec oranges, nèfles, grenade et fèves vertes par Hussein Hadid",
    "chef_name": "Hussein Hadid, chef créateur de concepts",
    "cuisine_type": "libanaise",
    "is_lebanese": true,
    "is_recipe": false,
    "category_canonical": "plat_principal",
    "difficulty_canonical": "difficile",
    "tags": [
      "cuisine",
      "restaurant"
    ],
    "main_ingredients": [
      "jarrets d'agneau",
      "jus d'orange",
      "jus de grenade",
      "oignons",
      "carottes",
      "céleri",
      "ail",
      "nèfles",
      "concentré de tomate",
      "farine",
      "vin rouge",
      "mélasse de grenade"
    ],
    "aliases": [],
    "search_text": "Les jarrets d'agneau avec oranges, nèfles, grenade et fèves vertes par Hussein Hadid Hussein Hadid, chef créateur de concepts  Pour les jarrets d’agneau : 6 x 500 g de jarrets d’agneau nettoyés 150 ml d’huile de tournesol 2 litres de bouillon de poulet 1 litre de jus d’orange 1 litre de jus de grenade 200 g d’oignons coupés en dés (façon mirepoix) 200 g de carottes coupées en dés (façon mirepoix) 200 g de céleri coupé en dés (façon mirepoix) 5 gousses d’ail La peau d’une demi-grenade coupée en lamelles 6 nèfles dénoyautées 250 g de concentré de tomate 250 g de farine 500 ml de vin rouge 150 ml de mélasse de grenade Un bouquet garni de cannelle, de clous de girofle, de grains de poivre, de feuilles de laurier et d’herbes fraîches Sel et poivre selon le goût. Pour la garniture : Oranges, graines de grenade, nèfles, fèves vertes pelées et aneth haché.  cuisine restaurant  jarrets d'agneau jus d'orange jus de grenade oignons carottes céleri ail nèfles concentré de tomate farine vin rouge mélasse de grenade",
    "source": "olj",
    "raw_category": "plat principal",
    "raw_difficulty": "difficile",
    "raw_enrichment_present": true
  },
  {
    "url": "https://www.lorientlejour.com/cuisine-liban-a-table/1236516/la-declinaison-de-tomates-jabaliyeh-de-hussein-hadid.html",
    "title": "La declinaison de tomates jabaliyeh de hussein hadid.html",
    "chef_name": null,
    "cuisine_type": null,
    "is_lebanese": false,
    "is_recipe": false,
    "category_canonical": "autre",
    "difficulty_canonical": "non_specifie",
    "tags": [],
    "main_ingredients": [],
    "aliases": [],
    "search_text": "La declinaison de tomates jabaliyeh de hussein hadid.html",
    "source": "olj",
    "raw_category": null,
    "raw_difficulty": null,
    "raw_enrichment_present": true
  },
  {
    "url": "https://www.lorientlejour.com/cuisine-liban-a-table/1485509/le-mochi-achta-aux-pistaches-de-may-bsat.html",
    "title": "Le mochi achta aux pistaches de May Bsat",
    "chef_name": "May Bsat, une passion née dans la cuisine familiale",
    "cuisine_type": "libanaise",
    "is_lebanese": true,
    "is_recipe": true,
    "category_canonical": "dessert",
    "difficulty_canonical": "facile",
    "tags": [
      "dessert",
      "recette végétarienne"
    ],
    "main_ingredients": [
      "farine de riz gluant",
      "lait",
      "sucre",
      "pistaches"
    ],
    "aliases": [],
    "search_text": "Le mochi achta aux pistaches de May Bsat May Bsat, une passion née dans la cuisine familiale Le mochi est une spécialité traditionnelle japonaise à base de riz gluant pilé, dont la pâte est travaillée pour devenir élastique et légèrement gluante. Le mochi peut être consommé nature, sucré ou salé. Sous la forme du daifuku, il est farci d’une pâte de haricot rouge ou d’une crème aromatisée aux fruits. Il peut aussi être consommé glacé.Ici, May Bsat a revisité cette spécialité japonaise pour l’assortir à des saveurs très libanaises : la achta et la pistache. Pour la pâte à mochi 90 g de farine de riz gluant 180 ml de lait 3 c. à s. de sucre 3 c. à s. de fécule de maïs Une pincée de spiruline verte pour la couleur Fécule de maïs pour saupoudrer Pour la achta (base caillée + base crémeuse): Pour la base caillée : 500 ml de lait 2 c. à s. de vinaigre blanc Pour la base crémeuse : 180 ml de lait 1 c. à s. de kaymar (ou crème fraîche épaisse) 1 c. à s. de fécule de maïs 1 c. à s. de sucre (facultatif) 1 c. à c. d'eau de fleurs d'oranger 40 g de pistaches hachées Pour le sirop de sucre (ater) : 200 g de sucre 120 ml d'eau 1 c. à c. de jus de citron 1 c. à c. d'eau de fleurs d'oranger ou d'eau de rose (facultatif)  dessert recette végétarienne  farine de riz gluant lait sucre pistaches",
    "source": "olj",
    "raw_category": "dessert",
    "raw_difficulty": "facile",
    "raw_enrichment_present": true
  },
  {
    "url": "https://www.lorientlejour.com/cuisine-liban-a-table/1469084/lahm-bi-ajin-tripolitaine.html",
    "title": "Lahm bi ajin tripolitaine d'Alan Geaam",
    "chef_name": "Alan Geaam, chef étoilé",
    "cuisine_type": "libanaise",
    "is_lebanese": true,
    "is_recipe": false,
    "category_canonical": "plat_principal",
    "difficulty_canonical": "facile",
    "tags": [
      "recette libanaise",
      "recettes alan geaam",
      "alan geaam",
      "chef libanais",
      "cuisine libanaise",
      "mezzé",
      "entrée"
    ],
    "main_ingredients": [
      "pâte feuilletée",
      "bœuf haché",
      "oignons",
      "ail",
      "beurre clarifié",
      "mélange sept épices libanais",
      "tahini",
      "yaourt grec",
      "mélasse de grenade",
      "pignons de pin"
    ],
    "aliases": [],
    "search_text": "Lahm bi ajin tripolitaine d'Alan Geaam Alan Geaam, chef étoilé  800 g de pâte feuilletée 300 g de bœuf haché 600 g d'oignons (6 oignons environ) 15 g d'ail 50 g de beurre clarifié 5 g de mélange sept épices libanais 75 g de tahini 100 g de yaourt grec 50 g de mélasse de grenade 50 g de pignons de pin Sel 3 g de poivre blanc Le jus de 1 citron (facultatif)  recette libanaise recettes alan geaam alan geaam chef libanais cuisine libanaise mezzé entrée  pâte feuilletée bœuf haché oignons ail beurre clarifié mélange sept épices libanais tahini yaourt grec mélasse de grenade pignons de pin",
    "source": "olj",
    "raw_category": "plat principal",
    "raw_difficulty": "facile",
    "raw_enrichment_present": true
  },
  {
    "url": "https://www.lorientlejour.com/cuisine-liban-a-table/1469086/sauces-tarator-toum-yaourt-coriandre-piment-concombre.html",
    "title": "Sauces : tarator, toum, yaourt, coriandre, piment, concombre",
    "chef_name": "Alan Geaam, chef étoilé",
    "cuisine_type": "libanaise",
    "is_lebanese": true,
    "is_recipe": false,
    "category_canonical": "sauces",
    "difficulty_canonical": "facile",
    "tags": [
      "recette libanaise",
      "recettes alan geaam",
      "cuisine libanaise",
      "recette végétarienne",
      "alan geaam",
      "chef libanais"
    ],
    "main_ingredients": [
      "tahini",
      "ail",
      "coriandre",
      "yaourt",
      "concombre"
    ],
    "aliases": [],
    "search_text": "Sauces : tarator, toum, yaourt, coriandre, piment, concombre Alan Geaam, chef étoilé  Pour la sauce Tarator : 260 g de tahini 1 citron 300 ml d'eau Sel Sumac Pour la sauce Toum : 6 gousses d'ail 200 ml d'huile de tournesol 5 g de sel 50 ml de jus de citron 50 g de blancs d'œufs 20 ml d'eau Pour la sauce coriandre : 1 botte de coriandre 5 g de gingembre frais 1 gousse d'ail 1 citron 1 avocat 100 ml d'huile d'olive Pour la sauce au concombre : 3 concombres 2 bottes de menthe 1 botte de coriandre 3 gousses d'ail 100 ml d'huile d'olive 3 yaourts grecs Sel et poivre Pour la sauce au yaourt : 600 g de yaourt grec 2 gousses d'ail 1 citron 10 g de cumin 60 g de tahini Pour la sauce au piment : 150 g de poivron rouge (1 poivron moyen) 2 piments rouges 3 gousses d'ail 30 g de paprika 15 g de coriandre en poudre 15 g de cumin 50 g de concentré de tomates 30 ml d'huile d'olive Sel  recette libanaise recettes alan geaam cuisine libanaise recette végétarienne alan geaam chef libanais  tahini ail coriandre yaourt concombre",
    "source": "olj",
    "raw_category": "sauces",
    "raw_difficulty": "facile",
    "raw_enrichment_present": true
  },
  {
    "url": "https://www.lorientlejour.com/cuisine-liban-a-table/1468720/fatteh-de-pois-chiches-fattet-hommos.html",
    "title": "Fatteh de pois chiches fattet hommos.html",
    "chef_name": null,
    "cuisine_type": null,
    "is_lebanese": false,
    "is_recipe": false,
    "category_canonical": "autre",
    "difficulty_canonical": "non_specifie",
    "tags": [],
    "main_ingredients": [],
    "aliases": [],
    "search_text": "Fatteh de pois chiches fattet hommos.html",
    "source": "olj",
    "raw_category": null,
    "raw_difficulty": null,
    "raw_enrichment_present": true
  },
  {
    "url": "https://www.lorientlejour.com/cuisine-liban-a-table/1463826/salade-de-fraises-au-sirop-de-rose-et-crumble-de-pavot.html",
    "title": "Salade de fraises au sirop de rose et crumble de pavot.html",
    "chef_name": null,
    "cuisine_type": null,
    "is_lebanese": false,
    "is_recipe": false,
    "category_canonical": "autre",
    "difficulty_canonical": "non_specifie",
    "tags": [],
    "main_ingredients": [],
    "aliases": [],
    "search_text": "Salade de fraises au sirop de rose et crumble de pavot.html",
    "source": "olj",
    "raw_category": null,
    "raw_difficulty": null,
    "raw_enrichment_present": true
  },
  {
    "url": "https://www.lorientlejour.com/cuisine-liban-a-table/1237819/la-peche-melba-orientalisee-de-maroun-chedid.html",
    "title": "La pêche Melba orientalisée de Maroun Chedid",
    "chef_name": "Maroun Chedid, chef entrepreneur",
    "cuisine_type": "française",
    "is_lebanese": false,
    "is_recipe": false,
    "category_canonical": "dessert",
    "difficulty_canonical": "non_specifie",
    "tags": [
      "recette",
      "recette végétarienne",
      "recette libanaise",
      "chef libanais",
      "dessert"
    ],
    "main_ingredients": [
      "pêche",
      "cassonade",
      "beurre",
      "osmalieh",
      "margarine",
      "praliné de noisettes",
      "blancs d’œufs",
      "jaunes d’œufs",
      "sucre",
      "farine",
      "mascarpone",
      "sucre glace",
      "jus de citron",
      "miel",
      "jujube"
    ],
    "aliases": [],
    "search_text": "La pêche Melba orientalisée de Maroun Chedid Maroun Chedid, chef entrepreneur Ce que dit Maroun Chedid de sa recette : « La pêche Melba est un dessert classique français originellement conceptualisé et créé par le chef Auguste Escoffier en 1892. J’ai décidé de réinventer ce dessert de manière à mélanger les cultures et fusionner le classique avec le contemporain, le français avec l’oriental. J’essaie ainsi de rapprocher la classique pêche Melba de notre identité et, plus encore, de notre culture, en la « construisant » comme un mille-feuille, en utilisant de la osmalieh, avec du miel de thym et de chêne de notre label « Georgette ». Et, toujours, ces quatre mots d’ordre qui nous motivent et qui constituent notre philosophie et nos valeurs : authenticité, inventivité, art et terroir. » Pour les pêches au caramel 300 g de pêche 300 g de cassonade 20 g de beurre. Pour la osmalieh 200 g de osmalieh 20 g de margarine. Pour le biscuit praliné 40 g de praliné de noisettes 60 g de blancs d’œufs 40 g de jaunes d’œufs 40 g de sucre 15 g de farine. Pour la crème mascarpone au miel 100 g de mascarpone 30 g de sucre glace 20 g de jus de citron 10 g de miel. 4 pièces de jujube pour la garniture  recette recette végétarienne recette libanaise chef libanais dessert  pêche cassonade beurre osmalieh margarine praliné de noisettes blancs d’œufs jaunes d’œufs sucre farine mascarpone sucre glace jus de citron miel jujube",
    "source": "olj",
    "raw_category": "dessert",
    "raw_difficulty": "non spécifié",
    "raw_enrichment_present": true
  },
  {
    "url": "https://www.lorientlejour.com/cuisine-liban-a-table/1463824/galettes-de-kammouneh-et-salade-dherbes-sauvages.html",
    "title": "Galettes de kammouneh et salade dherbes sauvages.html",
    "chef_name": null,
    "cuisine_type": null,
    "is_lebanese": false,
    "is_recipe": false,
    "category_canonical": "autre",
    "difficulty_canonical": "non_specifie",
    "tags": [],
    "main_ingredients": [],
    "aliases": [],
    "search_text": "Galettes de kammouneh et salade dherbes sauvages.html",
    "source": "olj",
    "raw_category": null,
    "raw_difficulty": null,
    "raw_enrichment_present": true
  },
  {
    "url": "https://www.lorientlejour.com/cuisine-liban-a-table/1468713/daoud-bacha-a-la-melasse-de-grenade.html",
    "title": "Daoud bacha a la melasse de grenade.html",
    "chef_name": null,
    "cuisine_type": null,
    "is_lebanese": false,
    "is_recipe": false,
    "category_canonical": "autre",
    "difficulty_canonical": "non_specifie",
    "tags": [],
    "main_ingredients": [],
    "aliases": [],
    "search_text": "Daoud bacha a la melasse de grenade.html",
    "source": "olj",
    "raw_category": null,
    "raw_difficulty": null,
    "raw_enrichment_present": true
  },
  {
    "url": "https://www.lorientlejour.com/cuisine-liban-a-table/1468863/boulettes-de-viande-aux-coings-kebbe-sfarjaliye.html",
    "title": "Kebbé sfarjaliyé (Boulettes de viande aux coings)",
    "chef_name": "Tara Khattar, cheffe et ambitieuse entrepreneuse",
    "cuisine_type": "libanaise",
    "is_lebanese": true,
    "is_recipe": true,
    "category_canonical": "plat_principal",
    "difficulty_canonical": "moyenne",
    "tags": [
      "recette libanaise",
      "tara khattar",
      "plat principal",
      "cuisine libanaise"
    ],
    "main_ingredients": [
      "viande de bœuf",
      "blé concassé",
      "viande d'agneau",
      "coings"
    ],
    "aliases": [
      "kebbé",
      "kibbe"
    ],
    "search_text": "Kebbé sfarjaliyé (Boulettes de viande aux coings) Tara Khattar, cheffe et ambitieuse entrepreneuse Tara Khattar : « Cette spécialité alépine est un ragoût au goût aigre-doux. Il est préparé avec des coings, de la viande de mouton et des kebbés. C'est un des plats que ma grand-mère maternelle cuisine quand toute la famille se réunit le samedi. » Pour les kebbés : 500 g de viande de bœuf hachée pour tartare 300 g de blé concassé (boulgour fin) 1 petit oignon 3/4 cuil. à café de sel 1/2 cuil. à café de poivre noir 1 pincée de muscade moulue 1 pincée de cannelle Huile Pour le ragoût aux coings : 750 g de cubes de viande d'agneau (jarret) 1 bâton de cannelle 1 feuille de laurier 1 carotte 1 petit oignon 5 coings Le jus d'1 citron 7,5 cl de mélasse de grenade 5 cuil. à soupe de sucre 1 pincée de cannelle 1 cuil. à café de sel 1/2 cuil. à café de poivre noir  recette libanaise tara khattar plat principal cuisine libanaise kebbé kibbe viande de bœuf blé concassé viande d'agneau coings",
    "source": "olj",
    "raw_category": "plat principal",
    "raw_difficulty": "moyenne",
    "raw_enrichment_present": true
  },
  {
    "url": "https://www.lorientlejour.com/cuisine-liban-a-table/1347612/le-cocktail-amer-darak-et-jus-de-mure-de-pierre-farah.html",
    "title": "Le cocktail « sour » d’arak et jus de mûre de Pierre Farah",
    "chef_name": "Pierre Farah, le conseil et la cuisine",
    "cuisine_type": "libanaise",
    "is_lebanese": true,
    "is_recipe": true,
    "category_canonical": "boisson",
    "difficulty_canonical": "facile",
    "tags": [
      "recette",
      "cuisine méditerranéenne",
      "recette libanaise"
    ],
    "main_ingredients": [
      "gin",
      "arak",
      "sirop",
      "jus de citron",
      "blanc d'œuf",
      "mûres",
      "sel"
    ],
    "aliases": [],
    "search_text": "Le cocktail « sour » d’arak et jus de mûre de Pierre Farah Pierre Farah, le conseil et la cuisine Pierre Farah a choisi de revisiter, pour la saison estivale, certains cocktails en y ajoutant un twist local. Café turc-Martini, Aperol spritz à l’eau de rose ou encore cet arak « sour » et jus de mûre que nous vous proposons. 45 ml de gin 15 ml d’arak 15 ml de sirop (quantités égales de sucre blanc et d’eau portées à ébullition et laissées à refroidir) 30 ml de jus de citron 15 ml de blanc d’œuf ou d’aquafaba* Une poignée de mûres Une pincée de sel. Verser tous les ingrédients dans un shaker sans glaçons et secouer énergiquement pendant 20 à 30 secondes. Ajouter une poignée de glaçons et secouez à nouveau 20 à 30 secondes. Servir le cocktail filtré dans un verre à cocktail givré. Décorer avec une mûre piquée d’un cure-dent. recette cuisine méditerranéenne recette libanaise  gin arak sirop jus de citron blanc d'œuf mûres sel",
    "source": "olj",
    "raw_category": "cocktail",
    "raw_difficulty": "facile",
    "raw_enrichment_present": true
  },
  {
    "url": "https://www.lorientlejour.com/cuisine-liban-a-table/1484499/-spaghetti-al-pomodoro-fresco-e-basilico-de-isabella-baffa.html",
    "title": "Spaghetti al pomodoro fresco e basilico de isabella baffa.html",
    "chef_name": null,
    "cuisine_type": null,
    "is_lebanese": false,
    "is_recipe": false,
    "category_canonical": "autre",
    "difficulty_canonical": "non_specifie",
    "tags": [],
    "main_ingredients": [],
    "aliases": [],
    "search_text": "Spaghetti al pomodoro fresco e basilico de isabella baffa.html",
    "source": "olj",
    "raw_category": null,
    "raw_difficulty": null,
    "raw_enrichment_present": true
  },
  {
    "url": "https://www.lorientlejour.com/cuisine-liban-a-table/1469111/ebbe-bil-sanie.html",
    "title": "La kebbé bil sanié d'Alan Geaam",
    "chef_name": "Alan Geaam, chef étoilé",
    "cuisine_type": "libanaise",
    "is_lebanese": true,
    "is_recipe": true,
    "category_canonical": "plat_principal",
    "difficulty_canonical": "facile",
    "tags": [
      "plat principal",
      "recettes alan geaam",
      "cuisine libanaise",
      "recette libanaise",
      "alan geaam",
      "chef libanais"
    ],
    "main_ingredients": [
      "boulghour",
      "bœuf haché",
      "oignons",
      "menthe",
      "basilic",
      "pignons de pin"
    ],
    "aliases": [
      "kebbé",
      "kebbe",
      "kibbe"
    ],
    "search_text": "La kebbé bil sanié d'Alan Geaam Alan Geaam, chef étoilé  Pour la base : 480 g de boulghour 600 g de bœuf haché 180 g d'oignons (2 oignons moyens environ) 15 g de menthe fraîche 15 g de basilic frais 12 g de mélange d'épices pour kebbeh Sel Pour la garniture : 240 g d'oignons (3 oignons moyens environ) 60 cl d'huile de tournesol 600 g de bœuf haché 7 g de mélange sept épices libanais 3 g de cannelle en poudre 30 g de pignons de pin Sel Pour le dressage : 20 cl d'huile d'olive  plat principal recettes alan geaam cuisine libanaise recette libanaise alan geaam chef libanais kebbé kebbe kibbe boulghour bœuf haché oignons menthe basilic pignons de pin",
    "source": "olj",
    "raw_category": "plat principal",
    "raw_difficulty": "facile",
    "raw_enrichment_present": true
  },
  {
    "url": "https://www.lorientlejour.com/cuisine-liban-a-table/1462504/le-gateau-au-yaourt-et-agrumes-de-farid-chehab-1.html",
    "title": "Le gâteau au yaourt et agrumes de Farid Chehab",
    "chef_name": "Farid Chehab, chef entrepreneur",
    "cuisine_type": "méditerranéenne",
    "is_lebanese": false,
    "is_recipe": false,
    "category_canonical": "dessert",
    "difficulty_canonical": "facile",
    "tags": [
      "cuisine",
      "recette automne",
      "recette végétarienne",
      "recette",
      "dessert"
    ],
    "main_ingredients": [
      "beurre",
      "sucre",
      "œufs",
      "citrons",
      "orange",
      "jus d'agrumes",
      "farine",
      "levure",
      "sel",
      "yaourt",
      "sucre en poudre"
    ],
    "aliases": [],
    "search_text": "Le gâteau au yaourt et agrumes de Farid Chehab Farid Chehab, chef entrepreneur « J’ai choisi cette recette facile et très économique, saine, pleine de vitamine C, sans chocolat, un ingrédient de plus en plus rare et cher au Liban », explique Farid Chehab. Pour l'appareil à gâteau : 175 g de beurre doux 175 g de sucre semoule ou cassonade 4 œufs Zestes de deux citrons Zestes d’une orange ½ verre de jus d’agrumes mélangées 240 g de farine 25 g de levure instantanée 5 g de sel 100 g de yaourt (laban ou à la grecque) 400 g de glaçage. Pour le glaçage : 400 g de sucre en poudre 250 g de beurre doux 6 cl de jus de citron.  cuisine recette automne recette végétarienne recette dessert  beurre sucre œufs citrons orange jus d'agrumes farine levure sel yaourt sucre en poudre",
    "source": "olj",
    "raw_category": "dessert",
    "raw_difficulty": "facile",
    "raw_enrichment_present": true
  },
  {
    "url": "https://www.lorientlejour.com/cuisine-liban-a-table/1483471/le-veloute-de-champignons-avec-un-oeuf-frit-dalan-geaam.html",
    "title": "Le velouté de champignons avec un œuf frit d’Alan Geaam",
    "chef_name": "Alan Geaam, chef étoilé",
    "cuisine_type": "française",
    "is_lebanese": false,
    "is_recipe": false,
    "category_canonical": "plat_principal",
    "difficulty_canonical": "facile",
    "tags": [
      "recette végétarienne",
      "entrée",
      "recettes alan geaam",
      "alan geaam",
      "chef libanais",
      "recette automne"
    ],
    "main_ingredients": [
      "œufs",
      "échalote",
      "champignons de Paris",
      "beurre",
      "bouillon",
      "crème liquide",
      "huile de friture",
      "sel",
      "poivre",
      "cerfeuil"
    ],
    "aliases": [],
    "search_text": "Le velouté de champignons avec un œuf frit d’Alan Geaam Alan Geaam, chef étoilé  4 œufs 1 échalote 500 g de champignons de Paris 50 g de beurre 100 ml de bouillon de volaille ou légumes 100 g de crème liquide 1 l d’huile de friture Sel et poivre Cerfeuil pour décorer les assiettes  recette végétarienne entrée recettes alan geaam alan geaam chef libanais recette automne  œufs échalote champignons de Paris beurre bouillon crème liquide huile de friture sel poivre cerfeuil",
    "source": "olj",
    "raw_category": "plat principal",
    "raw_difficulty": "facile",
    "raw_enrichment_present": true
  },
  {
    "url": "https://www.lorientlejour.com/cuisine-liban-a-table/1463818/tarte-de-caviar-de-tomates-sechees-pesto-de-persil-et-tomates-cerises.html",
    "title": "Tarte de caviar de tomates sechees pesto de persil et tomates cerises.html",
    "chef_name": null,
    "cuisine_type": null,
    "is_lebanese": false,
    "is_recipe": false,
    "category_canonical": "autre",
    "difficulty_canonical": "non_specifie",
    "tags": [],
    "main_ingredients": [],
    "aliases": [],
    "search_text": "Tarte de caviar de tomates sechees pesto de persil et tomates cerises.html",
    "source": "olj",
    "raw_category": null,
    "raw_difficulty": null,
    "raw_enrichment_present": true
  },
  {
    "url": "https://www.lorientlejour.com/cuisine-liban-a-table/1481093/la-creme-brulee-aux-fruits-rouges-de-charles-azar.html",
    "title": "La crème brûlée aux fruits rouges de Charles Azar",
    "chef_name": "Charles Azar, la pâtisserie sous toutes ses formes",
    "cuisine_type": "française",
    "is_lebanese": false,
    "is_recipe": true,
    "category_canonical": "dessert",
    "difficulty_canonical": "facile",
    "tags": [
      "dessert",
      "charles azar",
      "recettes charles azar",
      "chef libanais",
      "recette végétarienne"
    ],
    "main_ingredients": [
      "crème liquide",
      "jaunes d’œufs",
      "sucre",
      "vanille",
      "fruits rouges"
    ],
    "aliases": [],
    "search_text": "La crème brûlée aux fruits rouges de Charles Azar Charles Azar, la pâtisserie sous toutes ses formes Cette recette porte en elle à la fois mémoire et convivialité. La crème brûlée réveille le souvenir d’un geste raffiné, celui de casser la fine couche caramélisée. Il s‘agit d’un dessert universel, mais qui rappelle aussi les premiers souvenirs gourmands que nous créons àThe Chase. Ce dessert fait partie des souvenirs de la belle époque du restaurant que nous souhaitons prolonger. 500 g de crème liquide entière 1 gousse de vanille 5 jaunes d’œufs 100 g de sucre semoule 40 g de cassonade (pour caraméliser) 80 g de compotée de fruits rouges Quelques fraises et myrtilles fraîches pour la décoration Chauffer la crème avec la gousse de vanille fendue et grattée. Blanchir les jaunes d’œufs avec le sucre. Verser la crème chaude sur le mélange œufs-sucre en fouettant sans s’arrêter. Répartir la préparation dans 4 ramequins. Cuire au bain-marie, au four préchauffé à 110 °C, pendant 40 à 50 minutes, jusqu’à ce que la crème soit prise mais encore légèrement tremblotante. Mettre à refroidir au réfrigérateur pendant au moins 2 heures. Saupoudrer chaque crème froide de cassonade. Caraméliser à l’aide d’un chalumeau pour former une fine croûte croustillante. Déposer une cuillère de compotée de fruits rouges au centre. Décorer avec une fraise fraîche et quelques myrtilles. dessert charles azar recettes charles azar chef libanais recette végétarienne  crème liquide jaunes d’œufs sucre vanille fruits rouges",
    "source": "olj",
    "raw_category": "dessert",
    "raw_difficulty": "facile",
    "raw_enrichment_present": true
  },
  {
    "url": "https://www.lorientlejour.com/cuisine-liban-a-table/1350552/les-pappardelle-de-courgettes-a-la-feta-et-au-citron-de-matteo-el-khodr.html",
    "title": "Les « pappardelle » de courgettes à la feta et au citron de Matteo el-Khodr",
    "chef_name": "Matteo el-Khodr, chef d'un jour",
    "cuisine_type": "méditerranéenne",
    "is_lebanese": false,
    "is_recipe": true,
    "category_canonical": "plat_principal",
    "difficulty_canonical": "facile",
    "tags": [
      "matteo el-khodr",
      "cuisine méditerranéenne",
      "plat principal",
      "cuisine",
      "recette végétarienne"
    ],
    "main_ingredients": [
      "courgette",
      "feta",
      "pâtes",
      "ail",
      "origan"
    ],
    "aliases": [],
    "search_text": "Les « pappardelle » de courgettes à la feta et au citron de Matteo el-Khodr Matteo el-Khodr, chef d'un jour « Je suis quelqu’un qui aime les plats de saison avec les produits de saison, des plats qui soient colorés, généreux et pas prétentieux. Les goûts simples sont un luxe et je trouve que dans un pays comme le Liban où nous avons accès à de bons produits saisonniers, c’est une aubaine de pouvoir cuisiner selon l’arrivage des produits frais et des légumes. La courgette a toujours été boudée dans la cuisine savante, mais je trouve qu’elle a un goût et une texture assez sophistiqués qui donnent rapidement des notes méditerranéennes et solaires à votre assiette ! Mariée avec la feta, c’est un pur air de vacances qui s’en dégage ! », estime Matteo el-Khodr. Pour la sauce 3 c. à s. d’huile d’olive 2 gousses d’ail, finement tranchées 3 c. à s. d’origan 3 grandes courgettes vertes, coupées en quatre dans le sens de la longueur, puis émincées Sel et poivre noir 150 g de feta coupée en gros morceaux 100 ml de bouillon de légumes. Pour les pâtes et les rubans de courgettes 30 g de beurre non salé 80 g de pignons de pin grossièrement hachés 2 courgettes (300 g) jaunes et vertes tranchées en longues et fines lamelles (idéalement à l’aide d’une mandoline ou d’un économe). Conserver les rubans en excédent et les ajouter à votre prochaine salade. 300 g de pâtes pappardelle aux œufs (on peut les remplacer par des tagliatelles) Zeste d’un citron plus 1 cuillère à soupe de jus de citron 25 g de feuilles de basilic.  matteo el-khodr cuisine méditerranéenne plat principal cuisine recette végétarienne  courgette feta pâtes ail origan",
    "source": "olj",
    "raw_category": "plat principal",
    "raw_difficulty": "facile",
    "raw_enrichment_present": true
  },
  {
    "url": "https://www.lorientlejour.com/cuisine-liban-a-table/1469082/samboussik-feta-menthe-chaussons-feta-menthe.html",
    "title": "Samboussik feta-menthe (Chaussons feta-menthe) d'Alan Geaam",
    "chef_name": "Alan Geaam, chef étoilé",
    "cuisine_type": "libanaise",
    "is_lebanese": true,
    "is_recipe": false,
    "category_canonical": "mezze_froid",
    "difficulty_canonical": "facile",
    "tags": [
      "recette libanaise",
      "recettes alan geaam",
      "alan geaam",
      "chef libanais",
      "mezzé",
      "entrée",
      "recette végétarienne",
      "cuisine libanaise"
    ],
    "main_ingredients": [
      "feta",
      "halloumi",
      "farine",
      "lait",
      "menthe"
    ],
    "aliases": [],
    "search_text": "Samboussik feta-menthe (Chaussons feta-menthe) d'Alan Geaam Alan Geaam, chef étoilé  Pour la pâte : 230 ml de lait 10 g de levure boulangère fraîche 70 ml d'huile de tournesol 400 g de farine 5 g de sel 10 g de sucre Pour la farce : 100 g de feta 200 g de halloumi 5 g de persil 5 g de menthe sèche 1 g d'anis en poudre Poivre blanc Pour la cuisson : Huile de friture  recette libanaise recettes alan geaam alan geaam chef libanais mezzé entrée recette végétarienne cuisine libanaise  feta halloumi farine lait menthe",
    "source": "olj",
    "raw_category": "mezze",
    "raw_difficulty": "facile",
    "raw_enrichment_present": true
  },
  {
    "url": "https://www.lorientlejour.com/cuisine-liban-a-table/1479374/la-mjaddara-de-boulghour-et-haricots-rouges-de-simon-yammine.html",
    "title": "La mjaddara de boulghour et haricots rouges de Simon Yammine",
    "chef_name": "Simon Yammine, le chef Insta de Zghorta",
    "cuisine_type": "libanaise",
    "is_lebanese": true,
    "is_recipe": true,
    "category_canonical": "plat_principal",
    "difficulty_canonical": "facile",
    "tags": [
      "plat principal",
      "recette libanaise",
      "recette vegan",
      "recette végétarienne",
      "cuisine méditerranéenne"
    ],
    "main_ingredients": [
      "haricots rouges",
      "boulghour",
      "oignons",
      "huile d'olive",
      "sel"
    ],
    "aliases": [],
    "search_text": "La mjaddara de boulghour et haricots rouges de Simon Yammine Simon Yammine, le chef Insta de Zghorta La mjaddara de boulghour et haricots rouges est un plat très ancien. Dans le temps, on utilisait le blé concassé brun au lieu du blanc, parce que la terre les produisait ainsi.Ce plat ne coûte pas cher, il ne nécessite que peu d’ingrédients ; les gens d’ici l’ont beaucoup cuisiné pendant la guerre. Simple et méconnue, la mjaddara peut se décliner en sept recettes différentes, toutes faciles et surprenantes. Celle-ci est l’une de mes préférées. 500g d’haricots rouges 200g de boulghour 3 c.à.s d’huile d’olive 150g d’oignons 3g de sel Cuire dans de l'eau bouillante les haricots qui ont trempé dans l’eau toute la nuit. Arrêter la cuisson quand ils sont presque cuits. Hacher finement les oignons et les faire revenir dans de l’huile d’olive jusqu’à ce qu’ils soient bien bruns. Les ajouter aux haricots et les laisser mijoter pendant quelques minutes. Enfin, ajouter le boulghour et le faire cuire jusqu’à ce qu’il soit tendre. Assaisonnez avec du sel et de l’huile d’olive, et servir avec des radis en accompagnement. plat principal recette libanaise recette vegan recette végétarienne cuisine méditerranéenne  haricots rouges boulghour oignons huile d'olive sel",
    "source": "olj",
    "raw_category": "plat principal",
    "raw_difficulty": "facile",
    "raw_enrichment_present": true
  },
  {
    "url": "https://www.lorientlejour.com/cuisine-liban-a-table/1235689/le-poivron-dalep-dans-tous-ses-etats-avec-aline-kamakian.html",
    "title": "Le poivron d'Alep dans tous ses états avec Aline Kamakian",
    "chef_name": "Aline Kamakian, cheffe engagée",
    "cuisine_type": "méditerranéenne",
    "is_lebanese": false,
    "is_recipe": false,
    "category_canonical": "boisson",
    "difficulty_canonical": "facile",
    "tags": [
      "recette",
      "recettes aline kamakian",
      "cuisine méditerranéenne",
      "entrée",
      "mezzé",
      "recette libanaise",
      "recette arménienne",
      "aline kamakian",
      "chef libanais",
      "recette végétarienne",
      "recette vegan"
    ],
    "main_ingredients": [
      "poivron d'Alep",
      "aubergine",
      "oignon",
      "mélasse de grenade",
      "chapelure",
      "noix"
    ],
    "aliases": [],
    "search_text": "Le poivron d'Alep dans tous ses états avec Aline Kamakian Aline Kamakian, cheffe engagée Ce que dit Aline Kamakian : « Excellente source de vitamines C, E, B6 et B9, bon pour le cœur, riche en antioxydants... Super aliment, le poivron rouge protège le corps des infections, favorise la santé des os, des dents, des gencives et des cartilages. Mais au-delà de ses vertus pour la santé, le poivron d’Alep a un goût plus fin et concentré que les poivrons basiques, qui regorgent plus d’eau et ont une chair plus épaisse. C’est un poivron doux, gentiment aromatisé, pas trop sucré et pas piquant. Une fois grillé au feu de bois, avec de l’huile et du sel, il offre toute la richesse de sa saveur. Délicieux avec une salade, sur un fromage chauffé, ou encore avec du thon, ce légume, facile à préparer, accompagne de nombreux plats et entrées. C’est pour toutes ces raisons et pour toutes ses possibilités que je l’ai choisi ». Ingrédients pour l'apéro méditerranéen à base de poivrons grillés 2 ou 3 poivrons d’Alep Huile d’olive selon votre goût Sel selon votre goût. Ingrédients pour la trempette aux poivrons d'Alep et aubergines 3 poivrons d’Alep Huile d’olive selon votre goût Sel selon votre goût Une grande aubergine Un oignon Une pincée de poivron moulu 2 cuillères à soupe de persil haché. Ingrédients pour la muhamara 5 poivrons d’Alep Huile d’olive selon votre goût Sel selon votre goût 1 c. à soupe de mélasse de grenade 2 c. à soupe de chapelure 2 c. à soupe de noix hachées au couteau Une pincée au goût de cumin en poudre.  recette recettes aline kamakian cuisine méditerranéenne entrée mezzé recette libanaise recette arménienne aline kamakian chef libanais recette végétarienne recette vegan  poivron d'Alep aubergine oignon mélasse de grenade chapelure noix",
    "source": "olj",
    "raw_category": "apéro",
    "raw_difficulty": "facile",
    "raw_enrichment_present": true
  },
  {
    "url": "https://www.lorientlejour.com/cuisine-liban-a-table/1469017/kebbe-arnabiye-kebbes-a-la-pate-de-sesame-et-aux-agrumes.html",
    "title": "Kebbé arnabiyé (Kebbés à la pâte de sésame et aux agrumes) de Tara Khattar",
    "chef_name": "Tara Khattar, cheffe et ambitieuse entrepreneuse",
    "cuisine_type": "libanaise",
    "is_lebanese": true,
    "is_recipe": true,
    "category_canonical": "plat_principal",
    "difficulty_canonical": "difficile",
    "tags": [
      "recette libanaise",
      "recette automne",
      "recettes tara khattar",
      "tara khattar",
      "cuisine libanaise",
      "chef libanais",
      "plat principal"
    ],
    "main_ingredients": [
      "viande de bœuf",
      "boulgour",
      "oignon",
      "tahiné",
      "oranges",
      "citrons",
      "pois chiches"
    ],
    "aliases": [],
    "search_text": "Kebbé arnabiyé (Kebbés à la pâte de sésame et aux agrumes) de Tara Khattar Tara Khattar, cheffe et ambitieuse entrepreneuse Tara Khattar : « On mange ce plat à Pâques. Les chrétiens orthodoxes d'Achrafieh sont connus pour ce plat qu'ils maîtrisent parfaitement. Ma grand-mère paternelle en prépare un délicieux : tout le secret réside dans le temps de cuisson. De nombreuses personnes pensent que l'huile sur le dessus signifie une recette ratée mais c'est tout le contraire, car c'est comme ça que vous saurez que votre plat est prêt et réussi. Ce plat est difficile à réaliser à l'étranger puisqu'on ne trouve pas aisément tous les agrumes ; cependant, je pense avoir trouvé une solution pour obtenir un goût similaire avec des ingrédients locaux. » Pour les kebbés 500 g de viande de bœuf hachée pour tartare 300 g de blé concassé (boulgour fin) 1 petit oignon 3/4 cuil. à café de sel 1/2 cuil. à café de poivre noir 1 pincée de muscade moulue 1 pincée de cannelle Huile Pour le reste de la recette 500 g de viande à ragoût (bœuf ou agneau) 500 g d'os d'agneau pour bouillon 40 kebbés 1 kg de pâte de sésame (tahiné) 1 kg d'oranges 6 kg d'oranges de Séville (amères) 2 feuilles de laurier 500 g de citrons 2 gros oignons 300 g de pois chiches cuits 2 bâtons de cannelle Sel, poivre Pour le riz 5 verres de riz 10 verres d'eau (environ 2 litres) 20 g de beurre  recette libanaise recette automne recettes tara khattar tara khattar cuisine libanaise chef libanais plat principal  viande de bœuf boulgour oignon tahiné oranges citrons pois chiches",
    "source": "olj",
    "raw_category": "plat principal",
    "raw_difficulty": "difficile",
    "raw_enrichment_present": true
  },
  {
    "url": "https://www.lorientlejour.com/cuisine-liban-a-table/1463963/le-halva-glace-de-kubri-le-gout-regressif-de-lenfance.html",
    "title": "Le « halva » glacé de Kubri : le goût régressif de l'enfance",
    "chef_name": "Le trio des Franco-libanaises de Kubri",
    "cuisine_type": "libanaise",
    "is_lebanese": true,
    "is_recipe": true,
    "category_canonical": "dessert",
    "difficulty_canonical": "facile",
    "tags": [
      "dessert",
      "recette végétarienne",
      "cuisine méditerranéenne",
      "recette"
    ],
    "main_ingredients": [
      "crème",
      "chocolat",
      "œufs",
      "sucre",
      "halva",
      "pistaches",
      "amandes"
    ],
    "aliases": [],
    "search_text": "Le « halva » glacé de Kubri : le goût régressif de l'enfance Le trio des Franco-libanaises de Kubri Une recette à l'image de la philosophie que les sœurs Mayfrid et Ingrid Chehlaoui ainsi que Rita Higgins, ont voulu insuffler dans la carte du restaurant Kubri : une cuisine libanaise réinventée, un esprit d’adaptation et un optimisme à toute épreuve.« C’est un plat qui fait l’unanimité depuis. Les clients nous rendent visite parfois juste pour ce dessert. Le halawa en est la star, on y ajoute du chocolat pour magnifier le tout. C’est un goût régressif qui nous rappelle nos souvenirs d’enfance : nos petits goûters de sandwiches de pain libanais au halawa que nous préparaient nos mamans », explique Rita Higgins. 237 g de crème liquide 35 % de matière grasse 115 g de pépites de chocolat 75 % cacao 10 g d’huile de noix de coco 4 gros œufs 80 g de sucre blanc 2 g de fleur de sel 120 g de halva mixé en poudre. Garniture 150 g de halva émietté 80 g de pistaches décortiquées et hachées 80 g d’amandes caramélisées et hachées.  dessert recette végétarienne cuisine méditerranéenne recette  crème chocolat œufs sucre halva pistaches amandes",
    "source": "olj",
    "raw_category": "dessert",
    "raw_difficulty": "facile",
    "raw_enrichment_present": true
  },
  {
    "url": "https://www.lorientlejour.com/cuisine-liban-a-table/1348337/la-fatte-au-pesto-de-maya-the-kitchen-editor.html",
    "title": "La Fatté au pesto de Maya, The Kitchen editor",
    "chef_name": "Maya Ammous, la cuisine en partage",
    "cuisine_type": "libanaise",
    "is_lebanese": true,
    "is_recipe": false,
    "category_canonical": "mezze_froid",
    "difficulty_canonical": "facile",
    "tags": [
      "recette",
      "cuisine libanaise",
      "recette libanaise",
      "plat principal",
      "recette végétarienne"
    ],
    "main_ingredients": [
      "basilic",
      "ail",
      "pignons de pin",
      "pois chiches",
      "pain libanais",
      "yaourt",
      "grenade"
    ],
    "aliases": [],
    "search_text": "La Fatté au pesto de Maya, The Kitchen editor Maya Ammous, la cuisine en partage  Pour le pesto 1 poignée de basilic 1 gousse d'ail Sel au goût 1 à 2 cuillères à soupe de pignons de pin (vous pouvez les remplacer par des amandes ou des noix de cajou) 2 à 3 c. à s. d’huile d'olive. Pour le plat 1 boîte de pois chiches cuits rincés puis réchauffés dans de l’eau à feu doux pendant quelques minutes 1 pain libanais coupé en carrés 2 tasses de yaourt (laban) Sel 1 gousse d'ail écrasée. Pour la garniture 1 poignée de pignons de pin frits dans de l’huile d’olive 1 poignée de grains de grenade.  recette cuisine libanaise recette libanaise plat principal recette végétarienne  basilic ail pignons de pin pois chiches pain libanais yaourt grenade",
    "source": "olj",
    "raw_category": "mezze",
    "raw_difficulty": "facile",
    "raw_enrichment_present": true
  },
  {
    "url": "https://www.lorientlejour.com/cuisine-liban-a-table/1469398/confiture-de-rose-varti-anoush.html",
    "title": "Confiture de rose (Varti anoush) d'Aline Kamakian",
    "chef_name": "Aline Kamakian, cheffe engagée",
    "cuisine_type": "libanaise",
    "is_lebanese": true,
    "is_recipe": false,
    "category_canonical": "dessert",
    "difficulty_canonical": "facile",
    "tags": [
      "dessert",
      "recettes aline kamakian",
      "aline kamakian",
      "chef libanais",
      "cuisine méditerranéenne",
      "recette végétarienne",
      "recette vegan",
      "recette libanaise",
      "recette arménienne"
    ],
    "main_ingredients": [
      "pétales de rose",
      "sucre",
      "sel citronné"
    ],
    "aliases": [
      "Varti anoush"
    ],
    "search_text": "Confiture de rose (Varti anoush) d'Aline Kamakian Aline Kamakian, cheffe engagée  1 kg de pétales de rose 3 kg de sucre 2,5 cuillères à soupe de sel citronné  dessert recettes aline kamakian aline kamakian chef libanais cuisine méditerranéenne recette végétarienne recette vegan recette libanaise recette arménienne Varti anoush pétales de rose sucre sel citronné",
    "source": "olj",
    "raw_category": "dessert",
    "raw_difficulty": "facile",
    "raw_enrichment_present": true
  },
  {
    "url": "https://www.lorientlejour.com/cuisine-liban-a-table/1469374/brioche-de-paques-tsheureg.html",
    "title": "Brioche de Pâques (Tsheureg)",
    "chef_name": "Aline Kamakian, cheffe engagée",
    "cuisine_type": "arménienne",
    "is_lebanese": false,
    "is_recipe": false,
    "category_canonical": "dessert",
    "difficulty_canonical": "facile",
    "tags": [
      "dessert",
      "aline kamakian",
      "recette arménienne",
      "recette libanaise",
      "chef libanais",
      "recette végétarienne"
    ],
    "main_ingredients": [
      "farine",
      "beurre",
      "lait",
      "sucre",
      "œufs",
      "levure",
      "mastic",
      "mahlab",
      "sel"
    ],
    "aliases": [],
    "search_text": "Brioche de Pâques (Tsheureg) Aline Kamakian, cheffe engagée Aline Kamakian et Barbara Drieskens : « À Istanbul, nous avons rencontré un jeune producteur qui avait réalisé une série de CD de musique enregistrés par les minorités de Turquie. Il nous a raconté à quel point il avait été surpris de vendre environ 1 000 exemplaires des CD géorgien et thrace, contre 20 000 exemplaires du CD arménien. Il expliquait cela par le fait qu’au moins deux millions de Turcs ont des grands-parents arméniens, même si beaucoup l’ignorent ou refusent de reconnaître leurs origines. Lorsqu’il a commencé à rassembler des chansons arméniennes pour son disque, de nombreuses personnes l’ont contacté. La conversation débutait souvent par une affirmation de leur identité turque, mais il ne fallait pas plus de dix minutes pour qu’ils évoquent leurs grands-mères arméniennes et entonnent des chansons traditionnelles arméniennes.Fethiye Çetin, avocate turque, n’a découvert que tard dans sa vie que sa grand-mère était arménienne. Comme tant d’autres, cette dernière avait caché son identité. Elle avait vu ses parents se faire tuer sous ses yeux, avant d’être sauvée et élevée par une famille turque, puis d’épouser un homme turc.Enfant, Fethiye se souvenait avoir mangé du tsheureg — sans savoir qu’il s’agissait pour sa grand-mère d’une manière de commémorer Pâques. Et elle n’était pas la seule à le faire en silence. Beaucoup de ses amies en mangeaient aussi, partageant à travers ces brioches délicieuses un lien secret avec leurs origines. » 1 kg de farine 225 g de beurre fondu 375 ml de lait entier 300 g de sucre 5 œufs 12 g de levure boulangère sèche 4 g de levure chimique 1 cuillère à café de mastic (mastiha) réduit en poudre 1 cuillère à café de mahlab 1 pincée de sel Pour la dorure : 1 œuf 30 ml de lait (environ 2 cuillères à soupe) 10 g de sésame noir (environ 1 cuillère à soupe)  dessert aline kamakian recette arménienne recette libanaise chef libanais recette végétarienne  farine beurre lait sucre œufs levure mastic mahlab sel",
    "source": "olj",
    "raw_category": "dessert",
    "raw_difficulty": "facile",
    "raw_enrichment_present": true
  },
  {
    "url": "https://www.lorientlejour.com/cuisine-liban-a-table/1469405/raviolis-grilles-a-la-sauce-au-yaourt-mante.html",
    "title": "Raviolis grillés à la sauce au yaourt (Mante) d'Aline Kamakian",
    "chef_name": "Aline Kamakian, cheffe engagée",
    "cuisine_type": "arménienne",
    "is_lebanese": false,
    "is_recipe": true,
    "category_canonical": "plat_principal",
    "difficulty_canonical": "moyenne",
    "tags": [
      "recette arménienne",
      "recettes aline kamakian",
      "aline kamakian",
      "chef libanais",
      "cuisine méditerranéenne"
    ],
    "main_ingredients": [
      "farine",
      "bœuf haché",
      "yaourt",
      "oignons",
      "épices"
    ],
    "aliases": [],
    "search_text": "Raviolis grillés à la sauce au yaourt (Mante) d'Aline Kamakian Aline Kamakian, cheffe engagée Aline Kamakian et Barbara Drieskens : « Les différents types de raviolis que l’on trouve dans la cuisine arménienne sont probablement un héritage des nomades asiatiques ou des Mongols qui ont envahi l’Arménie au Moyen Âge. Lemanteest l’un des rares plats dont l’origine est incontestablement arménienne.Nous préparons différentes formes de raviolis : les petites barques sont appeléesmante, grillées au four et servies avec une sauce rouge et du yaourt. Les raviolis triangulaires sont servis dans une soupe aux pois chiches, et les petits baluchons, appelésbokhtcha, sont servis soit dans une soupe au yaourt, soit bouillis avec une sauce tomate et du yaourt.Il est préférable d’utiliser une pâte faite maison, mais si vous êtes pressé, vous pouvez aussi utiliser des feuilles dewon tonou une pâte prête à l’emploi. La préparation est certes longue, mais elle en vaut vraiment la peine. » Pour la pâte : 250 g de farine 125 ml d’eau 1 cuillère à café de sel Pour la farce : 330 g de bœuf haché (haché deux fois, moitié maigre moitié gras) 2 oignons, hachés finement ½ cuillère à café de sel ½ cuillère à café de sept épices ½ cuillère à café de piment rouge en poudre ½ cuillère à café de poivre noir Pour la sauce : 15 g de beurre 500 ml de bouillon de viande (ou 1 cube de bouillon dissous dans 500 ml d’eau) ½ cuillère à soupe de concentré de tomate ½ cuillère à soupe de pâte de piment rouge fort Sel, au goût Pour le yaourt : 3 gousses d’ail, écrasées 240 g de yaourt égoutté 125 ml d’eau Pour la finition : Poudre de sumac, pour garnir  recette arménienne recettes aline kamakian aline kamakian chef libanais cuisine méditerranéenne  farine bœuf haché yaourt oignons épices",
    "source": "olj",
    "raw_category": "plat principal",
    "raw_difficulty": "moyenne",
    "raw_enrichment_present": true
  },
  {
    "url": "https://www.lorientlejour.com/cuisine-liban-a-table/1451544/une-lasagne-tres-vegetarienne-mamma-mia-.html",
    "title": "Une lasagne très végétarienne, « mamma mia » !",
    "chef_name": "Jaimee Lee Haddad, cheffe amateure",
    "cuisine_type": "méditerranéenne",
    "is_lebanese": false,
    "is_recipe": true,
    "category_canonical": "plat_principal",
    "difficulty_canonical": "facile",
    "tags": [
      "recette végétarienne",
      "plat principal",
      "recette vegan",
      "cuisine méditerranéenne",
      "recette de carême"
    ],
    "main_ingredients": [
      "noix de cajou",
      "tomates",
      "blettes",
      "courgettes",
      "lasagnes"
    ],
    "aliases": [],
    "search_text": "Une lasagne très végétarienne, « mamma mia » ! Jaimee Lee Haddad, cheffe amateure Elle est belle et bonne, « structurée » avec ses couches de pâte et de farce superposées, ses textures différentes à chaque « étage » et le croustillant qui vient parachever l’ensemble.Ses fines couches dégagent des notes aiguës d’herbes fraîches et des notes plus graves, crémeuses et réconfortantes. La lasagne doit rassasier sans être lourde, être onctueuse mais pas grasse. La recette que nous vous proposons tente d'accomplir tout cela, et même plus. Elle est idéale pour les personnes qui ont une intolérance aux produits laitiers.L’Orient-Le Jourvous présente cette variation autour de la lasagne traditionnelle. Nous l’avons baptiséeVery Veggi Lasagne,car elle est végétalienne, et plus… Pour la crème de noix de cajou : 300 g de noix de cajou 500 ml d’eau bouillante ½ cuillère à café de noix de muscade ½ cuillère à café de poivre blanc 20 ml de vinaigre de pomme 30 g de levure alimentaire (facultatif mais conseillé) Sel Pour la sauce tomate : 7 grosses tomates mûres 10 à 12 gousses d’ail finement hachées 15 g de basilic frais finement haché 60 ml d’huile d’olive ½ cuillère à café de poivre noir Sel Pour la garniture de blettes : 20 feuilles de blette équeutées et découpées en lamelles 10 champignons de taille moyenne finement hachés 1 oignon moyen finement haché 1 cuillère à soupe d’huile d’olive Sel et poivre Pour les couches de lasagne : 7 courgettes de taille moyenne coupées en fines rondelles 1 boîte de lasagnes (prêtes à l’emploi) 15 à 20 tomates cerises coupées en deux dans le sens de la longueur  recette végétarienne plat principal recette vegan cuisine méditerranéenne recette de carême  noix de cajou tomates blettes courgettes lasagnes",
    "source": "olj",
    "raw_category": "plat principal",
    "raw_difficulty": "facile",
    "raw_enrichment_present": true
  },
  {
    "url": "https://www.lorientlejour.com/cuisine-liban-a-table/1293275/le-sare-bourma-daline-kamakian-et-sa-mere-vartouhie.html",
    "title": "Le sare bourma aux noix et à la cannelle d’Aline Kamakian et sa mère Vartouhie",
    "chef_name": "Aline Kamakian, cheffe engagée",
    "cuisine_type": "arménienne",
    "is_lebanese": false,
    "is_recipe": false,
    "category_canonical": "dessert",
    "difficulty_canonical": "facile",
    "tags": [
      "aline kamakian",
      "recette automne",
      "recette arménienne",
      "dessert",
      "recette végétarienne",
      "arménie",
      "recettes aline kamakian"
    ],
    "main_ingredients": [
      "noix",
      "sucre",
      "cannelle",
      "beurre",
      "farine",
      "œufs",
      "huile de tournesol",
      "sel",
      "eau",
      "eau de fleur d’oranger",
      "eau de rose"
    ],
    "aliases": [],
    "search_text": "Le sare bourma aux noix et à la cannelle d’Aline Kamakian et sa mère Vartouhie Aline Kamakian, cheffe engagée « Ce dessert m’a été transmis par ma mère quand j’étais petite et je ne l’ai pas oublié ! Le sare bourma est une recette très facile à faire. Je m’en souviens aussi parce que j’étais assez difficile et que je ne mangeais que la pâte avec le sirop et la cannelle, et que, de plus, j’étais allergique aux noix… Mais je l’aidais quand elle la préparait, explique Aline Kamakian. C’est une très vieille recette arménienne, elle est faite d’une base de pâte pour baklava, mais plus épaisse. On l’appelle « bourma », qui signifie petit bracelet en turc. Comme il était interdit de parler l’arménien, tous nos plats et ceux que je sers à Mayrig sont en turc. » Pour la farce : 500g de noix moulues 50g de sucre blanc 1 c. à soupe de cannelle moulue 4 c. à soupe de beurre. Pour la pâte feuilletée légère (vous pouvez remplacer la pâte faite maison par une pâte feuilletée prête à l’emploi) : 250g de farine 60 ml d’eau 2 œufs à température ambiante 165 g d’huile de tournesol 1 pincée de sel Pour le sirop : 130g de sucre 240 ml d’eau 1 c. à café d’eau de fleur d’oranger 1 c. à café d’eau de rose  aline kamakian recette automne recette arménienne dessert recette végétarienne arménie recettes aline kamakian  noix sucre cannelle beurre farine œufs huile de tournesol sel eau eau de fleur d’oranger eau de rose",
    "source": "olj",
    "raw_category": "dessert",
    "raw_difficulty": "facile",
    "raw_enrichment_present": true
  },
  {
    "url": "https://www.lorientlejour.com/cuisine-liban-a-table/1484477/le-risotto-au-safran-de-sophie-schoucair-1.html",
    "title": "Le risotto au safran de Sophie Schoucair",
    "chef_name": "Sophie Schoucair, le goût de l'Italie à Beyrouth",
    "cuisine_type": "italienne",
    "is_lebanese": false,
    "is_recipe": true,
    "category_canonical": "plat_principal",
    "difficulty_canonical": "facile",
    "tags": [
      "entrée",
      "plat principal",
      "recette végétarienne",
      "recette rapide et facile"
    ],
    "main_ingredients": [
      "riz arborio",
      "bouillon de légumes",
      "oignon",
      "huile d'olive",
      "vin blanc",
      "safran",
      "parmesan",
      "beurre"
    ],
    "aliases": [],
    "search_text": "Le risotto au safran de Sophie Schoucair Sophie Schoucair, le goût de l'Italie à Beyrouth « J’ai choisi le risotto, car il peut être servi en plat principal ou accompagner un osso buco. Et c’est surtout un plat que j’affectionne particulièrement. » 250 g de riz arborio 1,5 litre de bouillon de légumes 1 oignon 2 c. à soupe d’huile d’olive 10 cl de vin blanc 5 g de pistils de safran 80 g de parmesan 80 g de beurre Sel et poivre Hacher un oignon finement. Faire bouillir le bouillon (du bouillon fait maison ou un bouillon fait avec un cube de bouillon de légumes) et y ajouter le safran. Faire suer l’oignon, sans coloration, dans un peu d’huile. Ajouter le riz et bien mélanger. Au bout de 3 minutes, mouiller avec le vin blanc et laisser l’alcool s’évaporer. Ajouter petit à petit le bouillon chaud sur le riz et mélanger. Surveiller constamment la cuisson du risotto. Au bout de 18 minutes, goûter et rectifier l’assaisonnement avec du sel et du poivre. Le risotto doit être al dente. La cuisson prendre environ 20 minutes. Hors du feu, ajouter le beurre bien froid et le parmesan. Mélanger et goûter une dernière fois. entrée plat principal recette végétarienne recette rapide et facile  riz arborio bouillon de légumes oignon huile d'olive vin blanc safran parmesan beurre",
    "source": "olj",
    "raw_category": "plat principal",
    "raw_difficulty": "facile",
    "raw_enrichment_present": true
  },
  {
    "url": "https://www.lorientlejour.com/cuisine-liban-a-table/1349771/la-kebbe-a-travers-les-generations.html",
    "title": "La kebbe a travers les generations.html",
    "chef_name": null,
    "cuisine_type": null,
    "is_lebanese": false,
    "is_recipe": false,
    "category_canonical": "autre",
    "difficulty_canonical": "non_specifie",
    "tags": [],
    "main_ingredients": [],
    "aliases": [],
    "search_text": "La kebbe a travers les generations.html",
    "source": "olj",
    "raw_category": null,
    "raw_difficulty": null,
    "raw_enrichment_present": true
  },
  {
    "url": "https://www.lorientlejour.com/cuisine-liban-a-table/1463969/les-cailles-a-la-melasse-de-grenade-de-karim-haidar-et-de-sa-mere.html",
    "title": "Les cailles à la mélasse de grenade de Karim Haïdar (et de sa mère)",
    "chef_name": "Karim Haïdar, chef tous azimuts",
    "cuisine_type": "libanaise",
    "is_lebanese": true,
    "is_recipe": true,
    "category_canonical": "plat_principal",
    "difficulty_canonical": "facile",
    "tags": [
      "diaspora libanaise",
      "recette libanaise",
      "cuisine méditerranéenne",
      "recette",
      "plat principal",
      "cuisine"
    ],
    "main_ingredients": [
      "cailles",
      "oignons grelots",
      "boulghour",
      "mélasse de grenade",
      "vermicelles"
    ],
    "aliases": [],
    "search_text": "Les cailles à la mélasse de grenade de Karim Haïdar (et de sa mère) Karim Haïdar, chef tous azimuts « Cette recette était un des plats favoris de ma mère. Nous adorions tous deux dépiauter les cailles à la mélasse de grenade », dit Karim Haïdar, qui a publié, avec Andrée Maalouf,La cuisine libanaise de Beyrouth à Parisaux éditions Albin-Michel, avec une préface d’Amin Maalouf. 8 cailles 16 oignons grelots 2 cébettes 20 gr de zaatar (pas le mélange) 2 c. à s d’huile végétale 6 cl de mélasse de grenade 6 cl de vin blanc Sel et poivre noir du moulin 1/2 grenade aigre égrenée 300 gr de boulghour gros brun 100 gr de vermicelles 1 c. à s. de 7 épices 5 cl d’huile végétale Sel. Dans une cocotte, faire dorer les cailles dans l’huile, saler et poivrer. Rajouter les oignons grelots, laisser revenir encore 3 minutes. Mouiller de 10 cl d’eau. Couvrir et cuire 10 minutes. Découvrir, rajouter le vin blanc, le zaatar et la mélasse de grenade mélangés. Bien en napper les cailles. Cuire suivant votre goût, 5 minutes pour moi ou 12 minutes, comme le conseille ma mère ! Rajouter les cébettes hachées et les graines de grenade et servir. Pendant ce temps, faire revenir les vermicelles dans l’huile jusqu’à ce qu’ils soient brun foncé. Rajouter le boulghour, bien mélanger. Couvrir de 60 cl d’eau. Rajouter sel et épices. Porter à ébullition. Couvrir et cuire à feu doux jusqu’à absorption de l’eau (8-10 minutes) diaspora libanaise recette libanaise cuisine méditerranéenne recette plat principal cuisine  cailles oignons grelots boulghour mélasse de grenade vermicelles",
    "source": "olj",
    "raw_category": "plat principal",
    "raw_difficulty": "facile",
    "raw_enrichment_present": true
  },
  {
    "url": "https://www.lorientlejour.com/cuisine-liban-a-table/1463967/les-choux-de-bruxelles-aux-raisins-figues-et-noix-de-philippe-massoud.html",
    "title": "Les choux de Bruxelles aux raisins, figues et noix, de Philippe Massoud",
    "chef_name": "Philippe Massoud, une passion libanaise",
    "cuisine_type": "libanaise",
    "is_lebanese": true,
    "is_recipe": false,
    "category_canonical": "plat_principal",
    "difficulty_canonical": "facile",
    "tags": [
      "plat principal",
      "diaspora libanaise",
      "recette végétarienne",
      "recette",
      "cuisine"
    ],
    "main_ingredients": [
      "choux de Bruxelles",
      "yaourt",
      "figue",
      "noix",
      "raisins"
    ],
    "aliases": [],
    "search_text": "Les choux de Bruxelles aux raisins, figues et noix, de Philippe Massoud Philippe Massoud, une passion libanaise « Le chou de Bruxelles est l’un de nos plats les plus appréciés et il a conquis un public de passionnés. Nous sommes heureux de partager cette recette avec les lecteurs deL’Orient-Le Jourafin de leur faire connaître notre cuisine libanaise », explique Philippe Massoud. 500 grammes de choux de Bruxelles 1 c. à s. de menthe fraîche ciselée 1 tasse de yaourt nature 3/4 c. à c. de sel 1/2 tasse de confiture de figue libanaise 1/4 tasse d’eau 1/2 tasse de noix grillées concassées 1/2 tasse de raisins verts ou rouges sans pépins, coupés en deux 4 c. à s. de vinaigre de xérès – ou plus selon le goût 1,25 c. à c. de sel  plat principal diaspora libanaise recette végétarienne recette cuisine  choux de Bruxelles yaourt figue noix raisins",
    "source": "olj",
    "raw_category": "plat principal",
    "raw_difficulty": "facile",
    "raw_enrichment_present": true
  },
  {
    "url": "https://www.lorientlejour.com/cuisine-liban-a-table/1468724/frike-au-poulet-frike-bi-djej.html",
    "title": "Frike au poulet frike bi djej.html",
    "chef_name": null,
    "cuisine_type": null,
    "is_lebanese": false,
    "is_recipe": false,
    "category_canonical": "autre",
    "difficulty_canonical": "non_specifie",
    "tags": [],
    "main_ingredients": [],
    "aliases": [],
    "search_text": "Frike au poulet frike bi djej.html",
    "source": "olj",
    "raw_category": null,
    "raw_difficulty": null,
    "raw_enrichment_present": true
  },
  {
    "url": "https://www.lorientlejour.com/cuisine-liban-a-table/1462482/le-chocolate-birthday-cake-de-raja-farah-1.html",
    "title": "Le gâteau d'anniversaire au chocolat de Raja Farah",
    "chef_name": "Raja Farah, pâtissier passionné",
    "cuisine_type": "méditerranéenne",
    "is_lebanese": false,
    "is_recipe": true,
    "category_canonical": "dessert",
    "difficulty_canonical": "facile",
    "tags": [
      "recette",
      "cuisine",
      "chocolat"
    ],
    "main_ingredients": [
      "farine",
      "sucre",
      "cacao",
      "lait",
      "œufs",
      "beurre"
    ],
    "aliases": [],
    "search_text": "Le gâteau d'anniversaire au chocolat de Raja Farah Raja Farah, pâtissier passionné  190 g de farine 250 g de sucre 80 g de poudre de cacao 1 c. à café de baking powder 1 c. à café de sel 240 ml de lait 160 ml d’eau avec 3 c. à café de café 120 ml d’huile végétale 2 œufs 1 c. à café d’extrait de vanille (facultatif). 250 g de beurre (à température ambiante) 90 g de sucre glace 45 g de poudre de cacao 60 ml d’eau chaude 60 ml de crème entière 1 c. à café d’extrait de vanille (facultatif) 1 c. à café de sel 150 g de chocolat noir fondu.  recette cuisine chocolat  farine sucre cacao lait œufs beurre",
    "source": "olj",
    "raw_category": "dessert",
    "raw_difficulty": "facile",
    "raw_enrichment_present": true
  },
  {
    "url": "https://www.lorientlejour.com/cuisine-liban-a-table/1462499/le-chou-fleur-roti-sauce-tahine-a-lorange-de-tara-khattar.html",
    "title": "Le chou-fleur rôti sauce tahiné à l’orange de Tara Khattar",
    "chef_name": "Tara Khattar, cheffe et ambitieuse entrepreneuse",
    "cuisine_type": "libanaise",
    "is_lebanese": true,
    "is_recipe": false,
    "category_canonical": "mezze_froid",
    "difficulty_canonical": "facile",
    "tags": [
      "tara khattar",
      "recettes tara khattar",
      "cuisine méditerranéenne",
      "plat principal",
      "recette",
      "recette végétarienne",
      "cuisine",
      "cuisine du moyen-orient"
    ],
    "main_ingredients": [
      "chou-fleur",
      "tahiné",
      "yaourt",
      "huile d’olive",
      "mélasse de grenade",
      "oranges",
      "citrons",
      "grenade",
      "herbes",
      "thym",
      "sésame"
    ],
    "aliases": [],
    "search_text": "Le chou-fleur rôti sauce tahiné à l’orange de Tara Khattar Tara Khattar, cheffe et ambitieuse entrepreneuse  1 gros chou-fleur 1/2 tasse de tahiné 1 tasse de yaourt 3 c. à soupe d’huile d’olive 1 c. à café de mélasse de grenade 2 oranges 2 citrons 1 c. à soupe de grenade fraîche Herbes diverses (ciboulette, menthe, coriandre, aneth, persil) Thym (zaatar) en poudre Sésame noir et blanc Fleurs comestibles (optionnel)  tara khattar recettes tara khattar cuisine méditerranéenne plat principal recette recette végétarienne cuisine cuisine du moyen-orient  chou-fleur tahiné yaourt huile d’olive mélasse de grenade oranges citrons grenade herbes thym sésame",
    "source": "olj",
    "raw_category": "mezze",
    "raw_difficulty": "facile",
    "raw_enrichment_present": true
  },
  {
    "url": "https://www.lorientlejour.com/cuisine-liban-a-table/1453736/gateau-au-chocolat-a-la-melasse-de-caroube-une-douce-fin-heureuse.html",
    "title": "Gâteau au chocolat et à la mélasse de caroube",
    "chef_name": "Jaimee Lee Haddad, cheffe amateure",
    "cuisine_type": "libanaise",
    "is_lebanese": true,
    "is_recipe": true,
    "category_canonical": "dessert",
    "difficulty_canonical": "facile",
    "tags": [
      "cuisine méditerranéenne",
      "recette végétarienne",
      "cuisine du moyen-orient",
      "recette vegan",
      "recette de carême",
      "dessert",
      "chocolat"
    ],
    "main_ingredients": [
      "farine",
      "cacao",
      "mélasse de caroube",
      "huile",
      "eau",
      "café instantané"
    ],
    "aliases": [],
    "search_text": "Gâteau au chocolat et à la mélasse de caroube Jaimee Lee Haddad, cheffe amateure Ce dessert allie le meilleur de deux mondes : d’abord le gâteau au chocolat décadent à l’américaine et la fameuse mélasse de caroube, si populaire dans les foyers orientaux, pour créer une recette unique. Ce gâteau est aussi inspiré de deux des plus anciennes cultures domestiquées de Mésopotamie, le sésame et les graines de lin, ainsi que l’arbre de caroube, que les familles au Liban transforment en mélasse depuis des siècles. 250 g de farine tout usage 80 g de poudre de cacao 1/2 c. à café de sel 1 c. à café de levure chimique 1 c. à soupe de bicarbonate de soude 100 g de sucre 1 c. à soupe de graines de lin 230 ml de mélasse de caroube (debs el-kharroub) 230 ml d’huile 450 ml d’eau chaude 2 c. à soupe de café instantané 1 c. à soupe de vinaigre de pomme 100 g de haléwé (facultatif) 125 ml de pâte de tahini à ajouter sur le dessus.  cuisine méditerranéenne recette végétarienne cuisine du moyen-orient recette vegan recette de carême dessert chocolat  farine cacao mélasse de caroube huile eau café instantané",
    "source": "olj",
    "raw_category": "dessert",
    "raw_difficulty": "facile",
    "raw_enrichment_present": true
  },
  {
    "url": "https://www.lorientlejour.com/cuisine-liban-a-table/1469109/kefta-burger.html",
    "title": "Le kefta burger d'Alan Geaam",
    "chef_name": "Alan Geaam, chef étoilé",
    "cuisine_type": "libanaise",
    "is_lebanese": true,
    "is_recipe": false,
    "category_canonical": "plat_principal",
    "difficulty_canonical": "facile",
    "tags": [
      "recette libanaise",
      "recettes alan geaam",
      "cuisine libanaise",
      "plat principal",
      "alan geaam",
      "chef libanais"
    ],
    "main_ingredients": [
      "gigot d'agneau",
      "halloumi",
      "pain buns",
      "tomate",
      "oignon"
    ],
    "aliases": [],
    "search_text": "Le kefta burger d'Alan Geaam Alan Geaam, chef étoilé  Pour la base de viande de kefta : 1,2 kg de gigot d'agneau 6 g de mélange d'épices pour kefta 3 g de cannelle en poudre ½ botte de persil 150 g d'oignons (2 oignons moyens environ) 6 g de sel Pour le montage du burger : 6 pains buns au sésame 360 g de halloumi 3 tomates 3 oignons 18 feuilles de sucrine Pour la sauce : 300 g de mayonnaise 120 g de ketchup 6 g de Tabasco 3 g de sel  recette libanaise recettes alan geaam cuisine libanaise plat principal alan geaam chef libanais  gigot d'agneau halloumi pain buns tomate oignon",
    "source": "olj",
    "raw_category": "plat principal",
    "raw_difficulty": "facile",
    "raw_enrichment_present": true
  },
  {
    "url": "https://www.lorientlejour.com/cuisine-liban-a-table/1440626/a-loccasion-des-fetes-des-cookies-des-couleurs-et-de-la-douceur-en-cette-fin-dannee-sombre.html",
    "title": "Les biscuits, au sucre et aux épices, de Noël",
    "chef_name": "Jaimee Lee Haddad, cheffe amateure",
    "cuisine_type": "méditerranéenne",
    "is_lebanese": false,
    "is_recipe": true,
    "category_canonical": "dessert",
    "difficulty_canonical": "facile",
    "tags": [
      "dessert",
      "recette végétarienne",
      "recette de noel"
    ],
    "main_ingredients": [
      "beurre",
      "sucre",
      "farine",
      "œufs",
      "épices"
    ],
    "aliases": [],
    "search_text": "Les biscuits, au sucre et aux épices, de Noël Jaimee Lee Haddad, cheffe amateure L'Orient-Le Joura voulu, à sa manière, donner un sens à cette année particulièrement difficile et offrir un peu de douceur. Trois jours avant Noël, l’occasion était idéale de clore cette annus horribilis dans la joie et la légèreté avec quelques biscuits.Nous avons sélectionné pour vous deux recettes de biscuits aux saveurs différentes customisées à votre guise : gingembre, vanille, anis et cannelle, lavande et miel… Le mode d’emploi est facile, rapide et peu cher. Pour la pâte de biscuits au sucre 250 g de beurre 300 g de sucre blanc 1 c. à s. de sucre vanillé Une pincée de sel 3 œufs 480 g de farine 1 c. à c. pleine de levure chimique 1 c. à. s. de sucre vanillé Une c. à. c. de colorants alimentaires pour obtenir une couleur moyenne Pour le glaçage : Soit un paquet d’un mélange prêt. Soit, si vous préférez le faire vous-même : 2 blancs d’œuf 500 g de sucre en poudre Pour le biscuit au pain d'épices : 360 g de farine 2 c. à s. de cannelle 1 c. à. s. de gingembre ½ c. à c. de noix de muscade ½ c. à c. de sel 100 g de sucre blanc 2 c. à. s. de sucre vanillé ¾ c. à. c. de bicarbonate de soude 200 g de beurre 250 g de mélasse de caroube 1 c. à. s de miel brun (facultatif)  dessert recette végétarienne recette de noel  beurre sucre farine œufs épices",
    "source": "olj",
    "raw_category": "dessert",
    "raw_difficulty": "facile",
    "raw_enrichment_present": true
  },
  {
    "url": "https://www.lorientlejour.com/cuisine-liban-a-table/1367918/le-mafe-de-poulet-de-hady-sy.html",
    "title": "Le « mafé » de poulet de Hady Sy",
    "chef_name": "Hady Sy, chef d'un jour",
    "cuisine_type": "sénégalaise",
    "is_lebanese": false,
    "is_recipe": false,
    "category_canonical": "plat_principal",
    "difficulty_canonical": "non_specifie",
    "tags": [
      "recette",
      "cuisine",
      "plat principal",
      "sénégal"
    ],
    "main_ingredients": [
      "poulet",
      "pommes de terre",
      "carottes",
      "patates douces",
      "chou",
      "oignons",
      "ail",
      "piments",
      "tomates",
      "beurre d'arachide"
    ],
    "aliases": [],
    "search_text": "Le « mafé » de poulet de Hady Sy Hady Sy, chef d'un jour Un verre de vin blanc à la main, des Converse rouges aux (grands) pieds, une serviette en guise de tablier, Hady Sy, enfant terrible de l’art, se transforme en chef organisé qui prépare, étape par étape, le mafé, plat traditionnel sénégalais, devant des témoins enivrés par des couches de parfums relevés, puis de saveurs, qui ressemblent à une invitation au voyage. « C’est un des premiers plats que l’on m’a appris à cuisiner. Je suis heureux de pouvoir partager et faire connaître une recette du Sénégal, vu que je suis à moitié sénégalais », dit-il.Chez lui, dans cette ancienne maison « à caractère traditionnel », dans le cœur de Beyrouth, les parfums d’un autre monde se mêlent à ses œuvres accrochées aux murs ou posées dans le salon. Des œuvres qui décrivent et rappellent son parcours artistique, deIn God We TrustàWall of Hope, en passant parNot for saleetOne Blood. Avec, en exclusivité, sa prochaine exposition discrètement dévoilée aux amis. Pour le poulet : 3 pommes de terre coupées en deux 3 carottes coupées en deux 2 patates douces coupées en trois 1 chou coupé en six et bouilli dans de l'eau 2 oignons moyens coupés en lamelles 3 gousses d'ail écrasées à la lame du couteau et finement hachées 2 piments oiseau non coupés 1 à 2 piments antillais non coupés et non écrasés 400 g de tomates pelées bio 1 c. à c. de concentré de tomate 3 c. à s. d'huile végétale 1 c. à c. de nuoc mam 1 c. à c. d'huile de palme 1 morceau de 1 cm de gingembre 200 g de beurre d'arachide bio 600 g de blancs de poulet coupés en gros cubes, marinés la veille dans du gingembre, de l'ail et du poivre noir du moulin 1 l d'eau bouillante. Pour le riz : 1,5 verre de riz à long grain (basmati, jasmin, riz blanc…) 3 verres d'eau Une pincée de sel 1 c. à c. d'huile d'olive.  recette cuisine plat principal sénégal  poulet pommes de terre carottes patates douces chou oignons ail piments tomates beurre d'arachide",
    "source": "olj",
    "raw_category": "plat principal",
    "raw_difficulty": "non spécifié",
    "raw_enrichment_present": true
  },
  {
    "url": "https://www.lorientlejour.com/cuisine-liban-a-table/1469108/sfouf.html",
    "title": "Le sfouf d'Alan Geaam",
    "chef_name": "Alan Geaam, chef étoilé",
    "cuisine_type": "libanaise",
    "is_lebanese": true,
    "is_recipe": true,
    "category_canonical": "dessert",
    "difficulty_canonical": "facile",
    "tags": [
      "recette libanaise",
      "recettes alan geaam",
      "alan geaam",
      "recette végétarienne",
      "cuisine libanaise",
      "chef libanais",
      "dessert"
    ],
    "main_ingredients": [
      "farine",
      "semoule de blé",
      "lait",
      "sucre",
      "curcuma"
    ],
    "aliases": [],
    "search_text": "Le sfouf d'Alan Geaam Alan Geaam, chef étoilé  135 g de farine 5 g de levure chimique 200 g de semoule de blé 150 ml d'huile de tournesol 15 g de curcuma 190 g de sucre 10 g d'anis en poudre 250 ml de lait 25 g de tahini 30 g de pignons de pin Préchauffer le four à 200 °C. Dans un saladier, mélanger tous les ingrédients dans l'ordre suivant : farine, levure, semoule, huile, curcuma, sucre, anis, lait. Mélanger jusqu'à l'obtention d'une pâte homogène. Badigeonner le fond et les bords d'un moule carré avec le tahini. Y verser la pâte et lisser la surface du gâteau. Saupoudrer de pignons de pin. Enfourner et faire cuire le sfouf 20 à 25 min, jusqu'à ce qu'il devienne bien doré. recette libanaise recettes alan geaam alan geaam recette végétarienne cuisine libanaise chef libanais dessert  farine semoule de blé lait sucre curcuma",
    "source": "olj",
    "raw_category": "dessert",
    "raw_difficulty": "facile",
    "raw_enrichment_present": true
  },
  {
    "url": "https://www.lorientlejour.com/cuisine-liban-a-table/1245038/la-buche-tout-chocolat-de-karine-zablit.html",
    "title": "La bûche « tout chocolat » de Karine Zablit",
    "chef_name": "Karine Zablit, entre culture occidentale et héritage levantin",
    "cuisine_type": "occidentale",
    "is_lebanese": false,
    "is_recipe": false,
    "category_canonical": "dessert",
    "difficulty_canonical": "facile",
    "tags": [
      "recette de noel",
      "dessert",
      "chocolat"
    ],
    "main_ingredients": [
      "œufs",
      "sucre",
      "farine",
      "cacao",
      "chocolat noir",
      "crème",
      "noisettes"
    ],
    "aliases": [],
    "search_text": "La bûche « tout chocolat » de Karine Zablit Karine Zablit, entre culture occidentale et héritage levantin « Cette année, Noël a un drôle de goût. Le cœur n’est pas du tout aux festivités, la crise économique est très dure, nous ne nous sommes toujours pas remis de la double explosion du 4 août 2020 au port de Beyrouth et la situation sanitaire, avec le Covid, vient couronner le tout. Mais je me réjouis de retrouver mes enfants, étudiants à l’étranger, pour les vacances. C’est mon plus grand bonheur et c’est ce qui me motive pour décorer le sapin, les accueillir dans une ambiance un minimum festive et essayer de retrouver un peu de la magie de Noël des années précédentes. Toujours dans cette quête de petits bonheurs que nous avons envie d’apporter à nos familles pour les fêtes de Noël, je propose à celles et ceux qui souhaiteraient préparer leur bûche à la maison une recette simplissime mais très gourmande : une bûche tout chocolat composée d’un biscuit viennois bien moelleux et léger au cacao, d’une ganache au chocolat noir et, pour apporter un peu de croquant, d’éclats de noisettes torréfiées. Joyeuses fêtes à tous, en espérant des jours meilleurs. » Pour le biscuit viennois au cacao : 4 œufs 75 g de sucre 25 g de farine 25 g de cacao non sucré. Pour la ganache au chocolat noir : 250 g de chocolat noir 325 de crème 75 g de noisettes  recette de noel dessert chocolat  œufs sucre farine cacao chocolat noir crème noisettes",
    "source": "olj",
    "raw_category": "dessert",
    "raw_difficulty": "facile",
    "raw_enrichment_present": true
  },
  {
    "url": "https://www.lorientlejour.com/cuisine-liban-a-table/1474401/le-chawarma-de-poulet-de-john-achkar-et-de-sa-teta-.html",
    "title": "Le chawarma de poulet de John Achkar (et de sa téta)",
    "chef_name": "John Achkar, chef d'un jour",
    "cuisine_type": "libanaise",
    "is_lebanese": true,
    "is_recipe": true,
    "category_canonical": "plat_principal",
    "difficulty_canonical": "facile",
    "tags": [
      "recette libanaise",
      "plat principal",
      "cuisine méditerranéenne"
    ],
    "main_ingredients": [
      "poulet",
      "tahini",
      "laban",
      "épices",
      "pain arabe"
    ],
    "aliases": [
      "chawarma"
    ],
    "search_text": "Le chawarma de poulet de John Achkar (et de sa téta) John Achkar, chef d'un jour Lorsqu’il débarque dans la cuisine les bras chargés de sacs remplis d’ingrédients, qu’il les sort un à un avec un grand sourire, John Achkar ressemble à un grand enfant fin prêt à passer un examen. « Ma femme Katia a mis tout ce qu’il faut. Enfin, je crois… » Puis il dispose les épices dans des bols, le blanc de poulet sur une assiette, et pose son yaourt à portée de main. Muni de gants, d’un tablier de pro, le voilà lancé dans cette nouvelle aventure, pas totalement sûr de lui, cherchant à chaque instant l’approbation d’un public improvisé. Et lorsqu’on lui demande depuis quand il cuisine, il répond : « Depuis une demi-heure ! » Puis il confie, avec une certaine fierté, que toute sa famille est prévenue et guette secrètement les résultats. Pour son baptême des fourneaux, il a choisi le chawarma de sa grand-mère. « Facile, et presque déjà fait, puisqu’elle avait préparé la marinade la veille ! »Même si le plat est réussi, alors qu’il a oublié certains ingrédients rajoutés à la dernière minute et changé certains dosages, John Achkar derrière les fourneaux, c’est un peu beaucoup John Achkar sur scène : naturel, drôle et touchant. Délicieux en sommet. 700 g de blancs ou de cuisses de poulet (émincés en très petits morceaux). Pour la marinade 1 tasse moyenne de tahini 3 cuillère à soupe de laban (ou de yaourt) Un bocal de cornichons locaux ½ cuillère à café de sept épices ½ c. à c. de cardamome moulue ½ c. à c. de sel ½ c. à c. de poivre blanc moulu 1 c. à s. d’épices pour chawarma Le jus d’un citron Le jus d’une orange 1 petite tasse de vin blanc 1 petite tasse de vinaigre blanc Un sac de pain arabe de taille moyenne 1 petite boîte de crème d’ail (toum) déjà prête.  recette libanaise plat principal cuisine méditerranéenne chawarma poulet tahini laban épices pain arabe",
    "source": "olj",
    "raw_category": "plat principal",
    "raw_difficulty": "facile",
    "raw_enrichment_present": true
  },
  {
    "url": "https://www.lorientlejour.com/cuisine-liban-a-table/1233924/le-carpaccio-de-courgettes-grillees-gratine-au-comte-et-pistou-de-youssef-akiki.html",
    "title": "Le carpaccio de courgettes grillées, gratiné au Comté et pistou de Youssef Akiki",
    "chef_name": "Youssef Akiki, chef aux multiples projets",
    "cuisine_type": "méditerranéenne",
    "is_lebanese": false,
    "is_recipe": true,
    "category_canonical": "entree",
    "difficulty_canonical": "facile",
    "tags": [
      "recette",
      "recettes youssef akiki",
      "cuisine méditerranéenne",
      "recette libanaise",
      "entrée",
      "recette végétarienne",
      "youssef akiki"
    ],
    "main_ingredients": [
      "courgettes",
      "Comté",
      "huile d'olive",
      "ail",
      "herbes sauvages"
    ],
    "aliases": [],
    "search_text": "Le carpaccio de courgettes grillées, gratiné au Comté et pistou de Youssef Akiki Youssef Akiki, chef aux multiples projets Ce que dit le chef Akiki : « On pourrait penser que la courgette est un légume est simple et sans saveur. Et pourtant, on peut la réinventer dans de nombreux plats libanais, la consommer crue ou cuite, l’utiliser dans des soupes, la jeter dans une frittata ou remplacer les pâtes avec. On peut même la manger bouillie, tout simplement en salade avec un peu d’huile et de citron. La courgette est un légume sain, elle ne contient presque pas de calories mais est riche en vitamines : du cuivre, de la vitamine C et B2, du magnésium, des fibres, du calcium. » Pour le pistou d'herbes sauvages 1 gousse d’ail 150 g d’huile d’olive 2 g de sel 2 g de poivre 10 g de roquette sauvage 10 g de basilic 1 feuille de radis 10 g de persil 10 g de moutarde de Dijon 4 fleurs de courgettes. Pour le carpaccio de courgettes grillées, gratiné au Comté ou au Gouda local 800 g de petites courgettes 4 fleurs de courgettes 400 g de Comté ou de Gouda local 100 g de mimolette 50 g d’huile d’olive 2 radis 4 g d’herbes sauvages. Lavez les légumes. Mixez tous les ingrédients dans un blender. recette recettes youssef akiki cuisine méditerranéenne recette libanaise entrée recette végétarienne youssef akiki  courgettes Comté huile d'olive ail herbes sauvages",
    "source": "olj",
    "raw_category": "entrée",
    "raw_difficulty": "facile",
    "raw_enrichment_present": true
  },
  {
    "url": "https://www.lorientlejour.com/cuisine-liban-a-table/1245886/la-torche-aux-marrons-et-oranges-de-farid-chehab-et-nicole-razzouk.html",
    "title": "La torche aux marrons et oranges de Farid Chehab et Nicole Razzouk",
    "chef_name": "Farid Chehab, chef entrepreneur",
    "cuisine_type": "méditerranéenne",
    "is_lebanese": false,
    "is_recipe": true,
    "category_canonical": "dessert",
    "difficulty_canonical": "facile",
    "tags": [
      "dessert",
      "chef libanais",
      "recette de noel"
    ],
    "main_ingredients": [
      "crème fraîche",
      "sucre",
      "crème de marrons",
      "pâte de marrons",
      "zestes d’orange",
      "sirop d’orange confite",
      "liqueur d’orange",
      "blanc d’œuf",
      "sucre semoule",
      "sucre glace"
    ],
    "aliases": [],
    "search_text": "La torche aux marrons et oranges de Farid Chehab et Nicole Razzouk Farid Chehab, chef entrepreneur « Noël revêt une signification particulière pour nous, soulignent en chœur Farid Chehab et Nicole Razzouk (Vanille). C’est une période de réunions, familiales essentiellement, baignées de chaleur humaine. Une célébration de l’amour sincère. C’est dans cette optique que nous avons décidé de collaborer afin de vous offrir cette recette toute en partage. »Sous le label Vanille, Nicole Razzouk propose depuis août 2002 ses pâtisseries, ses glaces et ses sorbets à partir de produits de première qualité qui sont disponibles en grande surface.« Octobre 2019, la crise s’installe, Noël passé, on y croyait encore, confie Nicole Razzouk. Début 2020 : le Covid-19 fait des ravages, la crise financière se fait de plus en plus ressentir, puis le 4 août explose nos vies et nos attentes. Beyrouth est dévastée, nos âmes aussi. Travaillant en ce moment avec le chef Farid Chehab afin d’élargir ma gamme de produits dérivés, et ce pour faire face à la conjoncture actuelle, cette collaboration s’est faite aussi dans la préparation de ce dessert qui lui tient à cœur : la torche aux marrons. Un choix d’autant plus justifié pour des raisons économiques, le mont-blanc étant hors de la portée des budgets de la majorité des Libanais cette année. De cette collaboration sont nées des saveurs inédites pour ce type de produit : l’orange (fruit de saison abordable) sous plusieurs déclinaisons, mariée à l’indispensable marron pour l’aboutissement de ce dessert savoureux. » Pour l’appareil à marron : 200 g crème fraîche 100 g sucre en poudre 400 g crème de marrons 200 g pâte de marrons Zestes d’orange (selon goût) 20 g sirop d’orange confite 20 g liqueur d’orange Pour l’appareil à vermicelles : 170 g appareil à marron 270 g pâte de marron Pour la meringue : 300 g blanc d’œuf 300 g sucre semoule 300 g sucre glace  dessert chef libanais recette de noel  crème fraîche sucre crème de marrons pâte de marrons zestes d’orange sirop d’orange confite liqueur d’orange blanc d’œuf sucre semoule sucre glace",
    "source": "olj",
    "raw_category": "dessert",
    "raw_difficulty": "facile",
    "raw_enrichment_present": true
  },
  {
    "url": "https://www.lorientlejour.com/cuisine-liban-a-table/1484495/la-mousse-au-chocolat-de-karine-zablit-onctueuse-et-reconfortante-1.html",
    "title": "La mousse au chocolat de Karine Zablit, onctueuse et réconfortante",
    "chef_name": "Karine Zablit, entre culture occidentale et héritage levantin",
    "cuisine_type": "occidentale",
    "is_lebanese": false,
    "is_recipe": true,
    "category_canonical": "dessert",
    "difficulty_canonical": "facile",
    "tags": [
      "chocolat",
      "dessert",
      "recette rapide et facile"
    ],
    "main_ingredients": [
      "chocolat noir",
      "lait",
      "beurre",
      "sucre",
      "œufs"
    ],
    "aliases": [],
    "search_text": "La mousse au chocolat de Karine Zablit, onctueuse et réconfortante Karine Zablit, entre culture occidentale et héritage levantin « Ma recette de mousse au chocolat, onctueuse et réconfortante, est réalisée à partir d’ingrédients basiques et simples à trouver. Elle ne contient pas de crème, mais un petit peu de beurre qui apporte cette onctuosité. Pour lui donner du volume, de la légèreté et de la tenue, je fouette longuement au bain-marie les jaunes d’œufs et un peu de sucre. Les blancs sont montés en neige avec un petit peu de sucre pour les serrer », explique Karine Zablit. 170 g de chocolat noir 80 g de lait 30 g de beurre 30 g de sucre (20 g pour les jaunes et 10 g pour les blancs) 4 œufs bien frais Concasser le chocolat et le mettre dans un bol. Faire bouillir le lait et le verser sur le chocolat. Remuer à la spatule jusqu’à obtention d’un mélange bien lisse. Ajouter le beurre et mélanger. Séparer les jaunes des blancs d’œufs. Fouetter les jaunes avec 20 g de sucre dans un bol posé sur une casserole d’eau frémissante (bain-marie) jusqu’à ce que le mélange blanchisse et double de volume (5 à 6 minutes). Incorporer aux jaunes d'oeufs le mélange chocolat-lait-beurre à l’aide de la spatule. Laver les fouets du batteur et monter les blancs en neige avec 10 g de sucre. Incorporer délicatement à la spatule les blancs en neige au mélange. Verser la mousse dans un bol et réfrigérer au minimum 3 heures avant de déguster. chocolat dessert recette rapide et facile  chocolat noir lait beurre sucre œufs",
    "source": "olj",
    "raw_category": "dessert",
    "raw_difficulty": "facile",
    "raw_enrichment_present": true
  },
  {
    "url": "https://www.lorientlejour.com/cuisine-liban-a-table/1468859/soupe-de-lentilles-au-citron-adas-bi-hamoud.html",
    "title": "Adas bi Hamoud (Soupe de lentilles au citron) de Tara Khattar",
    "chef_name": "Tara Khattar, cheffe et ambitieuse entrepreneuse",
    "cuisine_type": "libanaise",
    "is_lebanese": true,
    "is_recipe": false,
    "category_canonical": "soupe",
    "difficulty_canonical": "facile",
    "tags": [
      "recette libanaise",
      "recettes tara khattar",
      "tara khattar",
      "recette végétarienne",
      "chef libanais",
      "recette vegan",
      "plat principal",
      "cuisine libanaise"
    ],
    "main_ingredients": [
      "lentilles",
      "pommes de terre",
      "carottes",
      "blettes",
      "citrons",
      "oignon",
      "coriandre",
      "huile d'olive",
      "ail",
      "sel"
    ],
    "aliases": [],
    "search_text": "Adas bi Hamoud (Soupe de lentilles au citron) de Tara Khattar Tara Khattar, cheffe et ambitieuse entrepreneuse Tara Khattar : « Cette soupe est bien citronnée, parfaite pour une nuit d'hiver ou lorsque l'on sent qu'on va tomber malade. Elle est bonne aussi bien pour nous booster physiquement que pour nous remonter le moral après une journée difficile. C'est un mets incontournable pendant les mois d'hiver. » 300 g de lentilles 2 grosses pommes de terre 3 carottes 1 botte de blettes 3 citrons jaunes 1 oignon 1 botte de coriandre 5 cuil. à soupe d'huile d'olive 3 gousses d'ail Sel  recette libanaise recettes tara khattar tara khattar recette végétarienne chef libanais recette vegan plat principal cuisine libanaise  lentilles pommes de terre carottes blettes citrons oignon coriandre huile d'olive ail sel",
    "source": "olj",
    "raw_category": "soupe",
    "raw_difficulty": "facile",
    "raw_enrichment_present": true
  },
  {
    "url": "https://www.lorientlejour.com/cuisine-liban-a-table/1463814/salade-estivale-sur-son-lit-de-chips-de-chou-kale.html",
    "title": "Salade estivale sur son lit de chips de chou kale.html",
    "chef_name": null,
    "cuisine_type": null,
    "is_lebanese": false,
    "is_recipe": false,
    "category_canonical": "autre",
    "difficulty_canonical": "non_specifie",
    "tags": [],
    "main_ingredients": [],
    "aliases": [],
    "search_text": "Salade estivale sur son lit de chips de chou kale.html",
    "source": "olj",
    "raw_category": null,
    "raw_difficulty": null,
    "raw_enrichment_present": true
  },
  {
    "url": "https://www.lorientlejour.com/cuisine-liban-a-table/1469080/bazella-w-rez-ragout-de-petits-pois-pommes-de-terre-et-carottes.html",
    "title": "Le bazella w rez (Ragoût de petits pois) de Tara Khattar",
    "chef_name": "Tara Khattar, cheffe et ambitieuse entrepreneuse",
    "cuisine_type": "libanaise",
    "is_lebanese": true,
    "is_recipe": false,
    "category_canonical": "plat_principal",
    "difficulty_canonical": "facile",
    "tags": [
      "recette libanaise",
      "recettes tara khattar",
      "tara khattar",
      "cuisine libanaise",
      "chef libanais",
      "plat principal"
    ],
    "main_ingredients": [
      "viande à ragoût",
      "petits pois",
      "pommes de terre",
      "carottes",
      "tomates",
      "oignon",
      "ail",
      "huile d'olive",
      "concentré de tomates",
      "sel",
      "poivre"
    ],
    "aliases": [],
    "search_text": "Le bazella w rez (Ragoût de petits pois) de Tara Khattar Tara Khattar, cheffe et ambitieuse entrepreneuse Tara Khattar : « Ce ragoût de petit pois et de pommes de terre est aussi bon végétarien, tout simplement en retirant la viande. C'est un plat que l'on sert souvent pendant la semaine et que ma mère me préparait régulièrement lorsque je rentrais de l'école. Ce plat est réconfortant, avec une petite touche sucrée, grâce aux petits pois et aux carottes. » 500 g de viande à ragoût (bœuf ou agneau) coupée en cubes 1 kg de petits pois 3 grosses pommes de terre 4 carottes 6 tomates 1/2 oignon 2 gousses d'ail 3 cuil. à soupe d'huile d'olive 1 cuil. à soupe de concentré de tomates 1 cuil. à café de sel, poivre  recette libanaise recettes tara khattar tara khattar cuisine libanaise chef libanais plat principal  viande à ragoût petits pois pommes de terre carottes tomates oignon ail huile d'olive concentré de tomates sel poivre",
    "source": "olj",
    "raw_category": "plat principal",
    "raw_difficulty": "facile",
    "raw_enrichment_present": true
  },
  {
    "url": "https://www.lorientlejour.com/cuisine-liban-a-table/1291068/les-beignets-de-courgettes-et-fenouil-de-walid-mouzannar-alia-et-nicolas-mogabgab.html",
    "title": "Les beignets de courgettes et fenouil de walid mouzannar alia et nicolas mogabgab.html",
    "chef_name": null,
    "cuisine_type": null,
    "is_lebanese": false,
    "is_recipe": false,
    "category_canonical": "autre",
    "difficulty_canonical": "non_specifie",
    "tags": [],
    "main_ingredients": [],
    "aliases": [],
    "search_text": "Les beignets de courgettes et fenouil de walid mouzannar alia et nicolas mogabgab.html",
    "source": "olj",
    "raw_category": null,
    "raw_difficulty": null,
    "raw_enrichment_present": true
  },
  {
    "url": "https://www.lorientlejour.com/cuisine-liban-a-table/1462506/le-tartare-de-thon-rouge-au-gingembre-dalfred-asseily.html",
    "title": "Le tartare de thon rouge au gingembre d’Alfred Asseily",
    "chef_name": "Alfred Asseily, un chef spécialisé dans la cuisine française",
    "cuisine_type": "française",
    "is_lebanese": false,
    "is_recipe": true,
    "category_canonical": "plat_principal",
    "difficulty_canonical": "facile",
    "tags": [
      "recette",
      "entrée",
      "recette végétarienne"
    ],
    "main_ingredients": [
      "thon rouge",
      "parmesan",
      "échalote",
      "ciboulette",
      "persil",
      "gingembre",
      "moutarde de Dijon",
      "citron",
      "huile d'olive"
    ],
    "aliases": [],
    "search_text": "Le tartare de thon rouge au gingembre d’Alfred Asseily Alfred Asseily, un chef spécialisé dans la cuisine française Alfred Asseily : « La recette que je vous propose aujourd’hui, et que vous pouvez également revoir en vidéo dans son intégralité sur ma page Instagram@cookwithfred, est un de nos best-sellers. Une recette simple, rafraîchissante et basse en calories pour l’été : le tartare de thon rouge au gingembre. Bon appétit. » 100 g de thon rouge haché finement au couteau 20 g de parmesan haché Une échalote Une c. à café de ciboulette hachée Une c. à café de persil haché Une demi-c. à café de gingembre râpé Une c. à café de moutarde de Dijon Le jus d’un citron 12 ml d’huile d’olive Sel Poivre Piment Dans un cul de poule, faites dissoudre la moutarde, un peu de sel et un peu de poivre dans le jus de citron puis incorporez l’huile d’olive en émulsionnant. Il faut toujours compter le double d’huile d’olive par rapport à la quantité de citron. Hachez tous les ingrédients et mélangez le tout avec un peu de la sauce réalisée. Assaisonnez à votre goût, rajoutez quelques feuilles de salade ou de roquettes pour garnir. recette entrée recette végétarienne  thon rouge parmesan échalote ciboulette persil gingembre moutarde de Dijon citron huile d'olive",
    "source": "olj",
    "raw_category": "plat principal",
    "raw_difficulty": "facile",
    "raw_enrichment_present": true
  },
  {
    "url": "https://www.lorientlejour.com/cuisine-liban-a-table/1468901/feuilles-de-vigne-farcies-warak-enab.html",
    "title": "Warak enab (Feuilles de vigne farcies) de Tara Khattar",
    "chef_name": "Tara Khattar, cheffe et ambitieuse entrepreneuse",
    "cuisine_type": "libanaise",
    "is_lebanese": true,
    "is_recipe": false,
    "category_canonical": "plat_principal",
    "difficulty_canonical": "moyenne",
    "tags": [
      "recette libanaise",
      "recettes tara khattar",
      "tara khattar",
      "plat principal",
      "chef libanais",
      "cuisine libanaise"
    ],
    "main_ingredients": [
      "feuilles de vigne",
      "riz",
      "viande hachée",
      "côtelettes d'agneau",
      "ail"
    ],
    "aliases": [],
    "search_text": "Warak enab (Feuilles de vigne farcies) de Tara Khattar Tara Khattar, cheffe et ambitieuse entrepreneuse Tara Khattar : « Les feuilles de vigne farcies aux côtelettes d'agneau sont un mets très raffiné et fastueux. Les Libanais le servent lors de fêtes ou bien comme plat principal le dimanche. » 600 g de feuilles de vigne fraîches (ou en bocal, préalablement blanchies dans de l'eau bouillante) 250 g de riz 400 g de viande hachée 12 petites côtelettes d'agneau 5 à 10 gousses d'ail 1/3 cuil. à café de cannelle Sel Poivre noir 50 cl d'eau Le jus de 2 citrons  recette libanaise recettes tara khattar tara khattar plat principal chef libanais cuisine libanaise  feuilles de vigne riz viande hachée côtelettes d'agneau ail",
    "source": "olj",
    "raw_category": "plat principal",
    "raw_difficulty": "moyenne",
    "raw_enrichment_present": true
  },
  {
    "url": "https://www.lorientlejour.com/cuisine-liban-a-table/1463968/le-poulet-citron-zaatar-et-son-bouillon-unique-carla-rebeiz.html",
    "title": "Le poulet citron zaatar (et son bouillon unique), Carla Rebeiz",
    "chef_name": "Carla Rebeiz, de la finance à la cuisine",
    "cuisine_type": "libanaise",
    "is_lebanese": true,
    "is_recipe": true,
    "category_canonical": "plat_principal",
    "difficulty_canonical": "facile",
    "tags": [
      "plat principal",
      "diaspora libanaise",
      "cuisine méditerranéenne",
      "recette"
    ],
    "main_ingredients": [
      "suprêmes de poulet",
      "jus de citron",
      "huile d’olive",
      "zaatar",
      "ail",
      "oignons"
    ],
    "aliases": [],
    "search_text": "Le poulet citron zaatar (et son bouillon unique), Carla Rebeiz Carla Rebeiz, de la finance à la cuisine « Cette recette est une de nos créations et une recette devenue emblématique. Le bouillon est unique, la volaille reste tendre, le plat est léger et savoureux. C’est le plat et le goût dont j’ai toujours rêvé… », explique Carla Rebeiz. 6 suprêmes de poulet 25 cl de jus de citron 10 cl d’huile d’olive 1 c. à s. de zaatar ½ c. à s. de sel Une pincée de poivre 3 gousses d’ail 2 oignons blanc Zeste de citron Préparer la marinade la veille : Peler et hacher les gousses d’ail ; mettre les suprêmes de poulet dans un récipient et les couvrir de jus de citron, d’huile d’olive, de zaatar, de zeste de citron et d’ail ; saler, poivrer et laisser mariner pendant 24 heures au réfrigérateur. Préchauffer le four à 180 degrés Celsius. Émincer l’oignon et le rajouter à la marinade. Enfourner les poulets couverts de papier aluminium pendant 45 minutes. Servir les suprêmes entières ou taillées dans leur jus, accompagnées de riz au vermicelle ou de pomme de terre ail coriandre. plat principal diaspora libanaise cuisine méditerranéenne recette  suprêmes de poulet jus de citron huile d’olive zaatar ail oignons",
    "source": "olj",
    "raw_category": "plat principal",
    "raw_difficulty": "facile",
    "raw_enrichment_present": true
  },
  {
    "url": "https://www.lorientlejour.com/cuisine-liban-a-table/1440159/une-cuvee-fraiche-et-epicee-pour-sublimer-une-langue-de-boeuf-et-sa-creme-de-sesame.html",
    "title": "Langue de bœuf et crème de sésame (accompagnée d'une cuvée fraîche et épicée)",
    "chef_name": "Chadi Hereiz, chef exécutif",
    "cuisine_type": "non spécifié",
    "is_lebanese": false,
    "is_recipe": false,
    "category_canonical": "plat_principal",
    "difficulty_canonical": "non_specifie",
    "tags": [
      "recette",
      "vin",
      "recette libanaise",
      "plat principal",
      "cuisine"
    ],
    "main_ingredients": [
      "langue de bœuf",
      "oignons",
      "poireau",
      "cèleri-branche",
      "orange",
      "crème de sésame",
      "jus de citron"
    ],
    "aliases": [],
    "search_text": "Langue de bœuf et crème de sésame (accompagnée d'une cuvée fraîche et épicée) Chadi Hereiz, chef exécutif LE CHOIX DE CHÂTEAU KSARA :« Avec la langue de bœuf, nous vous proposons la Cuvée du Troisième Millénaire. Un vin rouge dont la saveur accompagne bien cette viande, car elle contient peu de gras. Le Petit Verdot avec son acidité va lui alléger la texture en amenant de la fraîcheur. Le Syrah va participer à augmenter l’effet épices et le Cabernet Franc avec son côté fruits noirs et pruneaux va allonger le goût charnu de l’ingrédient principal. » Pour la langue de bœuf : 1 langue de bœuf (environ 1,6 kg) 3 oignons 100 g de poireau 100 g de cèleri-branche 2 tranches d’orange 3 clous de girofle 2 feuilles de laurier 1 bâton de cannelle Sel et poivre. Pour la sauce de crème de sésame : 100 g de crème de sésame 50 g de jus de citron 100 ml d’eau froide 10 g de persil finement haché 1 gousse d’ail écrasée (optionnelle) Pour le dressage : Une pincée de zeste de citron vert Une c. à. c. de jus de citron Une c. à. c. d’huile d’olive Une pincée d’aneth hachée Une pincée de baies de rose Une pincée de fleur de sel Quelques feuilles de menthe verte.  recette vin recette libanaise plat principal cuisine  langue de bœuf oignons poireau cèleri-branche orange crème de sésame jus de citron",
    "source": "olj",
    "raw_category": "plat principal",
    "raw_difficulty": "non spécifié",
    "raw_enrichment_present": true
  },
  {
    "url": "https://www.lorientlejour.com/cuisine-liban-a-table/1247113/le-poisson-du-noel-armenien-daline-kamakian.html",
    "title": "Le poisson du Noël arménien d’Aline Kamakian",
    "chef_name": "Aline Kamakian, cheffe engagée",
    "cuisine_type": "arménienne",
    "is_lebanese": false,
    "is_recipe": false,
    "category_canonical": "plat_principal",
    "difficulty_canonical": "facile",
    "tags": [
      "aline kamakian",
      "recette végétarienne",
      "plat principal",
      "recette de noel",
      "recettes aline kamakian"
    ],
    "main_ingredients": [
      "mérou",
      "poivrons",
      "coriandre",
      "oignons",
      "citron",
      "laurier",
      "huile d’olive",
      "ail vert",
      "tomates",
      "purée de poivrons",
      "aneth",
      "pignons",
      "zestes de citron",
      "jus de citron",
      "poivre",
      "sel"
    ],
    "aliases": [],
    "search_text": "Le poisson du Noël arménien d’Aline Kamakian Aline Kamakian, cheffe engagée « Chez nous les Arméniens, Noël est célébré le 6 janvier. Cette année, la fête est différente, plus triste et plus lourde. La thaoura, la crise financière, le coronavirus, la double explosion du 4 août et la guerre en Arménie, tous ces événements qui se sont succédé ont été d’énormes chocs, mais aussi, pour moi, d’énormes défis à relever. Un seul objectif me donnait l’énergie de continuer : les collaborateurs dans les bureaux, le restaurant et les cuisines, qu’il n’a pas été question de laisser tomber. J’essaie de trouver des solutions pour conserver tous les acquis, reconstruire tout ce qui a été détruit et continuer d’y croire… J’ai choisi pour ce repas de Noël de partager une recette de poisson. Outre la symbolique du poisson, le Christ et la vie en abondance, ce plat est facile à préparer avec des ingrédients accessibles et pas chers. » 500 à 600 g d’un bon mérou (ou tout autre bon poisson) 2 à 3 petits poivrons 1 poignée de coriandre 2 oignons moyens 1 citron 2 feuilles de laurier 1 verre d’huile d’olive 2 gousses d’ail vert (optionnel) 6 tomates épluchées et découpées en cubes (ou en boîte) 1 c. à soupe de purée de poivrons arméniens 1 tige d’aneth 1 poignée de pignons rôtis (ou amandes) Zestes d’un citron complet 1 jus de citron complet Poivre aromatique timut (ou un poivre de votre choix) Sel  aline kamakian recette végétarienne plat principal recette de noel recettes aline kamakian  mérou poivrons coriandre oignons citron laurier huile d’olive ail vert tomates purée de poivrons aneth pignons zestes de citron jus de citron poivre sel",
    "source": "olj",
    "raw_category": "plat principal",
    "raw_difficulty": "facile",
    "raw_enrichment_present": true
  }
]